Team,Most Games,Most Wins,Highest Win Percentage
FWD,Tang Ethan Pui Lok (8),Chung Yat Long (3),Chung Yat Long (42.9%)
Hong Kong Football Club 1,Cornes Ribadas Carlos (8),Cornes Ribadas Carlos (5),Cornes Ribadas Carlos (62.5%)
Perrier Sergio Tacchini KCC 1,"Lai Matthew Cheuk Nam, Lo Chris Cheuk Hin, Ling To Yu (7)",Lo Chris Cheuk Hin (7),Lo Chris Cheuk Hin (100.0%)
Young Player 1A,"Ho Samuel Ka Hei, To Wai Lok, Lo Chun Yu Kelvin (6)",Ho Samuel Ka Hei (4),Ho Samuel Ka Hei (66.7%)
Young Player 1B,Lam Matthew Shing Fung (7),Lam Matthew Shing Fung (5),Lam Matthew Shing Fung (71.4%)
