Team,Most Games,Most Wins,Highest Win Percentage
Hong Kong Cricket Club D2,"Chiu Ho Fai, Hill Peter (7)",Chiu Ho Fai (5),Chiu Ho Fai (71.4%)
Hong Kong Football Club 2A,Ohri Ashray (8),Low Mark Chun Kit (6),Low Mark Chun Kit (85.7%)
Hong Kong Football Club 2B,"Wong Anson, Ma Tsz Hei (6)","Lee Tin Hang, Ma Tsz Hei (4)",Lee Tin Hang (80.0%)
Kowloon Cricket Club 2,"Chan Linclon Wui Ki, Yuen Tsun Hei, Law Yat Long (6)","Chan Linclon Wui Ki, Yuen Tsun Hei (6)","Chan Linclon Wui Ki, Yuen Tsun Hei (100.0%)"
Young Player 2,"Lau Pak To, Law Pak Ho Cyrus, Wong Sze Yu (6)",Lau Pak To (3),Lau Pak To (50.0%)
