Team,Most Games,Most Wins,Highest Win Percentage
Hong Kong Cricket Club L2,Cheung Tin Yui (7),Cheung Tin Yui (5),Cheung Tin Yui (71.4%)
Hong Kong Football Club L2A,Tang Ching Sum (7),"Tang Ching Sum, Chiu Hau Ching, Tang Ka Ki (5)","Chiu Hau Ching, Tang Ka Ki (100.0%)"
Hong Kong Football Club L2B,"Lee Ka Man Carmen, Wu Renee, Chan Olivia, Wong Chung Ching Karen, Choi Celia Uen Shan (5)","Lee Ka Man Carmen, Chan Olivia, Wong Chung Ching Karen (5)","Lee Ka Man Carmen, Chan Olivia, Wong Chung Ching Karen (100.0%)"
Kowloon Cricket Club L2A,Lee Sum Yuet (8),"Lee Sum Yuet, Wong Suet Ling (5)",Wong Suet Ling (83.3%)
Kowloon Cricket Club L2B,Tung Wing Yan (8),Tung Wing Yan (7),Hau Venus (100.0%)
