Team,Most Games,Most Wins,Highest Win Percentage
Hong Kong Cricket Club L4,Verma Tara (6),Leung Lilian Wai Shan (3),Leung Lilian Wai Shan (60.0%)
Hong Kong Cricket Club Rockettes,Cumming Alison (8),Lam Ka Yin (4),Lam Ka Yin (57.1%)
Hong Kong Football Club JSA,Wong Yi Ching Mia (8),Wong Yi Ching Mia (5),Wong Yi Ching Mia (62.5%)
Hong Kong Football Club L4,Morton Mavis (7),"Le Angelina Elizabeth, Souza Suzanne (2)",Le Angelina Elizabeth (40.0%)
JESSICA L4,Leung Wai Kwan (7),"Choi Angel Chung Yin, Leung Wai Kwan, So Hau Yi (5)","Choi Angel Chung Yin, So Hau Yi (100.0%)"
JESSICA Mochis, (nan), (nan), (nan%)
Kwai Tsing District Squash Club L4,"Tsang Sin Kei Ophelia, Tam Sum Yi (6)",Tsang Sin Kei Ophelia (6),Tsang Sin Kei Ophelia (100.0%)
Squashathon Ladies,"Ho Michelle Pak Wai, Chan Alice Yin Ling (5)",Ho Michelle Pak Wai (4),Ho Michelle Pak Wai (80.0%)
The Squash Club L4,"Chung Tsam Yee, Ngan Joan (7)",Ngan Joan (4),Wong Yeuk Yik (60.0%)
