Team,Rubber 1 Win %,Rubber 2 Win %,Rubber 3 Win %,Rubber 4 Win %,avg_win_perc,Total Rubbers
Kowloon Cricket Club L2,77.77777777777779,77.77777777777779,87.5,100.0,85.76388888888889,31
Hong Kong Football Club L2A,71.42857142857143,85.71428571428571,57.14285714285714,66.66666666666666,70.23809523809524,27
Hong Kong Cricket Club L2A,14.285714285714285,71.42857142857143,85.71428571428571,50.0,55.35714285714286,25
Hong Kong Football Club L2C,25.0,25.0,25.0,50.0,31.25,14
Hong Kong Football Club L2B,33.33333333333333,33.33333333333333,0.0,25.0,22.916666666666664,22
Hong Kong Cricket Club L2B,0.0,25.0,25.0,12.5,15.625,32
