Team,Rubber 1 Win %,Rubber 2 Win %,Rubber 3 Win %,Rubber 4 Win %,Rubber 5 Win %,avg_win_perc,Total Rubbers
Hong Kong Football Club M2C,50.0,75.0,75.0,100.0,100.0,80.0,20
Hong Kong Football Club M2A,40.0,60.0,80.0,100.0,100.0,76.0,25
Old Squash Fellows,100.0,80.0,60.0,40.0,50.0,66.0,24
Hong Kong Cricket Club M2,71.42857142857143,71.42857142857143,57.14285714285714,71.42857142857143,57.14285714285714,65.71428571428571,35
United Services Recreation Club M2,42.857142857142854,85.71428571428571,57.14285714285714,42.857142857142854,71.42857142857143,60.0,35
Hong Kong Football Club M2B,25.0,75.0,75.0,75.0,50.0,60.0,20
Ladies Recreation Club M2,42.857142857142854,57.14285714285714,57.14285714285714,57.14285714285714,28.57142857142857,48.57142857142857,35
Royal Hong Kong Yacht Club M2,60.0,20.0,60.0,20.0,60.0,44.0,25
Titlows Squash Team,0.0,0.0,33.33333333333333,16.666666666666664,16.666666666666664,13.333333333333332,30
