Team,Rubber 1 Win %,Rubber 2 Win %,Rubber 3 Win %,Rubber 4 Win %,avg_win_perc
Hong Kong Football Club L2B,33.33333333333333,-50.0,0.0,66.66666666666667,12.5
JESSICA L2 [withdrawal],0.0,0.0,0.0,0.0,0.0
Kowloon Cricket Club L2B,-16.66666666666667,-33.33333333333334,16.666666666666657,0.0,-8.333333333333343
Hong Kong Cricket Club L2,-50.0,-25.0,8.333333333333329,0.0,-16.666666666666664
Kowloon Cricket Club L2A,100.0,-50.0,-50.0,-100.0,-25.0
Hong Kong Football Club L2A,-16.666666666666657,-50.0,0.0,-50.0,-29.166666666666664
