Order,Player,HKS No.,Ranking,Points,Team
1,Chow Pui Sing,23591,3,24.67,Bravo
2,Wong Brian Chi Fai,23592,19,17.1,Bravo
3,Chan Samuel Kwai Fun,31187,14,18.35,Bravo
4,Lam Sam Sin Cheung,24392,39,14.4,Bravo
5,Tse Siu Ming,12717,0,5.25,Bravo
6,Tang Hung Tim,21903,58,12.0,Bravo
7,Lee Ying Fat,27914,52,13.2,Bravo
8,Li Hon Wah,24299,77,5.0,Bravo
9,Cheng Hok Hing,26269,71,7.8,Bravo
10,Lam Kwok Yiu,24958,0,8.25,Bravo
1,Yip Joe Hung Ping,27991,22,16.8,DS
2,Fong Michael Hok Shing,23518,29,15.8,DS
3,Yip Ben Tat Ming,24298,32,15.55,DS
4,Kwong John Ka Sing,26599,66,9.86,DS
5,Chung Simon Yiu Wing,23516,74,7.25,DS
6,Ho Yiu Kwong,29123,85,3.35,DS
7,Leung Jonathan Man Ho,27275,78,4.71,DS
1,Lau Ho Fung,31843,28,15.94,Friend Club 7
2,Lu Tsz Ho,31809,49,13.5,Friend Club 7
3,Li Ho Hin,31810,43,14.17,Friend Club 7
4,So Wan Kiu,31819,79,4.5,Friend Club 7
5,Hung Pui Ying,31950,76,5.31,Friend Club 7
6,Au Sin Man,32112,80,4.36,Friend Club 7
1,Chan Lok Hin,31035,2,24.83,Global 2
2,Ho Coco Ngai Yin,28369,0,0.0,Global 2
2,Cheung Chi Hei,31223,18,17.17,Global 2
3,Fung Fu Wah,31539,48,13.71,Global 2
4,Ng Chi Ming,29984,59,11.62,Global 2
5,Kwok Wai Lun,31212,70,8.33,Global 2
6,Cheung Fung Yee Ida,27556,55,12.6,Global 2
7,Lee Vanessa Sze Wing,28542,67,9.67,Global 2
9,Cheung Helen Wai Ching,24255,41,14.25,Global 2
10,So Yin Wei Winnie,29105,69,8.67,Global 2
1,Chan Gordon Yiu Cheong,27589,0,16.5,Hong Kong Football Club 14
2,McAlinden Barry,31607,13,18.4,Hong Kong Football Club 14
3,Cheong Gaven Wei Kin,28244,16,17.5,Hong Kong Football Club 14
4,Kok John Yoon Soon,23492,25,16.5,Hong Kong Football Club 14
5,Cheng Anne,31139,36,14.77,Hong Kong Football Club 14
6,Mahendran Devendran,31137,46,13.8,Hong Kong Football Club 14
7,Wright William,32204,45,14.0,Hong Kong Football Club 14
8,Cheung Thomas,31516,65,9.9,Hong Kong Football Club 14
9,So Conrad,7424,0,9.0,Hong Kong Football Club 14
10,Fong Kong Raymond,23694,0,12.75,Hong Kong Football Club 14
11,Simons Paul,32299,61,11.14,Hong Kong Football Club 14
12,Kwan Kay Ho Kelvin,28556,30,15.6,Hong Kong Football Club 14
1,Cheung Kenny Chun Hung,6124,5,22.67,Invader Squash
2,Tang Tanny Yin Choi,24161,12,18.8,Invader Squash
3,Liu Vincent Wing Sang,28127,24,16.5,Invader Squash
4,Ho Kwok Wing,22832,27,16.0,Invader Squash
5,Chan Willie Wai Hung,23991,21,16.8,Invader Squash
6,Poon Kings Kin Sun,19666,40,14.31,Invader Squash
7,Li David Hok Kwan,32193,26,16.29,Invader Squash
8,Au Shing Wai,23013,56,12.46,Invader Squash
9,Ng Wai Kei Ricky,31294,0,0.0,Invader Squash
1,Yeung Kelvin Kei Sum,29222,7,21.75,Kinetic 5
2,Tse Wai Hong,28394,34,15.3,Kinetic 5
3,Yip Chiu Ming,30988,31,15.6,Kinetic 5
4,Hui Prodipto,29872,11,20.0,Kinetic 5
5,Lam Kenneth Shek Yiu,28396,20,17.0,Kinetic 5
6,Leong David Kam Ho,29173,17,17.4,Kinetic 5
7,Ho Kwok Kei,28307,37,14.62,Kinetic 5
8,Luk Ivan Tsun Chee,20488,46,13.8,Kinetic 5
9,Lee Michael Kam Fai,18193,51,13.2,Kinetic 5
10,Ng Henry Wing Heng,32332,64,10.29,Kinetic 5
11,Lai George Pak Hung,28395,0,15.0,Kinetic 5
12,Siu Lai Kwan Vicky,30420,0,0.0,Kinetic 5
1,Wong Michael Wai Leung,19807,1,25.0,Phoenix
2,Wong Kenneth Wai Lun,29129,4,23.0,Phoenix
3,Mak Chee Soon,29131,23,16.75,Phoenix
4,Wong Anthony Yik Cheong,29270,60,11.33,Phoenix
5,Leung Chui Ming Micky,29133,50,13.42,Phoenix
6,Lam Daniel Kwan Yat,22817,57,12.33,Phoenix
7,Lee Dennis,31435,53,12.82,Phoenix
8,Young Kenneth Chun Man,29130,35,15.0,Phoenix
9,Kwan Edward Ching Cheong,29132,0,10.5,Phoenix
1,Chow Ka Lun,30089,54,12.75,PLZ
2,Ching Pak Hin,32198,68,9.4,PLZ
3,Chan Hin Chiu,30090,75,6.75,PLZ
4,Poon Ngan Chi,32550,81,4.29,PLZ
5,Fung Ka Chun,31451,82,4.0,PLZ
6,Ng Terry Yu Hin,31056,82,4.0,PLZ
7,Cheung Hoi Suen,29533,86,1.0,PLZ
1,Lau Chun Kwok,19255,8,21.0,Rovers
2,Chan Freeman Hon Wah,26906,44,14.05,Rovers
3,Kong Kai Ming Kim,19132,63,10.5,Rovers
5,Li Cham Hung Keith,30346,62,11.08,Rovers
6,Lee Tim Ming Tong,25951,72,7.5,Rovers
7,Kam Wing Kun Cedric,10979,84,3.75,Rovers
1,Chan Kin Hung Kit,26668,6,22.33,South Kwai Chung Squash Club 1
2,Chan Ka Long Leo,31679,9,20.65,South Kwai Chung Squash Club 1
3,Leung Michael Yan Por,25671,10,20.08,South Kwai Chung Squash Club 1
4,Chui King Yat,27048,15,17.65,South Kwai Chung Squash Club 1
5,Lai Herbert Chan Wah,27482,38,14.4,South Kwai Chung Squash Club 1
6,Ling Siu Ki Brian,27484,41,14.25,South Kwai Chung Squash Club 1
7,Leung Patrick Pak Chiu,12880,33,15.5,South Kwai Chung Squash Club 1
8,Cheung Chun Lin Raymond,32007,73,7.5,South Kwai Chung Squash Club 1
