Team,Most Games,Most Wins,Highest Win Percentage
Happy Squash 1,Leung Ping Chak (11),Leung Ping Chak (9),Seung Wai Ching (88.9%)
Hong Kong Football Club 3A,Cheng Yu Ching (9),Cheng Yu Ching (9),Cheng Yu Ching (100.0%)
Hong Kong Football Club 3B,"Anthony Nigel, Cassidy Cameron Michael (10)",Cassidy Cameron Michael (7),Cassidy Cameron Michael (70.0%)
Kowloon Cricket Club 3A,Ho Ka On (11),Ho Ka On (6),Lau Hok Yin Anthony (100.0%)
Kowloon Cricket Club 3B,Yip Tsz Ho (11),Liu Tsz Ling (9),Liu Tsz Ling (90.0%)
NEXUS 1,Li Ho Hin (9),Lau Ho Fung (5),Lau Ho Fung (71.4%)
Sha Tin 1,Tang Ethan Pui Lok (9),Tang Ethan Pui Lok (4),Tang Ethan Pui Lok (44.4%)
TNGX,Mak Tsun Hin (13),Hon Michael Tsz San (10),Hon Michael Tsz San (83.3%)
Young Player 3,Wong Sze Yu (8),"Wong Sze Yu, Yeung Tsung Chit Karson, Wai Pak Lam (6)","Yeung Tsung Chit Karson, Wai Pak Lam (85.7%)"
