Team,Rubber 1 Win %,Rubber 2 Win %,Rubber 3 Win %,Rubber 4 Win %,Rubber 5 Win %,avg_win_perc,Total Rubbers
Kowloon Cricket Club L2,66.66666666666666,100.0,55.55555555555556,75.0,0.0,59.44444444444444,35
JESSICA L2,88.88888888888889,55.55555555555556,62.5,33.33333333333333,0.0,48.05555555555556,33
Hong Kong Football Club L2B,50.0,50.0,50.0,75.0,0.0,45.0,16
Hong Kong Football Club L2A,50.0,25.0,25.0,50.0,0.0,30.0,14
Hong Kong Football Club L2C,16.666666666666664,0.0,33.33333333333333,40.0,0.0,18.0,23
Hong Kong Cricket Club L2,10.0,40.0,10.0,20.0,0.0,16.0,40
