Team,Rubber 1 Win %,Rubber 2 Win %,Rubber 3 Win %,Rubber 4 Win %,avg_win_perc,Total Rubbers
Hong Kong Football Club M2A,83.33333333333334,33.33333333333333,80.0,100.0,74.16666666666667,21
Hong Kong Football Club M2B,44.44444444444444,77.77777777777779,75.0,80.0,69.30555555555556,31
Hong Kong Cricket Club M2B,40.0,60.0,60.0,33.33333333333333,48.33333333333333,18
Ladies Recreation Club M2A,80.0,40.0,20.0,40.0,45.0,20
Hong Kong Cricket Club M2A,0.0,33.33333333333333,66.66666666666666,16.666666666666664,29.166666666666664,24
Ladies Recreation Club M2B,14.285714285714285,42.857142857142854,0.0,25.0,20.535714285714285,24
