Team,Most Games,Most Wins,Highest Win Percentage
Arctic Circle,Wu Chi Wai (13),Wu Chi Wai (9),Luk Long Ching (71.4%)
Craigengower Cricket Club,Tang Ka Yan (13),Tang Ka Yan (11),"Li Chung Him Samuel, Leung Wai Chun Hugo (100.0%)"
Greenfield,Young Ki Chun (13),Chan Kwok Wa (4),Chan Kwok Wa (36.4%)
MM Squash,"Bachani Vinay Suresh, Chen Haoyuan (11)","Bachani Vinay Suresh, Chen Haoyuan (8)",Ahmed Masood (75.0%)
North District Sports Association 1,Leung Yat Hei (13),Chau Yung Lok (10),Chau Yung Lok (90.9%)
Squashathon SocGen,Rambaud- Chanoz Nicolas (10),"Buxani Krish, Ho Cheuk Yiu (4)","Buxani Krish, Ho Cheuk Yiu (66.7%)"
Star River 2,Pang Danny King Wai (13),Li Zong Xiang (4),Li Zong Xiang (44.4%)
The Squash Club 3,Chong Siu Fung (12),Chong Siu Fung (11),"Chung Kwong Hei, Lam Yan Yu Hayley, Tam Ming Wai, Li Yip Ki (100.0%)"
X-Alpha 5,Tse Tin Yui (12),"Tse Tin Yui, Ma Tsz Wun (7)",Wong Kwun Hin (100.0%)
