Team,Most Games,Most Wins,Highest Win Percentage
Hong Kong Cricket Club D2,Chiu Ho Fai (12),Chiu Ho Fai (7),Chiu Ho Fai (58.3%)
Hong Kong Football Club 2A,Low Mark Chun Kit (12),Low Mark Chun Kit (10),Ward Andrew (88.9%)
Hong Kong Football Club 2B,Ma Tsz Hei (10),Ma Tsz Hei (7),Ma Tsz Hei (70.0%)
Kowloon Cricket Club 2,"Yuen Tsun Hei, Chan Linclon Wui Ki, Law Yat Long (10)",Yuen Tsun Hei (10),"Wong Wing Kuen, Yuen Tsun Hei (100.0%)"
Young Player 2,"Lau Pak To, Wong Sze Yu (9)",Yeung Tsung Chit Karson (5),Yeung Tsung Chit Karson (100.0%)
