Team Name,Home,Convenor,Email
Banbil,HK Squash Centre (HKSC),Chi On Leung,sunnycoleung@hotmail.com
Head Sha Tin 4,Cornwall Street (CSPSC),Michael Ka Ki Chan,michaelnicol@gmail.com
HKU 2,HK Squash Centre (HKSC),Chi Hang Kwok,squirrellewis@hotmail.com
Honey Badger 1,HK Squash Centre (HKSC),John Jiang Zhu,zhuj@umich.edu
Perrier Sergio Tacchini KCC 7,Kowloon Cricket Club (KCC),Yuk Kwong Donnie Choy,donniechoy@gmail.com
Studio Pro,Java Road (JRSC),Pak Kei Chris Lam,chris_lam@ymail.com
The Squash Club 2,Cornwall Street (CSPSC),Bruce Lap Tak Lee,mrbrucelee@gmail.com
Twister 2,Cornwall Street (CSPSC),Rachel Wing Yan Lee,wyrachel@hotmail.com
