Team Name,Home,Convenor,Email
HK Club Gold,HK CLUB,Dallas Reid,dallasreid@me.com
Hong Kong Cricket Club M1A,Hong Kong Cricket Club (HKCC),Rod Andrews,rodandrews48@hotmail.com
Hong Kong Cricket Club M1B,Hong Kong Cricket Club (HKCC),Brian Lau,brianlau.is@gmail.com
Hong Kong Football Club M1A,Hong Kong Football Club (HKFC),Jonathan Barton,jbarton@kellettschool.com
Hong Kong Football Club M1B,Hong Kong Football Club (HKFC),Simon Man Kai Ho,simonmkho@hotmail.com
United Services Recreation Club M1 Cougars,United Services Recreation Club (USRC),Julian Ragless,julian@ragless.com
