Team Name,Home,Convenor,Email
Alpha CUHK Master,Chinese University of HK (CUHK),Henry Kam Bo Ha,kambo.ha@gmail.com
American Club-Yacht Club,American Club (AC),John Lau,laujohnc@hotmail.com
Hong Kong Cricket Club M3,Hong Kong Cricket Club (HKCC),Richard Collis,richcollis1@gmail.com
Hong Kong Football Club M3A,Hong Kong Football Club (HKFC),Robert F. Jones,robjones@fcladvisory.com
Hong Kong Football Club M3B,Hong Kong Football Club (HKFC),Guy Norman,guynorman@deloitte.com.hk
Jaws Master,Masters - HK Squash Centre (HKSC - M),Vincent Man Shun Chiu,vmschiu@yahoo.com.hk
Titlows Masters,MTR Club House (MTRC),Wai Kiu Bobby Lo,bobbykiulo@yahoo.com.hk
