Team,Most Games,Most Wins,Highest Win Percentage
Hong Kong Cricket Club 2,Chiu Ho Fai (11),Chiu Ho Fai (5),Chiu Raymond Shung Hei (50.0%)
Hong Kong Football Club 2A,"Cheng Justin Hong-Chen, Low Mark Chun Kit (10)",Cheng Justin Hong-Chen (9),Cheng Justin Hong-Chen (90.0%)
Hong Kong Football Club 2B,Lee Tin Hang (11),Lai Long Ching (8),Lai Long Ching (80.0%)
Kowloon Cricket Club 2,Law Yat Long (10),Chan Linclon Wui Ki (9),"Chan Linclon Wui Ki, Ho Tze Ho Hugo (100.0%)"
Young Player 2,"Mak Tsun Hei, Cheng Nga Ching (8)",Mak Tsun Hei (3),Fung Ching Hei (40.0%)
