Team,Most Games,Most Wins,Highest Win Percentage
Hong Kong Cricket Club 5,Mercalfe Stephen Fraser (8),Shi Le (6),Shi Le (100.0%)
Hong Kong Football Club 7A,Porter Darrell Lee (12),Porter Darrell Lee (9),Chan Niki Sin Hok (100.0%)
Kinetic 1,"Tai Jacky Tsz Ki, Lau Lily Wun Cheung, Chan King Hei (7)",Tai Jacky Tsz Ki (7),Tai Jacky Tsz Ki (100.0%)
The Best Group 1,"Au Alex Ka Man, Wong Kin Tung (13)","Chan Hei Wai Henry, Wong Kin Tung (7)",Chan Hei Wai Henry (70.0%)
UST,Hung Tsz Hang (8),"Wong Chi Hang Frankie, Hung Tsz Hang (7)",Wong Chi Hang Frankie (100.0%)
Vitality Squash 1,Li Yi Wei (9),Toernell Henrik (5),Toernell Henrik (83.3%)
X-Alpha 3,"Yau Yeung, Chan Yan Yu, Chow Yuen Ching (10)",Yau Yeung (8),Yau Yeung (80.0%)
