Team,Most Games,Most Wins,Highest Win Percentage
Hong Kong Cricket Club L2,Cheung Tin Yui (9),"Yu Hiu Ching Nicole, Kwok Charmaine, Cheung Tin Yui (5)",Kwok Charmaine (83.3%)
Hong Kong Football Club L2A,Tang Ching Sum (11),Tang Ching Sum (9),Tang Ka Ki (100.0%)
Hong Kong Football Club L2B,Choi Celia Uen Shan (8),Chan Olivia (7),"Lee Ka Man Carmen, Chan Olivia, Tam Cho Nga Mariko, Wong Chung Ching Karen (100.0%)"
Kowloon Cricket Club L2A,"Lee Sum Yuet, Li Ka Man (11)","Lee Sum Yuet, Li Ka Man (6)",Wong Suet Ling (83.3%)
Kowloon Cricket Club L2B,Tung Wing Yan (14),Tung Wing Yan (12),"Lau Wai Tung, Hau Venus (90.0%)"
