Team,Most Games,Most Wins,Highest Win Percentage
Hong Kong Cricket Club 3,West Steven (13),West Steven (6),Lau Ka Leung (66.7%)
Hong Kong Football Club 4A,Chan Cheuk Fung (16),Appan Janak (12),Tsang Cheuk Fung (90.0%)
Hong Kong Football Club 4B,Lee Tsz Long Max (19),Khosa Ashwin (13),Khosa Ashwin (86.7%)
Kowloon Cricket Club 4,Lai Michael Cheuk Fung (17),Lai Michael Cheuk Fung (14),Tang Wai Hong (87.5%)
NEXUS 2,Chu Ho Ching (12),"Chan Kai Lam, Liang Chun Wai (7)",Chan Kai Lam (77.8%)
Sha Tin 2,Leung Kelvin Siu Fung (17),Leung Ethan Ka Hin (5),Tam Kal Wai (42.9%)
United Services Recreation Club 1,Yuen Tsz Long (18),Yuen Tsz Long (14),"Yip Tony Tsun Yuen, Choy Kit Lun Ivan (80.0%)"
X-Alpha 1,Lai Pong Yin (12),Lai Pong Yin (12),"* Kwan Wan Hei, Lai Pong Yin, * Ho Kwan Yin, Kwan Wan Lok (100.0%)"
