Team Name,Home,Average Home Score,Average Away Score,home_away_diff
X-Alpha 3,Cornwall Street Squash Centre,4.666666666666667,3.0,1.666666666666667
Hong Kong Cricket Club 5,Hong Kong Cricket Club,3.0,1.75,1.25
Hong Kong Football Club 7A,Hong Kong Football Club,3.25,2.0,1.25
UST,Cornwall Street Squash Centre,3.25,2.5,0.75
Vitality Squash 1,HK Squash Centre,2.0,1.3333333333333333,0.6666666666666667
The Best Group 1,Cornwall Street Squash Centre,2.0,1.6666666666666667,0.33333333333333326
Kinetic 1,HK Squash Centre,2.0,2.5,-0.5
