Team,Most Games,Most Wins,Highest Win Percentage
Hong Kong Cricket Club Rockettes,Kwok Alvina (5),Kwok Alvina (3),Kwok Alvina (60.0%)
Hong Kong Football Club L3A,Wei Mia Lynn (5),Wei Mia Lynn (1),Wei Mia Lynn (20.0%)
Hong Kong Football Club L3B,"Ho Hoi Kiu Bernice, Law Tsz Ting (5)",Ho Hoi Kiu Bernice (5),Ho Hoi Kiu Bernice (100.0%)
Hong Kong Football Club L3C,Chui Jennifer (6),Mak Tsz Tung (3),Mak Tsz Tung (60.0%)
JESSICA L3, (nan), (nan), (nan%)
i-Mask Advance Squash Club L3, (nan), (nan), (nan%)
