Team,Rubber 1 Win %,Rubber 2 Win %,Rubber 3 Win %,Rubber 4 Win %,avg_win_perc,Total Rubbers
Hong Kong Football Club M2A,75.0,25.0,66.66666666666666,100.0,66.66666666666666,14
Hong Kong Football Club M2B,50.0,66.66666666666666,66.66666666666666,75.0,64.58333333333333,22
Hong Kong Cricket Club M2B,50.0,75.0,75.0,50.0,62.5,14
Ladies Recreation Club M2A,75.0,25.0,25.0,25.0,37.5,16
Hong Kong Cricket Club M2A,0.0,33.33333333333333,66.66666666666666,16.666666666666664,29.166666666666664,24
Ladies Recreation Club M2B,0.0,60.0,0.0,0.0,15.0,17
