Team,Rubber 1 Win %,Rubber 2 Win %,Rubber 3 Win %,avg_win_perc,Total Rubbers
Hong Kong Football Club M1B,78.57142857142857,78.57142857142857,57.14285714285714,71.42857142857143,42
Hong Kong Football Club M1A,42.857142857142854,78.57142857142857,91.66666666666666,71.03174603174602,40
Hong Kong Cricket Club M1B,61.53846153846154,53.84615384615385,38.46153846153847,51.28205128205129,39
Hong Kong Cricket Club M1A,50.0,25.0,21.428571428571427,32.142857142857146,46
Ladies Recreation Club M1,15.384615384615385,15.384615384615385,46.15384615384615,25.64102564102564,39
