Team Name,Home,Average Home Score,Average Away Score,home_away_diff
Hong Kong Football Club M3B,Hong Kong Football Club,3.0,0.0,3.0
Kowloon Cricket Club M3,Kowloon Cricket Club,4.5,2.5,2.0
OSF,Masters - HK Squash Centre,0.3333333333333333,0.5,-0.16666666666666669
Hong Kong Football Club M3A,Hong Kong Football Club,4.666666666666667,5.0,-0.33333333333333304
Titlows Squash Master,Masters - HK Squash Centre,0.0,0.3333333333333333,-0.3333333333333333
Hong Kong Cricket Club M3,Hong Kong Cricket Club,3.0,4.5,-1.5
Royal Hong Kong Yacht Club M3,Royal Hong Kong Yacht Club,1.0,2.75,-1.75
