Team,Rubber 1 Win %,Rubber 2 Win %,Rubber 3 Win %,Rubber 4 Win %,avg_win_perc,Total Rubbers
Kowloon Cricket Club L2,92.3076923076923,76.92307692307693,83.33333333333334,88.88888888888889,85.36324786324786,47
Hong Kong Football Club L2A,75.0,91.66666666666666,75.0,90.0,82.91666666666666,46
Hong Kong Cricket Club L2A,30.76923076923077,69.23076923076923,84.61538461538461,40.0,56.15384615384615,49
Hong Kong Football Club L2C,41.66666666666667,33.33333333333333,36.36363636363637,33.33333333333333,36.17424242424242,44
Hong Kong Football Club L2B,46.15384615384615,15.384615384615385,7.6923076923076925,33.33333333333333,25.64102564102564,48
Hong Kong Cricket Club L2B,15.384615384615385,15.384615384615385,15.384615384615385,18.181818181818183,16.083916083916083,50
