Team,Rubber 1 Win %,Rubber 2 Win %,Rubber 3 Win %,Rubber 4 Win %,avg_win_perc,Total Rubbers
Kowloon Cricket Club L2,86.66666666666667,80.0,85.71428571428571,90.9090909090909,85.82251082251082,55
Hong Kong Football Club L2A,81.25,87.5,75.0,84.61538461538461,82.09134615384616,61
Hong Kong Cricket Club L2A,37.5,68.75,81.25,41.66666666666667,57.29166666666667,60
Hong Kong Football Club L2C,40.0,33.33333333333333,28.57142857142857,40.0,35.476190476190474,54
Hong Kong Football Club L2B,43.75,18.75,6.25,25.0,23.4375,60
Hong Kong Cricket Club L2B,12.5,12.5,25.0,21.428571428571427,17.857142857142858,62
