Team,Rubber 1 Win %,Rubber 2 Win %,Rubber 3 Win %,Rubber 4 Win %,avg_win_perc,Total Rubbers
Kowloon Cricket Club L2,91.66666666666666,75.0,81.81818181818183,87.5,83.99621212121212,43
Hong Kong Football Club L2A,70.0,90.0,70.0,88.88888888888889,79.72222222222223,39
Hong Kong Cricket Club L2A,33.33333333333333,75.0,91.66666666666666,44.44444444444444,61.111111111111114,45
Hong Kong Football Club L2C,45.45454545454545,27.27272727272727,30.0,25.0,31.93181818181818,40
Hong Kong Football Club L2B,45.45454545454545,18.181818181818183,9.090909090909092,37.5,27.556818181818183,41
Hong Kong Cricket Club L2B,16.666666666666664,16.666666666666664,16.666666666666664,20.0,17.5,46
