Team,Rubber 1 Win %,Rubber 2 Win %,Rubber 3 Win %,Rubber 4 Win %,avg_win_perc,Total Rubbers
Hong Kong Football Club M1B,81.81818181818183,81.81818181818183,72.72727272727273,54.54545454545454,72.72727272727273,44
Hong Kong Football Club M1A,75.0,75.0,66.66666666666666,66.66666666666666,70.83333333333333,48
Ladies Recreation Club M1,18.181818181818183,45.45454545454545,81.81818181818183,72.72727272727273,54.54545454545455,44
Hong Kong Cricket Club M1A,66.66666666666666,8.333333333333332,16.666666666666664,25.0,29.166666666666664,48
Hong Kong Cricket Club M1B,8.333333333333332,41.66666666666667,16.666666666666664,33.33333333333333,24.999999999999996,48
