Team,Rubber 1 Win %,Rubber 2 Win %,Rubber 3 Win %,Rubber 4 Win %,avg_win_perc,Total Rubbers
Hong Kong Football Club M1B,80.0,80.0,70.0,60.0,72.5,40
Hong Kong Football Club M1A,70.0,70.0,60.0,70.0,67.5,40
Ladies Recreation Club M1,22.22222222222222,44.44444444444444,77.77777777777779,77.77777777777779,55.55555555555556,36
Hong Kong Cricket Club M1A,66.66666666666666,11.11111111111111,22.22222222222222,22.22222222222222,30.555555555555557,36
Hong Kong Cricket Club M1B,0.0,37.5,12.5,12.5,15.625,32
