Team,Most Games,Most Wins,Highest Win Percentage
Hong Kong Cricket Club L2,"Kwong Sarah Wing Yan, Li Leanne Gi Ming (12)","Kwok Charmaine, Cheung Tin Yui, Leung Kam Yan (6)",Kwok Charmaine (85.7%)
Hong Kong Football Club L2A,Tang Ching Sum (15),Tang Ching Sum (13),Tang Ka Ki (100.0%)
Hong Kong Football Club L2B,"Wu Renee, Choi Celia Uen Shan (10)","Wu Renee, Chan Olivia (8)","Chan Olivia, Tam Cho Nga Mariko (100.0%)"
Kowloon Cricket Club L2A,Li Ka Man (16),Li Ka Man (8),Wong Suet Ling (87.5%)
Kowloon Cricket Club L2B,Tung Wing Yan (18),Tung Wing Yan (15),Hau Venus (91.7%)
