Team Name,Home,Convenor,Email
Boss,Cornwall Street Squash Centre,Kelvin Hon Hun Li,kelvinhhli@hotmail.com
HKPF Squash Team,Cornwall Street Squash Centre,Po Sing Chan,chanposing999@gmail.com
Hong Kong Football Club 15,Hong Kong Football Club,Robert F. Jones,robjones@fcladvisory.com
Old Squash Fellows,HK Squash Centre,Vincent Man Shun Chiu,vmschiu@yahoo.com.hk
Sergio Tacchini KCC 15,Kowloon Cricket Club,Rakesh Samtani,rakesh@ramco.com.hk
Tuen Mun Squash Club,Cornwall Street Squash Centre,Kwok Hee Wong,adbest@netvigator.com
United Services Recreation Club 3,United Services Recreation Club,Kermit Ka Fai Yuen,kermit8112@gmail.com
