Team Name,Home,Convenor,Email
Happy Squash 2,Tai Wo Hau Squash Centre,Wai Ching Seung,koseung101@hotmail.com
Hong Kong Football Club 7A,Hong Kong Football Club,Bradley Scheepers,bradscheepers@gmail.com
Hong Kong Football Club 7B,Hong Kong Football Club,Dave Chi Keung Chan,chichan1@gmail.com
Hong Kong Racketlon Association 1,Cornwall Street Squash Centre,Steven Wai Kit Cheng,wksteven2003@hotmail.com
i-Mask Advance Squash Club 1,Cornwall Street Squash Centre,Tat Chi Chow,chowsir30@gmail.com
i-Mask Advance Squash Club 2,Cornwall Street Squash Centre,Tat Chi Chow,chowsir30@gmail.com
Physical Chess Squash Club Academy 1,Cornwall Street Squash Centre,Shui Lun Wilson Chan,squashphysicalchess@gmail.com
TNG 2,Cornwall Street Squash Centre,Anson Yu Shun Kwong,ansonkys@hotmail.com
YLJR 1,Cornwall Street Squash Centre,Siu Nam Lau,oscarlauhk@hotmail.com
