Team,Most Games,Most Wins,Highest Win Percentage
HEAD SHATIN 5,Lai Shing Chak (9),"Lai Shing Chak, Mak Rachel Lai Lo, Chau Ka Chung (6)",Mak Rachel Lai Lo (100.0%)
Hong Kong Cricket Club 17,Clark Bryan Henry (9),"Healy Michael, Eyre James, Denham Jude (6)",Denham Jude (85.7%)
Kinetic 6,Chan Ching Long (10),Lo Ching Yin (7),Lo Ching Yin (77.8%)
PLZ,"Chow Ka Lun, Ching Pak Hin, Ng Terry Yu Hin (10)","Chow Ka Lun, Cheung Hoi Suen (3)",Cheung Hoi Suen (37.5%)
Smart Squash 3,Chung Ho Yin Will (10),Chung Ho Yin Will (6),Chung Ho Yin Will (60.0%)
Spaghetti,Wong Chun Hong (11),Wong Chun Hong (11),Wong Chun Hong (100.0%)
The Zero Squash Club D17,Tse Tin Po (8),Tsui Wing Fat (6),"Mak Kwok Wing, Tsui Wing Fat, Chung Ka Chun (100.0%)"
i-Mask Advance Squash Club 11,Lee Yuk Hei (9),Lee Yuk Hei (7),Lee Kit Long (100.0%)
