Team,Most Games,Most Wins,Highest Win Percentage
Friend Club 1,Chan Ho Ching (9),Chan Ho Ching (6),Law Harry (100.0%)
HEAD SHATIN 1,"Chan Tsz Yeung, Chan Jason (8)","Chan Tsz Yeung, Chan Jason (4)","Chan Tsz Yeung, Chan Jason, Luk Anson Chi Tao (50.0%)"
Hong Kong Cricket Club 4,"^ Windmill Mark, Kevin Waldmer (8)",Kevin Waldmer (7),Kevin Waldmer (87.5%)
Hong Kong Football Club 4,"Rosenzweig Nathan Shuyou, Schlosser Gergo (8)",Rosenzweig Nathan Shuyou (8),"Rosenzweig Nathan Shuyou, Leung Ho Him Jeff (100.0%)"
PERRIER SERGIO TACCHINI KCC 4,"Chu Ho Yin, Chan Shing Fung (8)",Cheng Yu Ching (5),Cheng Yu Ching (100.0%)
Smart Squash 1,Wong Tsz Lok Prince (9),Wong Tsz Lok Prince (7),Chui King Yin (83.3%)
Spark 1,"Wong Anson, Cheng Justin Hong-Chen (7)",Cheng Justin Hong-Chen (6),Cheng Justin Hong-Chen (85.7%)
TNGX,"Wai Wing Yin, Mak Ryan Lai Lok, Sin Kwun Kit Leo (9)",Wai Wing Yin (8),Wai Wing Yin (88.9%)
