Team,Most Games,Most Wins,Highest Win Percentage
A Squash 1A,"Seung Wai Ching, Weng Yi Kong (8)",Seung Wai Ching (8),Seung Wai Ching (100.0%)
A Squash 1B,"Leung Ka Huen, Cheng Pik Ching (8)",Leung Ka Huen (6),Leung Ka Huen (75.0%)
Hong Kong Football Club 5,"Cheung Chun, Gates Stuart (9)",Gates Stuart (7),Chapman William (85.7%)
Howards Folly Wine LRC Div 5,Soo Euan Tsung Liang (9),"^ Disler Simon William, Shum Peter, Soo Euan Tsung Liang (5)",Shum Peter (83.3%)
PERRIER SERGIO TACCHINI KCC 5,Lai Cheuk Yu (9),Lai Cheuk Yu (7),"Li Sum Yin, Ho Ka Po (100.0%)"
Physical Chess 1,Or  Ka Ming (8),"Or  Ka Ming, Lai Thomas Chun Sang (4)",Lai Thomas Chun Sang (66.7%)
Smart Squash 2,Ng Tsz Chun (10),Ng Tsz Chun (3),Ng Tsz Chun (30.0%)
TNG 1,"Tam Tommy Tsz Shing, Fong Ka Leung (8)",Tam Tommy Tsz Shing (6),Tam Tommy Tsz Shing (75.0%)
i-Mask Advance Squash Club 2,Li Chun Hei (7),"Li Chun Hei, Yu Fung, Lee Ka Fai Peterson (4)","Yu Fung, Lee Ka Fai Peterson (66.7%)"
