Home Team,Away Team,Venue,Match Week,Date
Ladies Recreation Club M2B,Ladies Recreation Club M2A,Ladies Recreation Club,6,2024-11-06
Hong Kong Football Club M2B,Hong Kong Football Club M2A,Hong Kong Football Club,6,2024-11-06
Hong Kong Cricket Club M2B,Hong Kong Cricket Club M2A,Hong Kong Cricket Club,6,2024-11-06
Ladies Recreation Club M2A,Ladies Recreation Club M2B,Ladies Recreation Club,11,2024-12-18
Hong Kong Cricket Club M2A,Hong Kong Cricket Club M2B,Hong Kong Cricket Club,11,2024-12-18
Ladies Recreation Club M2B,Ladies Recreation Club M2A,Ladies Recreation Club,16,2025-02-19
Hong Kong Football Club M2B,Hong Kong Football Club M2A,Hong Kong Football Club,16,2025-02-19
Hong Kong Cricket Club M2B,Hong Kong Cricket Club M2A,Hong Kong Cricket Club,16,2025-02-19
