Team Name,Home,Average Home Score,Average Away Score,home_away_diff
Sha Tin 7,Cornwall Street Squash Centre,3.0,1.3333333333333333,1.6666666666666667
Royal Hong Kong Yacht Club Div 15,Royal Hong Kong Yacht Club,4.0,2.6666666666666665,1.3333333333333335
HKIS Div 15,HK Squash Centre,3.0,1.75,1.25
Hong Kong Cricket Club 8,Hong Kong Cricket Club,3.0,1.75,1.25
United Services Recreation Club 4,United Services Recreation Club,2.5,1.5,1.0
Squashathon One,Cornwall Street Squash Centre,3.0,2.5,0.5
Physical Chess 5,Cornwall Street Squash Centre,2.6666666666666665,3.0,-0.3333333333333335
