Team,Rubber 1 Win %,Rubber 2 Win %,Rubber 3 Win %,Rubber 4 Win %,avg_win_perc,Total Rubbers
Kowloon Cricket Club L2,60.0,93.33333333333333,80.0,76.92307692307693,77.56410256410257,58
Hong Kong Football Club L2B,50.0,81.25,75.0,71.42857142857143,69.41964285714286,62
JESSICA L2,93.75,62.5,68.75,30.76923076923077,63.94230769230769,61
Hong Kong Football Club L2A,62.5,18.75,31.25,69.23076923076923,45.43269230769231,61
Hong Kong Cricket Club L2,13.333333333333334,40.0,13.333333333333334,21.428571428571427,22.023809523809526,59
Hong Kong Football Club L2C,18.75,6.25,31.25,30.76923076923077,21.754807692307693,61
