Team Name,Home,Convenor,Email
Hong Kong Cricket Club L2,Hong Kong Cricket Club,Kwai Wah Monique Hui,[email protected]
Hong Kong Football Club L2A,Hong Kong Football Club,Ching Sum Tang,[email protected]
Hong Kong Football Club L2B,Hong Kong Football Club,Ka Man Carmen Lee,[email protected]
JESSICA L2 [withdrawal],HK Squash Centre,Elise Jia Yunn * Ng,[email protected]
Kowloon Cricket Club L2A,Kowloon Cricket Club,Sum Yuet Lee,[email protected]
Kowloon Cricket Club L2B,Kowloon Cricket Club,Phoebe Hei Ting Leung,[email protected]
