,Team Name,Home,Convenor,Email
0,Electrify Squash Div 5,HK Squash Centre,Ryan Chun Hung * Wong,ryansquashcoaching@gmail.com
1,Hong Kong Football Club 5,Hong Kong Football Club,Christian Hibberd,hibberdchristian@gmail.com
2,i-Mask Advance Squash Club 1,Cornwall Street Squash Centre,Tat Chi Chow,chowsir30@gmail.com
3,Kowloon Cricket Club 5,Kowloon Cricket Club,Michael Cheuk Fung Lai,laicheukfung2001@yahoo.com.hk
4,Sha Tin Squash Rackets Club 1,Cornwall Street Squash Centre,Maurice Cheuk Him Lam,mauricelam123@yahoo.com
5,Squashathon,Cornwall Street Squash Centre,Tsz Chun Ng,mikengmike1990@yahoo.com.hk
6,United Services Recreation Club 1,United Services Recreation Club,Ji Yang Fung,jiyangfung0@gmail.com
7,X-Alpha 2,Cornwall Street Squash Centre,King Yin Chui,ckyken1211@gmail.com
8,YLJR 1,Cornwall Street Squash Centre,Ho Man Yang,jason13220@gmail.com
