Team Name,Home,Convenor,Email
Hong Kong Cricket Club Rockettes,Hong Kong Cricket Club,Vivien Peters,vivienapeters@gmail.com
Hong Kong Football Club L3A,Hong Kong Football Club,Esther Wan,telester@hotmail.com
Hong Kong Football Club L3B,Hong Kong Football Club,Tsz Ting Law,bonnylaw@connect.hku.hk
Hong Kong Football Club L3C,Hong Kong Football Club,Mavis Morton,mavisandandy@gmail.com
JESSICA Smashin' Mochi,HK Squash Centre,Chin Pik Ho,pikpik@gmail.com
Physical Chess Ladies,Cornwall Street Squash Centre,Shui Lun Wilson Chan,squashphysicalchess@gmail.com
The Squash Club Ladies,Cornwall Street Squash Centre,Samantha Ho Yan Cheng,thathacheng@gmail.com
