,Team Name,Home,Convenor,Email
0,Hong Kong Cricket Club M2,Hong Kong Cricket Club,Paul Denham,denzo41@yahoo.com.au
1,Hong Kong Football Club M2A,Hong Kong Football Club,Kien Hoon Ng,kien.ng@hwbhk.com
2,Hong Kong Football Club M2B,Hong Kong Football Club,Nikolaj Schultz,nikolaj_schultz@yahoo.co.uk
3,Hong Kong Football Club M2C,Hong Kong Football Club,Kenneth Kin Cheung Lo,kenlokc@gmail.com
4,Ladies Recreation Club M2,Ladies Recreation Club,Chi On Leung,sunnycoleung@hotmail.com
5,Old Squash Fellows,Masters - HK Squash Centre,Sunny Yat Sing Poon,sunnyyspoon@gmail.com
6,Royal Hong Kong Yacht Club M2,Royal Hong Kong Yacht Club,John Lau,laujohnc@hotmail.com
7,Titlows Squash Team,MTR Club House,Wai Kiu Bobby Lo,bobbykiulo@yahoo.com.hk
8,United Services Recreation Club M2,United Services Recreation Club,Tang Fat Elbert Yao,elbertyao@gmail.com
