Home Team,Away Team,Venue,Match Week,Date,Avg Simulated Home Points,Avg Simulated Away Points
Social Squash Team,Hong Kong Football Club 6B,HK Squash Centre,18,2025-03-17,1.8405681136227245,4.159431886377275
Kowloon Cricket Club 6A,Hong Kong Football Club 6A,Kowloon Cricket Club,18,2025-03-17,3.5939187837567514,2.4060812162432486
Hong Kong Cricket Club 4,United Services Recreation Club 2,Hong Kong Cricket Club,18,2025-03-17,2.9621924384876976,3.0378075615123024
Hong Kong Football Club 6C,Kowloon Cricket Club 6B,Hong Kong Football Club,18,2025-03-17,2.4344868973794758,3.5655131026205242
Friend Club 3,Global Squash 1,Cornwall Street Squash Centre,18,2025-03-17,2.359471894378876,3.640528105621124
