Team,Most Games,Most Wins,Highest Win Percentage
Electrify Squash Ladies,Yeung Abby (6),Yeung Abby (1),Yeung Abby (16.7%)
Hong Kong Cricket Club L4,Li Zoe (5),Li Zoe (5),Li Zoe (100.0%)
Hong Kong Football Club JSA, (nan), (nan), (nan%)
Hong Kong Football Club L4,Wong Shuk Ting Ruby (5),Wong Shuk Ting Ruby (2),Wong Shuk Ting Ruby (40.0%)
JESSICA L4,Ng Jessica Yuk Mui (5),Ng Jessica Yuk Mui (4),Ng Jessica Yuk Mui (80.0%)
JESSICA Smashin' Mochi,Ho Chin Pik (7),Ho Chin Pik (3),Ho Chin Pik (42.9%)
i-Mask Advance Squash Club L4, (nan), (nan), (nan%)
