Team,Rubber 1 Win %,Rubber 2 Win %,Rubber 3 Win %,avg_win_perc
Kowloon Cricket Club L1B,66.66666666666667,0.0,-16.666666666666657,16.66666666666667
Jessica,-25.0,16.66666666666667,33.33333333333334,8.333333333333336
Hong Kong Football Club L1A,33.33333333333334,0.0,-66.66666666666667,-11.1111111111111
Hong Kong Cricket Club L1,0.0,0.0,-33.33333333333333,-11.111111111111107
Hong Kong Football Club L1B,0.0,0.0,-33.33333333333333,-11.111111111111109
Kowloon Cricket Club L1A,0.0,0.0,-66.66666666666667,-22.22222222222223
