Team,Rubber 1 Win %,Rubber 2 Win %,Rubber 3 Win %,Rubber 4 Win %,avg_win_perc
Hong Kong Cricket Club L2A,-11.904761904761905,40.47619047619049,42.85714285714286,66.66666666666666,34.52380952380952
Hong Kong Football Club L2C,-17.857142857142854,10.714285714285715,8.333333333333336,25.0,6.547619047619051
Kowloon Cricket Club L2,-1.3888888888888857,9.722222222222214,-3.1746031746031775,14.285714285714292,4.861111111111114
Hong Kong Football Club L2B,-41.66666666666667,8.333333333333329,0.0,-8.333333333333329,-10.416666666666664
Hong Kong Cricket Club L2B,-28.57142857142857,28.57142857142857,0.0,-52.38095238095237,-13.095238095238095
Hong Kong Football Club L2A,-28.57142857142857,10.714285714285708,-17.85714285714286,-33.33333333333334,-17.26190476190476
