Team,Rubber 1 Win %,Rubber 2 Win %,Rubber 3 Win %,Rubber 4 Win %,avg_win_perc
Hong Kong Cricket Club L2A,-13.333333333333329,30.0,33.33333333333334,50.0,25.0
Hong Kong Football Club L2C,0.0,33.33333333333333,13.333333333333329,50.0,24.166666666666668
Kowloon Cricket Club L2,-14.285714285714292,19.04761904761905,0.0,20.0,6.19047619047619
Hong Kong Football Club L2B,-26.666666666666657,6.666666666666671,0.0,-16.66666666666667,-9.166666666666668
Hong Kong Football Club L2A,-25.0,25.0,-25.0,-25.0,-12.5
Hong Kong Cricket Club L2B,-20.0,33.33333333333333,-23.333333333333336,-49.99999999999999,-15.0
