Team,Rubber 1 Win %,Rubber 2 Win %,Rubber 3 Win %,Rubber 4 Win %,avg_win_perc
Hong Kong Cricket Club L2A,-11.904761904761905,40.47619047619049,42.85714285714286,66.66666666666666,34.52380952380952
Hong Kong Football Club L2C,-17.857142857142854,10.714285714285715,8.333333333333336,25.0,6.547619047619051
Kowloon Cricket Club L2,-3.1746031746031775,7.9365079365079225,-5.555555555555543,14.285714285714292,3.3730158730158735
Hong Kong Football Club L2B,-41.66666666666667,8.333333333333329,0.0,-8.333333333333329,-10.416666666666664
Hong Kong Cricket Club L2B,-20.0,28.57142857142857,-11.42857142857143,-52.38095238095237,-13.80952380952381
Hong Kong Football Club L2A,-16.666666666666657,8.333333333333343,-25.0,-33.33333333333334,-16.666666666666657
