Team,Rubber 1 Win %,Rubber 2 Win %,Rubber 3 Win %,Rubber 4 Win %,avg_win_perc
Hong Kong Football Club L3A,-25.0,0.0,8.333333333333343,75.0,14.583333333333343
Hong Kong Football Club L3C,25.0,25.0,-25.0,25.0,12.5
Hong Kong Cricket Club Rockettes,6.666666666666671,46.66666666666667,-16.666666666666657,0.0,9.166666666666671
The Squash Club Ladies,20.0,0.0,-5.0,20.0,8.75
Hong Kong Football Club L3B,25.0,25.0,-16.66666666666667,-16.66666666666667,4.166666666666657
Physical Chess Ladies,-30.0,25.0,0.0,0.0,-1.25
JESSICA Smashin' Mochi,-23.333333333333336,-6.666666666666671,0.0,20.0,-2.5
