Team,Rubber 1 Win %,Rubber 2 Win %,Rubber 3 Win %,Rubber 4 Win %,Rubber 5 Win %,avg_win_perc
Old Squash Fellows,25.0,5.0,60.0,40.0,50.0,36.0
Hong Kong Football Club M2B,-30.0,50.0,35.0,40.0,15.0,22.0
Hong Kong Football Club M2C,49.99999999999999,16.666666666666657,-16.666666666666686,16.666666666666657,16.666666666666657,16.666666666666664
Ladies Recreation Club M2,40.0,-20.0,40.0,0.0,20.0,16.0
Hong Kong Football Club M2A,-20.0,20.0,-20.0,20.0,60.0,12.0
Titlows Squash Team,-20.0,0.0,20.0,0.0,-5.0,-1.0
United Services Recreation Club M2,-16.666666666666657,16.666666666666686,-16.666666666666657,-16.666666666666657,16.666666666666686,-3.3333333333333215
Royal Hong Kong Yacht Club M2,-8.333333333333343,8.333333333333336,16.66666666666667,-41.66666666666666,0.0,-4.999999999999993
Hong Kong Cricket Club M2,40.0,20.0,-40.0,-40.0,-20.0,-8.0
