Team,Rubber 1 Win %,Rubber 2 Win %,Rubber 3 Win %,Rubber 4 Win %,Rubber 5 Win %,avg_win_perc
Old Squash Fellows,25.0,5.0,60.0,40.0,50.0,36.0
Hong Kong Football Club M2B,-30.0,50.0,35.0,40.0,15.0,22.0
Hong Kong Football Club M2A,-10.0,35.0,-20.0,25.0,75.0,21.0
Ladies Recreation Club M2,55.0,-35.0,55.0,-15.0,30.0,18.0
Hong Kong Football Club M2C,49.99999999999999,16.666666666666657,-16.666666666666686,16.666666666666657,16.666666666666657,16.666666666666664
Titlows Squash Team,-20.0,0.0,25.0,0.0,0.0,1.0
Royal Hong Kong Yacht Club M2,-5.0,5.0,30.0,-55.0,10.0,-3.0
Hong Kong Cricket Club M2,35.0,35.0,-55.0,-25.0,-10.0,-4.0
United Services Recreation Club M2,-50.0,33.33333333333334,-50.0,0.0,33.33333333333334,-6.666666666666664
