Team,Rubber 1 Win %,Rubber 2 Win %,Rubber 3 Win %,Rubber 4 Win %,Rubber 5 Win %,avg_win_perc
Hong Kong Football Club M3B,30.0,55.0,50.0,-35.0,50.0,30.0
Royal Hong Kong Yacht Club M3,46.66666666666666,6.666666666666657,-10.0,30.0,-13.333333333333343,12.0
Kowloon Cricket Club M3,8.333333333333343,-8.333333333333343,-8.333333333333343,16.66666666666667,15.0,4.666666666666657
United Services Recreation Club M3,8.333333333333336,8.333333333333336,16.66666666666667,-41.66666666666666,0.0,-1.6666666666666643
Bolton,0.0,-28.57142857142857,35.714285714285715,-57.14285714285714,21.42857142857143,-5.714285714285712
Hong Kong Club Blue,0.0,33.33333333333333,-33.33333333333333,-33.33333333333333,0.0,-6.666666666666657
Hong Kong Football Club M3A,10.0,55.0,5.0,-55.0,-55.0,-8.0
Phoenix,-20.0,0.0,0.0,-20.0,-40.0,-16.0
Hong Kong Cricket Club M3,-3.5714285714285694,-7.142857142857146,-7.142857142857146,-57.142857142857146,-57.142857142857146,-26.42857142857143
