Team,Most Games,Most Wins,Highest Win Percentage
Centre Squash,"Bedouillat Vincent, Cheung Ka Lun Alan, Chevaux Alexander (8)","Bedouillat Vincent, Chevaux Alexander (5)","Bedouillat Vincent, Chevaux Alexander (62.5%)"
Friend Club,"Ip Chun Keung, Wong Ho Sang (10)",Ip Chun Keung (10),Ip Chun Keung (100.0%)
HKPF Squash Team,Ko Toby Ho Yin (10),Ko Toby Ho Yin (9),Ko Toby Ho Yin (90.0%)
Hong Kong Football Club 9,Wei Mia Lynn (9),Wei Mia Lynn (6),Wei Mia Lynn (66.7%)
Kowloon Cricket Club 9,Wan Pauline Yuen Ping (9),Yim Man Ching (8),"Yim Man Ching, Cheung Coco Oi Yan (100.0%)"
Kwai Tsing District Squash Club,Ho Gary Ming Fai (10),Tsang Yan Kiu (7),Tsang Yan Kiu (87.5%)
The Best Group 2,"Andersson Greger, Chan Cheuk Kee (8)","Chan Cheuk Kee, Ho Sung Hon, Cheng Chi Wah (3)",Cheng Chi Wah (50.0%)
i-Mask Advance Squash Club 3,Hegde Vishal (9),Kong Yuk Hang Jason (6),Lee Wing Lam (80.0%)
