Home Team,Away Team,Venue,Match Week,Date,Overall Score,Rubbers,Home Score,Away Score,Home Games Won,Away Games Won,Winner Rubber 1,Winner Rubber 2,Winner Rubber 3
Hong Kong Football Club L3A,Hong Kong Football Club L3B,Hong Kong Football Club,1,04/10/2024,2-1,"['0-3', '3-0', '3-0']",2,1,6,3,Hong Kong Football Club L3B,Hong Kong Football Club L3A,Hong Kong Football Club L3A
Hong Kong Football Club L3C,i-Mask Advance Squash Club L3,Hong Kong Football Club,1,04/10/2024,3-0,"['3-2', '3-0', '3-0']",3,0,9,2,Hong Kong Football Club L3C,Hong Kong Football Club L3C,Hong Kong Football Club L3C
Hong Kong Cricket Club Rockettes,JESSICA L3,Hong Kong Cricket Club,1,04/10/2024,2-1,"['3-0', '3-1', '0-3']",2,1,6,4,Hong Kong Cricket Club Rockettes,Hong Kong Cricket Club Rockettes,JESSICA L3
Hong Kong Football Club L3C,Hong Kong Football Club L3A,Hong Kong Football Club,2,18/10/2024,2-1,"['3-0', '3-0', '1-3']",2,1,7,3,Hong Kong Football Club L3C,Hong Kong Football Club L3C,Hong Kong Football Club L3A
i-Mask Advance Squash Club L3,JESSICA L3,Cornwall Street Squash Centre,2,18/10/2024,1-2,"['0-3', '0-3', '3-2']",1,2,3,8,JESSICA L3,JESSICA L3,i-Mask Advance Squash Club L3
Hong Kong Cricket Club Rockettes,Hong Kong Football Club L3B,Hong Kong Cricket Club,2,18/10/2024,1-2,"['0-3', '3-0', '1-3']",1,2,4,6,Hong Kong Football Club L3B,Hong Kong Cricket Club Rockettes,Hong Kong Football Club L3B
