Team Name,Home,Average Home Score,Average Away Score,home_away_diff
Hong Kong Cricket Club M2A,Hong Kong Cricket Club,1.75,1.1666666666666667,0.5833333333333333
Hong Kong Football Club M2A,Hong Kong Football Club,3.0,2.75,0.25
Ladies Recreation Club M2A,Ladies Recreation Club,2.0,1.8,0.19999999999999996
Hong Kong Football Club M2B,Hong Kong Football Club,3.0,2.857142857142857,0.1428571428571428
Ladies Recreation Club M2B,Ladies Recreation Club,0.4,0.6,-0.19999999999999996
Hong Kong Cricket Club M2B,Hong Kong Cricket Club,2.0,2.5,-0.5
