Team,Most Games,Most Wins,Highest Win Percentage
Happy Squash 1,Leung Ping Chak (8),"Leung Ping Chak, Leung Shun Wa Ethan (6)",Leung Shun Wa Ethan (85.7%)
Hong Kong Football Club 3A,"Cheng Yu Ching, Soo Sean Tsung Jie (6)",Cheng Yu Ching (6),Cheng Yu Ching (100.0%)
Hong Kong Football Club 3B,"Cassidy Cameron Michael, Anthony Nigel (6)",Cassidy Cameron Michael (5),Cassidy Cameron Michael (83.3%)
Kowloon Cricket Club 3A,Ho Ka On (8),"Ho Ka On, Kwok Ka Ho (4)",Kwok Ka Ho (66.7%)
Kowloon Cricket Club 3B,Yip Tsz Ho (8),Liu Tsz Ling (6),Liu Tsz Ling (85.7%)
NEXUS 1,Li Ho Hin (7),Lau Ho Fung (4),Lau Ho Fung (80.0%)
Sha Tin 1,"Tang Ethan Pui Lok, Luk Anson Chi Tao (6)",Tang Ethan Pui Lok (3),Tang Ethan Pui Lok (50.0%)
TNGX,Mak Tsun Hin (9),Hon Michael Tsz San (7),Hon Michael Tsz San (87.5%)
Young Player 3,"Wong Sze Yu, Yeung Tsung Chit Karson, Law Pak Ho Cyrus (6)",Yeung Tsung Chit Karson (6),Yeung Tsung Chit Karson (100.0%)
