Team,Most Games,Most Wins,Highest Win Percentage
Friend Club 1,Law Harry (21),Law Harry (18),Law Harry (85.7%)
Happy Squash 1,Leung Ping Chak (23),Seung Wai Ching (22),Seung Wai Ching (100.0%)
Hong Kong Football Club 4A,"Schlosser Gergo, Or  Ka Ming, Tsang Cheuk Fung (19)",Tsang Cheuk Fung (16),Tsang Cheuk Fung (84.2%)
Hong Kong Football Club 4B,"Lee Tsz Long Max, Wat Kien Long Peter (17)","Lee Tsz Long Max, Cheung Parco (7)",Chapman William (55.6%)
Sergio Tacchini KCC 4,"Chan Chun Ching, Kwok Ka Ho (21)",Wong King Yat (19),Wong King Yat (100.0%)
TNG 1,Liu Sung Yan (11),Fong Ka Leung (6),Fong Ka Leung (66.7%)
The New Generation X,Wai Wing Yin (19),Hon Michael Tsz San (13),Hon Michael Tsz San (72.2%)
United Services Recreation Club 1,"Yip Tony Tsun Yuen, Lau Hugo Hin Yue, da Silva Juan (13)",Lau Hugo Hin Yue (7),Lau Hugo Hin Yue (53.8%)
