Team,Most Games,Most Wins,Highest Win Percentage
Hong Kong Cricket Club L2A,Yip Melody Kwun Ting (14),Yip Melody Kwun Ting (12),Yip Melody Kwun Ting (85.7%)
Hong Kong Cricket Club L2B,Li Leanne Gi Ming (15),Chan Suk Ting (5),Chan Suk Ting (50.0%)
Hong Kong Football Club L2A,Yeung Yurisa (16),Yeung Yurisa (15),Yeung Yurisa (93.8%)
Hong Kong Football Club L2B,Chan Christine Yik Tat (14),Lau Karen Siu Ying (10),Lau Karen Siu Ying (90.9%)
Hong Kong Football Club L2C,Mishra Ipsa (12),Mishra Ipsa (7),Mishra Ipsa (58.3%)
