Team,Rubber 1 Win %,Rubber 2 Win %,Rubber 3 Win %,Rubber 4 Win %,Rubber 5 Win %,avg_win_perc,Total Rubbers
Hong Kong Football Club L2B,66.66666666666666,100.0,100.0,60.0,0.0,65.33333333333333,22
Kowloon Cricket Club L2B,50.0,83.33333333333334,50.0,100.0,0.0,56.66666666666667,21
Kowloon Cricket Club L2A,0.0,50.0,100.0,100.0,0.0,50.0,13
Hong Kong Football Club L2A,83.33333333333334,50.0,25.0,25.0,0.0,36.66666666666667,18
Hong Kong Cricket Club L2,62.5,25.0,25.0,33.33333333333333,0.0,29.166666666666664,30
JESSICA L2 [withdrawal],0.0,0.0,0.0,0.0,0.0,0.0,0
