Team Name,Home,Convenor,Email
FWD-USRC,United Services Recreation Club (USRC),Joe Wai Chung Wong,joewwong48@hotmail.com
Hong Kong Football Club 2A,Hong Kong Football Club (HKFC),^Nathan L'Huillier,nathan.lhuillier@dlapiper.com
Hong Kong Football Club 2B,Hong Kong Football Club (HKFC),Ho Ming ^ Chiu,homing123@gmail.com
Perrier KCC 2A,Kowloon Cricket Club (KCC),Nelson Kai Chi Chan,kaichij@hotmail.com
Perrier KCC 2B,Kowloon Cricket Club (KCC),Ivan Ngo Long Fung,afs.ivanfung@gmail.com
Young Player 4,Hong Kong Sports Institute (HKSI),Rebecca Wing Yin Chiu,rebeccac@hksi.org.hk
