Team Name,Home,Convenor,Email
DG Audio,Java Road (JRSC),Pak Kei Chris Lam,chris_lam@ymail.com
Head Shatin 4,Cornwall Street (CSPSC),Marco Sin Hang Chan,shcmarco@gmail.com
Honey Badger SC 1,HK Squash Centre (HKSC),John Jiang Zhu,zhuj@umich.edu
Hong Kong Cricket Club 4,Hong Kong Cricket Club (HKCC),John Li,john@bands.com.hk
Hong Kong Football Club 9,Hong Kong Football Club (HKFC),Mark Squires,mark.squires@baml.com
Revolution,HK Squash Centre (HKSC),Daniel Ternes,dcternes@gmail.com
Star River 1,Cornwall Street (CSPSC),Ip Hing Paul Wong,paulwongsquash@gmail.com
Twister 1,Cornwall Street (CSPSC),Rachel Wing Yan Lee,wyrachel@hotmail.com
