Team,Most Games,Most Wins,Highest Win Percentage
Happy Squash 1,"Leung Ping Chak, Seung Wai Ching (19)",Seung Wai Ching (18),Seung Wai Ching (94.7%)
Hong Kong Football Club 3A,Cheung Chi Yan (17),Bai Ethan Hao Wen (11),Chan Hok Nam (71.4%)
Hong Kong Football Club 3B,Wong Ho Kiu (15),Wong Ho Kiu (10),Cassidy Cameron Michael (88.9%)
Kowloon Cricket Club 3A,"Ho Ka On, Chu Alex Kwok Kee (14)",Ho Ka On (8),Ng Ka Tsun Derek (83.3%)
Kowloon Cricket Club 3B,Yip Tsz Ho (19),"Yip Tsz Ho, Kwok Ka Ho (12)",Liu Tsz Ling (76.9%)
NEXUS 1,Law Harry (16),Lau Ho Fung (11),Lau Ho Fung (84.6%)
United Services Recreation Club 1,"Choy Kit Lun Ivan, Lau Hugo Hin Yue (12)",Lau Hugo Hin Yue (9),Lau Hugo Hin Yue (75.0%)
X-Alpha 1,Kwan Wan Hei (15),"Kwan Wan Hei, Leung Chun Ho (12)","Liu Steve Tsun Man, Ma Tsz Lok (100.0%)"
