Home Team,Away Team,Venue,Match Week,Date,Overall Score,Rubbers,Home Score,Away Score,Home Games Won,Away Games Won,VenueType,Winner Rubber 1,Winner Rubber 2,Winner Rubber 3,Winner Rubber 4,Winner Rubber 5
MM Squash,X-Alpha 5,HK Squash Centre,1,03/10/2025,3-2,"['0-3', '3-2', '3-2', '3-0', '0-3']",3,2,9,10,home,X-Alpha 5,MM Squash,MM Squash,MM Squash,X-Alpha 5
Star River 2,Squashathon SocGen,Kwun Chung Sports Centre,1,03/10/2025,3-2,"['3-0', '3-0', '3-0', '1-3', '0-3']",3,2,10,6,neutral,Star River 2,Star River 2,Star River 2,Squashathon SocGen,Squashathon SocGen
The Squash Club 3,Craigengower Cricket Club,Pei Ho Street Sports Centre,1,03/10/2025,4-1,"['3-0', '0-3', '3-0', '3-0', 'CR']",4,1,12,3,home,The Squash Club 3,Craigengower Cricket Club,The Squash Club 3,The Squash Club 3,
Greenfield,North District Sports Association 1,Cornwall Street Squash Centre,1,03/10/2025,0-5,"['0-3', '0-3', '0-3', '0-3', '0-3']",0,5,0,15,home,North District Sports Association 1,North District Sports Association 1,North District Sports Association 1,North District Sports Association 1,North District Sports Association 1
Craigengower Cricket Club,North District Sports Association 1,Craigengower Cricket Club,2,10/10/2025,4-1,"['3-1', '3-0', '3-0', '3-0', '0-3']",4,1,12,4,home,Craigengower Cricket Club,Craigengower Cricket Club,Craigengower Cricket Club,Craigengower Cricket Club,North District Sports Association 1
Squashathon SocGen,The Squash Club 3,HK Squash Centre,2,10/10/2025,0-5,"['0-3', '0-3', '0-3', '0-3', '0-3']",0,5,0,15,home,The Squash Club 3,The Squash Club 3,The Squash Club 3,The Squash Club 3,The Squash Club 3
X-Alpha 5,Star River 2,Tai Po Sports Ground,2,10/10/2025,2-3,"['0-3', '1-3', '0-3', '3-1', '3-0']",2,3,7,10,home,Star River 2,Star River 2,Star River 2,X-Alpha 5,X-Alpha 5
Arctic Circle,MM Squash,Pei Ho Street Sports Centre,2,10/10/2025,4-1,"['3-1', '1-3', '3-2', '3-0', 'CR']",4,1,13,6,neutral,Arctic Circle,MM Squash,Arctic Circle,Arctic Circle,
