Team Name,Home,Average Home Score,Average Away Score,home_away_diff
Hong Kong Cricket Club M2A,Hong Kong Cricket Club,1.75,1.1666666666666667,0.5833333333333333
Hong Kong Football Club M2B,Hong Kong Football Club,3.3333333333333335,2.888888888888889,0.44444444444444464
Hong Kong Cricket Club M2B,Hong Kong Cricket Club,2.0,2.1666666666666665,-0.16666666666666652
Ladies Recreation Club M2A,Ladies Recreation Club,1.5,1.6666666666666667,-0.16666666666666674
Hong Kong Football Club M2A,Hong Kong Football Club,3.0,3.25,-0.25
Ladies Recreation Club M2B,Ladies Recreation Club,0.3333333333333333,0.625,-0.2916666666666667
