Team Name,Home,Average Home Score,Average Away Score,home_away_diff
Ladies Recreation Club M1,Ladies Recreation Club,0.8333333333333334,0.625,0.20833333333333337
Hong Kong Football Club M1B,Hong Kong Football Club,2.5,2.5,0.0
Hong Kong Football Club M1A,Hong Kong Football Club,2.0,2.1666666666666665,-0.16666666666666652
Hong Kong Cricket Club M1B,Hong Kong Cricket Club,1.3333333333333333,1.75,-0.41666666666666674
Hong Kong Cricket Club M1A,Hong Kong Cricket Club,0.8333333333333334,1.3333333333333333,-0.4999999999999999
