Team,Most Games,Most Wins,Highest Win Percentage
Electrify Squash Ladies,Kwong Yee Ki (8),Lum Suet Man Belinda (3),Lum Suet Man Belinda (60.0%)
Hong Kong Cricket Club L4,Leung Lilian Wai Shan (8),"Leung Lilian Wai Shan, Li Zoe (7)",Li Zoe (100.0%)
Hong Kong Football Club JSA,Le Angelina Elizabeth (6),"Morton Tess, Jue Lauren Kai Xin (5)","Morton Tess, Jue Lauren Kai Xin (100.0%)"
Hong Kong Football Club L4,"Wong Shuk Ting Ruby, Morton Mavis (9)",Wong Shuk Ting Ruby (4),Wong Shuk Ting Ruby (44.4%)
JESSICA L4,"Kwong Wai Nga DoDo, Ng Jessica Yuk Mui (8)",Kwong Wai Nga DoDo (7),"Chan Cheuk Yan, Kwok To Yan (100.0%)"
JESSICA Smashin' Mochi,Ho Chin Pik (12),Ho Chin Pik (4),Guttendorf Zoe (40.0%)
i-Mask Advance Squash Club L4,Lin Hei Chi Amber (7),Tsang Tze Nam (2),Tsang Tze Nam (33.3%)
