Team,Most Games,Most Wins,Highest Win Percentage
Friend Club 9,"Lau Si Chun, Kwan Wan Hei, Tse Ka Wing, Lau Wai Tung (17)",Lau Wai Tung (16),Lau Wai Tung (94.1%)
Global 3,Lau King Hin (13),Wong Nok Him (5),"Siu Han, Wong Nok Him, Yung Wai Ling (50.0%)"
Head Shatin 7,"Law Ian Chun Hin, Choi Ming Fung (17)",Law Ian Chun Hin (13),Chen Carlos Lei Xin (90.9%)
Hong Kong Cricket Club 8,Namboodiri Bharat (14),Namboodiri Bharat (8),Namboodiri Bharat (57.1%)
KYS 2,"Yeung Chun Yin Hector, Mok Shun Hei (15)",Liu Charmaine Hui Yee (10),Liu Charmaine Hui Yee (71.4%)
MoveOnLoL,Wong Tat Tsun (12),"Au Sheung Lai, Martin (6)","Au Sheung Lai, Martin (85.7%)"
Spirit 4,Hau Timothy (17),Hau Timothy (16),Hau Timothy (94.1%)
