Team,Rubber 1 Win %,Rubber 2 Win %,Rubber 3 Win %,Rubber 4 Win %,avg_win_perc,Total Rubbers
JESSICA L3,25.0,87.5,62.5,87.5,65.625,32
Hong Kong Cricket Club L3,55.55555555555556,44.44444444444444,55.55555555555556,75.0,57.638888888888886,35
Hong Kong Football Club L3B,77.77777777777779,50.0,50.0,50.0,56.94444444444444,31
Hong Kong Football Club L3A,77.77777777777779,50.0,37.5,16.666666666666664,45.48611111111111,31
Hong Kong Football Club L3C,11.11111111111111,22.22222222222222,44.44444444444444,12.5,22.569444444444443,35
