Team,Most Games,Most Wins,Highest Win Percentage
Kinetic 2,"Ling Yau Hang, Tam Wing Tung, Chan Ching Long (7)",Tam Wing Tung (5),Tam Wing Tung (71.4%)
LONGVIEW,Yiu Sai Ngoi (8),Chui Danny Kam Wah (1),Chui Danny Kam Wah (14.3%)
Physical Chess 3,"Tung Chun Keung Anson, Leong Chin Han (7)",Leong Chin Han (5),Leong Chin Han (71.4%)
Sha Tin 3,Li Ka Kit (8),"Chan Gabriel Emmanuel, Cheuk Chi Tak, Cheung Wai Kwong (5)",Chan Gabriel Emmanuel (100.0%)
Squashathon Zero,"Ng Terry Ka Ming, Wong Tsz Wang Clayton (6)","Cheng Chun Yin, Wong Tsz Wang Clayton (5)",Cheng Chun Yin (100.0%)
TOMCAT,Poon Hing Keung (8),Poon Hing Keung (5),Poon Hing Keung (62.5%)
i-Mask Advance Squash Club 2,"Chow Tat Keung, Ho Miu Sze, Ho Wai Kit Simon (7)",Ho Miu Sze (6),Ho Miu Sze (85.7%)
