Team,Rubber 1 Win %,Rubber 2 Win %,Rubber 3 Win %,Rubber 4 Win %,Rubber 5 Win %,avg_win_perc,Total Rubbers
United Services Recreation Club M3,50.0,75.0,100.0,87.5,87.5,80.0,40
Royal Hong Kong Yacht Club M3,100.0,88.88888888888889,66.66666666666666,55.55555555555556,66.66666666666666,75.55555555555554,45
Hong Kong Football Club M3A,62.5,75.0,75.0,75.0,85.71428571428571,74.64285714285714,39
Hong Kong Football Club M3B,62.5,50.0,50.0,50.0,50.0,52.5,40
Old Squash Fellows,87.5,75.0,37.5,12.5,37.5,50.0,40
Kowloon Cricket Club M3,22.22222222222222,11.11111111111111,33.33333333333333,66.66666666666666,25.0,31.666666666666664,44
Titlows Squash Team,0.0,22.22222222222222,22.22222222222222,44.44444444444444,33.33333333333333,24.444444444444443,45
Hong Kong Cricket Club M3,22.22222222222222,11.11111111111111,22.22222222222222,11.11111111111111,22.22222222222222,17.77777777777778,45
