Home Team,Away Team,Venue,Match Week,Date,Avg Simulated Home Points,Avg Simulated Away Points
Hong Kong Football Club L1,Hong Kong Cricket Club L1,Hong Kong Football Club,8,2026-04-09,3.2912912912912913,0.7087087087087087
JESSICA L1,Kowloon Cricket Club L1A,HK Squash Centre,8,2026-04-09,1.5525525525525525,2.4474474474474475
Kowloon Cricket Club L1A,Hong Kong Football Club L1,Kowloon Cricket Club,9,2026-04-23,2.235235235235235,1.7647647647647648
Hong Kong Cricket Club L1,Kowloon Cricket Club L1B,Hong Kong Cricket Club,9,2026-04-23,1.1361361361361362,2.863863863863864
Hong Kong Cricket Club L1,JESSICA L1,Hong Kong Cricket Club,10,2026-04-30,0.8408408408408409,3.159159159159159
Kowloon Cricket Club L1B,Hong Kong Football Club L1,Kowloon Cricket Club,10,2026-04-30,1.7447447447447448,2.255255255255255
