Team,Most Games,Most Wins,Highest Win Percentage
Banbil,"Swan Owen, Foo Chun Huey (6)",Foo Chun Huey (5),Foo Chun Huey (83.3%)
Bravo D10,Cheng Wing Hei Timothy (7),Smith Alexander (4),Smith Alexander (66.7%)
Craigengower Cricket Club,Lam Wilson Koon Fung (6),Lam Wilson Koon Fung (3),Lam Wilson Koon Fung (50.0%)
RELAY 1,Tse Man Hin (7),Tse Man Hin (6),Cheung Danny Yui Nam (100.0%)
Sha Tin 4,"Li Ka Kit, Wong Alan Yuk Lun (6)",Li Ka Kit (4),Li Ka Kit (66.7%)
The Hong Kong Jockey Club Div 10, (nan), (nan), (nan%)
United Services Recreation Club 3,Chu Lap Sun (7),"Chu Lap Sun, Mirapuri Rajesh (4)",Mirapuri Rajesh (66.7%)
