Team,Most Games,Most Wins,Highest Win Percentage
Kinetic 2,"Ling Yau Hang, Chan Ching Long, Tam Wing Tung (9)",Tam Wing Tung (6),Tam Wing Tung (66.7%)
LONGVIEW,Yiu Sai Ngoi (9),Chui Danny Kam Wah (1),Chui Danny Kam Wah (14.3%)
Physical Chess 3,Tung Chun Keung Anson (8),Leong Chin Han (5),Leong Chin Han (71.4%)
Sha Tin 3,Cheung Wai Kwong (10),Chan Gabriel Emmanuel (8),"Chan Gabriel Emmanuel, Chan Yin Fung (100.0%)"
Squashathon Zero,Ng Terry Ka Ming (9),Cheng Chun Yin (7),Cheng Chun Yin (87.5%)
TOMCAT,Poon Hing Keung (11),Poon Hing Keung (6),Chau Po Yin (71.4%)
i-Mask Advance Squash Club 2,Chow Tat Keung (10),Ho Miu Sze (8),"Chan Martin Lok Yin, Yung Lok (100.0%)"
