Team,Most Games,Most Wins,Highest Win Percentage
Hong Kong Cricket Club 5,Dickson Robert (11),"Shi Le, Dickson Robert (8)",Shi Le (88.9%)
Hong Kong Football Club 7A,Porter Darrell Lee (14),Porter Darrell Lee (10),Chan Niki Sin Hok (85.7%)
Kinetic 1,"Lau Lily Wun Cheung, Chan King Hei, Ma Andy  Man Cheung (9)",Tai Jacky Tsz Ki (7),Tai Jacky Tsz Ki (100.0%)
The Best Group 1,Au Alex Ka Man (17),"Au Alex Ka Man, Chan Hei Wai Henry, Wong Kin Tung (9)",Chan Hei Wai Henry (69.2%)
UST,Wong Chi Hang Frankie (11),Wong Chi Hang Frankie (10),Wong Chi Hang Frankie (90.9%)
Vitality Squash 1,Li Yi Wei (14),Toernell Henrik (5),Toernell Henrik (71.4%)
X-Alpha 3,Yau Yeung (14),Yau Yeung (11),Feng Weitao (80.0%)
