Team,Rubber 1 Win %,Rubber 2 Win %,Rubber 3 Win %,Rubber 4 Win %,avg_win_perc,Total Rubbers
Kowloon Cricket Club L2A,0.0,100.0,100.0,100.0,75.0,6
Kowloon Cricket Club L2B,50.0,100.0,50.0,100.0,75.0,7
Hong Kong Football Club L2B,33.33333333333333,100.0,100.0,33.33333333333333,66.66666666666666,12
Hong Kong Cricket Club L2,66.66666666666666,33.33333333333333,33.33333333333333,50.0,45.83333333333333,11
Hong Kong Football Club L2A,66.66666666666666,50.0,0.0,50.0,41.666666666666664,9
JESSICA L2 [withdrawal],0.0,0.0,0.0,0.0,0.0,0
