Team,Rubber 1 Win %,Rubber 2 Win %,Rubber 3 Win %,avg_win_perc
Hong Kong Football Club L3C,-26.666666666666657,20.0,6.666666666666671,7.105427357601002e-15
Hong Kong Cricket Club Rockettes,10.0,27.5,-37.5,0.0
i-Mask Advance Squash Club L3,-26.666666666666657,-10.0,12.5,-8.055555555555557
Hong Kong Football Club L3B,-6.666666666666657,40.0,-66.66666666666666,-11.1111111111111
JESSICA L3,-35.55555555555556,22.222222222222214,-57.777777777777786,-23.703703703703717
Hong Kong Football Club L3A,-41.66666666666666,0.0,-33.33333333333333,-24.999999999999993
