Team,Rubber 1 Win %,Rubber 2 Win %,Rubber 3 Win %,Rubber 4 Win %,avg_win_perc,Total Rubbers
JESSICA L2,85.71428571428571,57.14285714285714,85.71428571428571,42.857142857142854,67.85714285714285,28
Hong Kong Football Club L2B,57.14285714285714,85.71428571428571,57.14285714285714,66.66666666666666,66.66666666666666,27
Kowloon Cricket Club L2,50.0,83.33333333333334,66.66666666666666,60.0,65.0,23
Hong Kong Football Club L2A,57.14285714285714,28.57142857142857,28.57142857142857,71.42857142857143,46.42857142857143,28
Hong Kong Cricket Club L2,16.666666666666664,50.0,33.33333333333333,33.33333333333333,33.33333333333333,24
Hong Kong Football Club L2C,28.57142857142857,0.0,28.57142857142857,20.0,19.285714285714285,26
