Home Team,Away Team,Venue,Match Week,Date,Avg Simulated Home Points,Avg Simulated Away Points
Tuen Mun Squash Club,The Squash Club 3,Cornwall Street Squash Centre,22,2025-04-29,2.488048804880488,3.511951195119512
BOSS,Kinetic 3,Cornwall Street Squash Centre,22,2025-04-29,3.3166316631663166,2.6833683368336834
HKCC Tuesday Night Rockers,i-Mask Advance Squash Club 4,Hong Kong Cricket Club,22,2025-04-29,3.4639463946394637,2.5360536053605363
Sha Tin 5,7NT,Cornwall Street Squash Centre,22,2025-04-29,4.119211921192119,1.8807880788078808
Global Squash 2,Invader Squash,HK Squash Centre,22,2025-04-29,3.496749674967497,2.503250325032503
