Team,Most Games,Most Wins,Highest Win Percentage
8 Virtues + 1,Chen Alexander Kelin (11),"Chen Alexander Kelin, Cai Yuxi (8)",Cai Yuxi (80.0%)
Electrify Squash Div 14,Law Wing Kin (13),Law Wing Kin (8),"Yuen Kenneth Ka Fai, Sat Wai Yin (80.0%)"
Hong Kong Football Club 14A,Le Aaron Quang (13),Le Aaron Quang (10),Le Aaron Quang (76.9%)
Hong Kong Football Club 14B,Ikeda-Thew Bennett Masa (14),"Sachdeva Anant, Ikeda-Thew Bennett Masa (11)",Sachdeva Anant (91.7%)
Kowloon Cricket Club 14,Wong Yin Chi Aurelius (14),Wong Yin Chi Aurelius (11),Ho Peter (83.3%)
Ladies Recreation Club Div 14,Chen Peak Julian (16),Lien Brandon (14),Choe Yeda (100.0%)
North District Sports Association 3,"Fung Yau On, Wong Chi Kit (15)",Wong Chi Kit (11),Wong Chi Kit (73.3%)
X-Alpha 6,Wong Ting Ho (12),"Ma Tsz Wun, Wong Ting Ho (4)",Ma Tsz Wun (44.4%)
