Team,Most Games,Most Wins,Highest Win Percentage
Hong Kong Cricket Club L2,Hui Kwai Wah Monique (16),"Kwong Sarah Wing Yan, Hui Kwai Wah Monique (4)",Kwong Sarah Wing Yan (40.0%)
Hong Kong Football Club L2A,Wong Chung Ching Karen (13),Wong Chung Ching Karen (8),Wu Renee (70.0%)
Hong Kong Football Club L2B,Yeung Yurisa (16),Yeung Yurisa (11),Law Hei Yau (80.0%)
Hong Kong Football Club L2C,"Cheung Ka Man, Leung Tsz Shan (13)",Cassidy Makaela Lin (8),Cassidy Makaela Lin (72.7%)
JESSICA L2,Li Ka Man (17),Chung Yee Ling Elaine (15),Li Tsz Yau (100.0%)
Kowloon Cricket Club L2,Ho Ka Wing Janice (13),Tang Lok Yin (10),Tang Lok Yin (90.9%)
