Team,Most Games,Most Wins,Highest Win Percentage
Hong Kong Cricket Club M1A,"Chiu Ho Fai, Ekanayake Yeshan (10)",Chiu Ho Fai (6),Salahuddin (66.7%)
Hong Kong Cricket Club M1B,Head Phil (10),Head Phil (6),Kwong Anson Yu Shun (66.7%)
Hong Kong Football Club M1A,Lau Dick Siu Wai (12),Lau Dick Siu Wai (8),Pun Teddy (100.0%)
Hong Kong Football Club M1B,Ward Andrew (14),Ward Andrew (11),Schaefer Rishad (85.7%)
Ladies Recreation Club M1,"Caves Christopher, * Leung Adco (10)",* Leung Adco (4),* Leung Adco (40.0%)
