Team Name,Home,Average Home Score,Average Away Score,home_away_diff
United Services Recreation Club M4,United Services Recreation Club,3.5714285714285716,3.0,0.5714285714285716
Hong Kong Football Club M4B,Hong Kong Football Club,3.25,2.8,0.4500000000000002
Hong Kong Football Club M4A,Hong Kong Football Club,3.2,2.8,0.40000000000000036
WAKO,Masters - Harbour Road Sports Centre,2.5714285714285716,2.2,0.37142857142857144
Bolton,Masters - HK Squash Centre,1.1428571428571428,1.0,0.1428571428571428
Royal Hong Kong Yacht Club M4,Royal Hong Kong Yacht Club,2.2,2.3333333333333335,-0.1333333333333333
SKCSC,Masters - Cornwall Street Squash Centre,3.0,3.4285714285714284,-0.4285714285714284
Hong Kong Club Blue,HK CLUB,1.4,2.142857142857143,-0.7428571428571429
