Team,Most Games,Most Wins,Highest Win Percentage
FC 3,Chan Siu Kwan (13),Choi Kenny Wing Kin (12),"Choi Kenny Wing Kin, Liu Edmund Chi Fai, Kan Ken Chun Kit (100.0%)"
HKU,"Wong Chi Hang Frankie, Kwok Chi Hang (9)",Wong Chi Hang Frankie (6),Wong Chi Hang Frankie (66.7%)
Hong Kong Football Club 10A,"Derouet Yann, Rundle David Christopher (13)","Derouet Yann, Rundle David Christopher (11)",Watt Ben (90.9%)
Hong Kong Football Club 10B,Lulla Vikram (11),"Mulchand Rajesh, Lulla Vikram (7)",Mulchand Rajesh (70.0%)
Kowloon Cricket Club 10,Osmund Ronnie (14),Choi John Wing Yiu (12),Choi John Wing Yiu (100.0%)
Social Squash Team,Raducki Stephen (14),"Raducki Stephen, Catherine Loic (8)",Lim Marcus (100.0%)
The Best Group,Au Alex Ka Man (14),"Au Alex Ka Man, Andersson Greger, Chan Cheuk Kee (5)",Chan Cheuk Kee (50.0%)
The Hong Kong Jockey Club Div 10,Lee Dennis Yuk Kai (13),Shum Hin Yeung Almond (5),Shum Hin Yeung Almond (55.6%)
Twister 2,Wong Ken Tat Tai (12),Pang Chiu Mun (6),Pang Chiu Mun (75.0%)
