Team,Most Games,Most Wins,Highest Win Percentage
Alpha CUHK,Lin Chun Wah (21),Lin Chun Wah (18),Lin Chun Wah (85.7%)
Craigengower Cricket Club,Lam Wilson Koon Fung (19),Lam Wilson Koon Fung (13),Li Chung Him Samuel (73.3%)
HKPF Squash Team,Ko Toby Ho Yin (21),Ko Toby Ho Yin (20),Lau Shing Chung Simon (100.0%)
Hong Kong Racketlon Association 2,Chow Kar Wah (18),"Chow Kar Wah, Chan Tsz Yan Joyce (6)",Chan Tsz Yan Joyce (40.0%)
North District Sports Association 1,Lee Leo Chi Kin (17),Lee Leo Chi Kin (14),Chan Ho Lam (85.7%)
Sea Bear,Luk Jeffery Chi Heng (17),Wan Wan Lung (9),Wan Wan Lung (75.0%)
Sha Tin Squash Rackets Club 4,Wong Gary Ming Ho (21),Leung Siu Lun (14),Li Jacky Yan Fung (83.3%)
Star River 1,Wong Bao Kwong Chi (20),Pau Andy Chun Hung (13),Pau Andy Chun Hung (86.7%)
