Team,Most Games,Most Wins,Highest Win Percentage
Friend Club 6,Wong Wang Ching (10),"Wong Wang Ching, Tam Ming Wai (4)",Tam Ming Wai (80.0%)
Fusion Squash Club 2,Cheung Hiu Man (12),Cheung Hiu Man (10),Leung Ngo San (100.0%)
Happy Squash 3,Lau Sze Tung (15),Lau Sze Tung (9),Lau Cheuk Yan (83.3%)
Smart Squash 2,Chan Yan Chau (14),"Chan Yan Chau, Lee Hok Chung (7)",Chan One (80.0%)
Vitality Squash 2,Shapiro William Dat (12),Shapiro William Dat (9),"Shapiro William Dat, Kollar Thomas (75.0%)"
X-Alpha 4,Lau Hiu Wing (11),Lau Hiu Wing (10),"Tse Ka Chun, Tin Chung Hei, Chan Sze Long (100.0%)"
i-Mask Advance Squash Club 7,Li Ying Huen (8),Li Ying Huen (4),Li Ying Huen (50.0%)
i-Mask Advance Squash Club 8,"Leung Ka Hei, Tsoi Cheuk Hin Kieran (12)",Leung Ka Hei (11),Leung Ka Hei (91.7%)
