Team,Most Games,Most Wins,Highest Win Percentage
Friend Club 6,Wong Wang Ching (12),Wong Wang Ching (5),Tam Ming Wai (66.7%)
Fusion Squash Club 2,Cheung Hiu Man (14),Cheung Hiu Man (11),Leung Ngo San (100.0%)
Happy Squash 3,Lau Sze Tung (18),Lau Sze Tung (12),Lau Cheuk Yan (87.5%)
Smart Squash 2,Chan Yan Chau (16),"Chan Yan Chau, Lee Hok Chung (7)",Chan One (80.0%)
Vitality Squash 2,"Shapiro William Dat, Luk Argen (13)",Shapiro William Dat (10),Kollar Thomas (80.0%)
X-Alpha 4,Mo Shing Tsang (13),Tin Chung Hei (12),"Tse Ka Chun, Chan Sze Long, Tin Chung Hei (100.0%)"
i-Mask Advance Squash Club 7,Li Ying Huen (10),Li Ying Huen (5),Li Ying Huen (50.0%)
i-Mask Advance Squash Club 8,Tsoi Cheuk Hin Kieran (15),Leung Ka Hei (13),Leung Ka Hei (92.9%)
