Team,Most Games,Most Wins,Highest Win Percentage
Hong Kong Cricket Club 2,"^ Chiu Ho Fai, ^ Chiu Raymond Shung Hei (13)",^ Chiu Raymond Shung Hei (7),^ Chiu Raymond Shung Hei (53.8%)
Hong Kong Football Club 2,"Low Mark Chun Kit, Ward Andrew (10)",Low Mark Chun Kit (9),Low Mark Chun Kit (90.0%)
Kowloon Cricket Club 2A,"Law Yat Long, Wong Wing Kuen (12)","Lo Chris Cheuk Hin, Wong Wing Kuen, Ho Ka On (9)",Lo Chris Cheuk Hin (100.0%)
Kowloon Cricket Club 2B,Chan Linclon Wui Ki (13),Chan Linclon Wui Ki (10),Chan Linclon Wui Ki (76.9%)
Young Player 2,Lee Tin Hang (11),"Law Pak Ki Arthur, Tse Toby Yee Lam (5)",Law Pak Ki Arthur (71.4%)
