Team,Most Games,Most Wins,Highest Win Percentage
Hong Kong Cricket Club 2,"^ Chiu Ho Fai, ^ Chiu Raymond Shung Hei (14)","^ Chiu Ho Fai, ^ Chiu Raymond Shung Hei (7)","^ Chiu Ho Fai, ^ Chiu Raymond Shung Hei (50.0%)"
Hong Kong Football Club 2,Low Mark Chun Kit (11),Low Mark Chun Kit (10),Low Mark Chun Kit (90.9%)
Kowloon Cricket Club 2A,"Law Yat Long, Wong Wing Kuen (13)","Lo Chris Cheuk Hin, Wong Wing Kuen, Ho Ka On (10)",Lo Chris Cheuk Hin (100.0%)
Kowloon Cricket Club 2B,Chan Linclon Wui Ki (14),Chan Linclon Wui Ki (10),Chan Russell Chi Ho (75.0%)
Young Player 2,Lee Tin Hang (13),"Law Pak Ki Arthur, Tse Toby Yee Lam (5)",Law Pak Ki Arthur (71.4%)
