Team,Most Games,Most Wins,Highest Win Percentage
Friend Club 1,"Law Harry, Ko Sherlock Rafael (19)",Law Harry (17),Law Harry (89.5%)
Hong Kong Football Club 4A,Lee Tsz Long Max (18),Lee Tsz Long Max (8),Tsang Cheuk Fung (55.6%)
Hong Kong Football Club 4B,Cheung Parco (16),Chan Hok Nam (12),Chan Hok Nam (80.0%)
Kowloon Cricket Club 4,Chu Kenny King Chun (21),Yip Tsz Ho (17),Wan Tsz Ho (85.7%)
TNGX,"Mak Tsun Hin, Wai Wing Yin (21)",Wai Wing Yin (12),Wai Wing Yin (57.1%)
X-Alpha 1,Ho Kwan Yin (18),Ho Kwan Yin (16),Liu Steve Tsun Man (100.0%)
