Team,Most Games,Most Wins,Highest Win Percentage
Electrify Squash Div 5,"Egginton Matthew, * Wong Ryan Chun Hung (14)",Wong King Tat (5),Lee Chun Kit (50.0%)
Hong Kong Football Club 5,Chu Anthony Tian Ming (16),"Chan Nathaniel Rong Jye, Chu Anthony Tian Ming, Liu Sung Yan (10)",Chan Nathaniel Rong Jye (100.0%)
Kowloon Cricket Club 5,"Chu Ho Yin, Lai Michael Cheuk Fung (17)",Chu Ho Yin (14),Chan Joey Ho Ling (100.0%)
Sha Tin Squash Rackets Club 1,Chan Tsz Yeung (13),"Chan Tsz Yeung, Cheung Jason Kiu Yin, To Kai Kong (7)",Cheung Jason Kiu Yin (87.5%)
Squashathon,"Ng Tsz Chun, Leung Sum Nam (14)",Tang Hoo Lang (3),Tang Hoo Lang (33.3%)
United Services Recreation Club 1,Choy Kit Lun Ivan (15),Choy Kit Lun Ivan (12),Lau Hugo Hin Yue (87.5%)
X-Alpha 2,"* Leung Shiu Moon, Hui Ka Hei (14)",Hui Ka Hei (14),"Hui Ka Hei, Chui King Yin (100.0%)"
YLJR 1,Lam Yin Tung (13),Cheung Ka Hin (7),Cheung Ka Hin (63.6%)
i-Mask Advance Squash Club 1,Lee Ka Fai Peterson (13),"Chan Kai Lam, Ng Tin Long Curtiss (9)","Chan Kai Lam, Ng Tin Long Curtiss (75.0%)"
