Team,Most Games,Most Wins,Highest Win Percentage
Global Squash 1,Chan Lok Hin (14),Chan Lok Hin (13),Chan Lok Hin (92.9%)
Hong Kong Cricket Club 3,^ West Steven (13),^ West Steven (12),Caveney Barry John (100.0%)
Hong Kong Cricket Club 4,Janes Gareth (10),"Achouch Frank, Hoogendijk Mark, Janes Gareth (5)",Hoogendijk Mark (83.3%)
Hong Kong Football Club 8A,Ng Ho Ching (14),"Ng Ho Ching, Ng Adrian (10)",Ng Adrian (90.9%)
Hong Kong Football Club 8B,Scheepers Bradley (11),"Lo Kenneth Kin Cheung, Scheepers Bradley (4)",Lo Kenneth Kin Cheung (40.0%)
Kowloon Cricket Club 8,"Li Pinky Wing Shan, Cheng Tak Kwong (12)",Li Pinky Wing Shan (10),Au Jovi Chun Tat (100.0%)
Physical Chess 2,Yip Ho Cheong (11),"Leung Kwan Ching, Yip Ho Cheong (5)",Leung Kwan Ching (71.4%)
Sha Tin Squash Rackets Club 2,Cheung Ringo Hon Lam (15),Leung Kelvin Siu Fung (12),Leung Kelvin Siu Fung (85.7%)
United Services Recreation Club 2,"Yuen Tsz Long, Bidal Jay, Poon Ho Kar James (12)",Poon Ho Kar James (10),Poon Ho Kar James (83.3%)
