Team,Most Games,Most Wins,Highest Win Percentage
Hong Kong Cricket Club L2A,"Kwong Sarah Wing Yan, Hui Kwai Wah Monique, Wong Jessica Po Sze (16)",Hui Kwai Wah Monique (13),Hui Kwai Wah Monique (81.2%)
Hong Kong Cricket Club L2B,"Yip Melody Kwun Ting, Li Leanne Gi Ming (15)",Chan Suk Ting (4),Chan Suk Ting (30.8%)
Hong Kong Football Club L2A,Yeung Yurisa (15),Yeung Yurisa (13),Chung Ka Yau (90.0%)
Hong Kong Football Club L2B,Leung Tsz Shan (14),Lam Jillian (5),Lam Jillian (55.6%)
Hong Kong Football Club L2C,Cassidy Makaela Lin (14),Cassidy Makaela Lin (6),Tang Ching Sum (57.1%)
Kowloon Cricket Club L2,"Tang Lok Yin, Lau Wai Tung, Hau Venus (12)",Tang Lok Yin (12),"Tang Lok Yin, Wong Suet Ling, Leung Phoebe Hei Ting (100.0%)"
