Team,Most Games,Most Wins,Highest Win Percentage
Hong Kong Cricket Club L2A,"Hui Kwai Wah Monique, Wong Jessica Po Sze (20)",Hui Kwai Wah Monique (15),Hui Kwai Wah Monique (75.0%)
Hong Kong Cricket Club L2B,Li Leanne Gi Ming (18),Chan Suk Ting (5),Chan Suk Ting (33.3%)
Hong Kong Football Club L2A,Yeung Yurisa (20),Yeung Yurisa (17),Choi Celia Uen Shan (88.2%)
Hong Kong Football Club L2B,Leung Tsz Shan (17),Lam Jillian (6),Chiu Hau Ching (80.0%)
Hong Kong Football Club L2C,Cassidy Makaela Lin (19),"Li Clarissa, Cassidy Makaela Lin (6)",Tang Ching Sum (55.6%)
Kowloon Cricket Club L2,Tang Lok Yin (16),"Tang Lok Yin, Tung Wing Yan (14)",Wong Suet Ling (100.0%)
