Team,Most Games,Most Wins,Highest Win Percentage
Hong Kong Cricket Club L2A,"Kwong Sarah Wing Yan, Hui Kwai Wah Monique, Wong Jessica Po Sze (14)",Hui Kwai Wah Monique (11),Hui Kwai Wah Monique (78.6%)
Hong Kong Cricket Club L2B,"Yip Melody Kwun Ting, Li Leanne Gi Ming (13)",Chan Suk Ting (4),Chan Suk Ting (33.3%)
Hong Kong Football Club L2A,Yeung Yurisa (14),Yeung Yurisa (12),Chung Ka Yau (88.9%)
Hong Kong Football Club L2B,Leung Tsz Shan (12),Lam Jillian (4),Cheung Ka Man (60.0%)
Hong Kong Football Club L2C,Cassidy Makaela Lin (13),Cassidy Makaela Lin (6),Tang Ching Sum (66.7%)
Kowloon Cricket Club L2,"Lau Wai Tung, Hau Venus (11)",Tang Lok Yin (10),"Tang Lok Yin, Leung Phoebe Hei Ting (100.0%)"
