Team,Most Games,Most Wins,Highest Win Percentage
Hong Kong Cricket Club Rockettes,Kwok Alvina (10),"Ho Si Nuo, Peters Vivien (5)",Ho Si Nuo (83.3%)
Hong Kong Football Club L3A,Tse Ka Wing (10),Tse Ka Wing (8),"Tse Ka Wing, Wan Esther (80.0%)"
Hong Kong Football Club L3B,Chiu Hau Ching (11),Mishra Ipsa (9),Mishra Ipsa (100.0%)
Hong Kong Football Club L3C,Ho Hoi Kiu Bernice (11),"Tang Ching Sum, Ho Hoi Kiu Bernice (8)",Tang Ching Sum (80.0%)
JESSICA Smashin' Mochi,Leung Wai Kwan (11),Choi Angel Chung Yin (9),Chan Cheuk Yan (100.0%)
Physical Chess Ladies,Ku Wing Gi Vingi (9),Chan Siu Ting (7),Chan Siu Ting (100.0%)
The Squash Club Ladies,"Chung Tsam Yee, Ngan Joan (8)",Ngan Joan (2),Ngan Joan (25.0%)
