Team,Most Games,Most Wins,Highest Win Percentage
Hong Kong Cricket Club M1A,^ Chiu Ho Fai (12),^ Chiu Ho Fai (8),^ Chiu Ho Fai (66.7%)
Hong Kong Cricket Club M1B,"^ West Steven, Head Phil (9)",^ West Steven (6),^ West Steven (66.7%)
Hong Kong Football Club M1A,^ Ho Eric Chu Him (13),^ Ho Eric Chu Him (9),^ Yu Vincent Hok Yan (87.5%)
Hong Kong Football Club M1B,Ward Andrew (13),Ward Andrew (11),^ Lee Max Ho Yin (100.0%)
Ladies Recreation Club M1,Hill Peter (11),Nihalani Rajesh (7),Nihalani Rajesh (87.5%)
