Team,Most Games,Most Wins,Highest Win Percentage
Hong Kong Cricket Club M1A,^ Chiu Ho Fai (12),^ Chiu Ho Fai (8),^ Chiu Ho Fai (66.7%)
Hong Kong Cricket Club M1B,"^ West Steven, Head Phil (9)",^ West Steven (6),^ West Steven (66.7%)
Hong Kong Football Club M1A,^ Ho Eric Chu Him (11),^ Ho Eric Chu Him (8),^ Yu Vincent Hok Yan (85.7%)
Hong Kong Football Club M1B,Ward Andrew (12),Ward Andrew (10),^ Chiu Ho Ming (87.5%)
Ladies Recreation Club M1,Hill Peter (10),Nihalani Rajesh (6),Nihalani Rajesh (85.7%)
