Team,Most Games,Most Wins,Highest Win Percentage
Hong Kong Cricket Club M1A,^ Chiu Ho Fai (12),^ Chiu Ho Fai (8),^ Chiu Ho Fai (66.7%)
Hong Kong Cricket Club M1B,"^ West Steven, Head Phil (9)",^ West Steven (6),^ West Steven (66.7%)
Hong Kong Football Club M1A,^ Ho Eric Chu Him (12),"^ Ho Eric Chu Him, Pun Teddy (8)",^ Yu Vincent Hok Yan (85.7%)
Hong Kong Football Club M1B,Ward Andrew (13),Ward Andrew (11),^ Lee Max Ho Yin (100.0%)
Ladies Recreation Club M1,Hill Peter (10),Nihalani Rajesh (6),Nihalani Rajesh (85.7%)
