Team,Most Games,Most Wins,Highest Win Percentage
Hong Kong Cricket Club M2,"Janes Gareth, Caveney Barry John, Denham Paul, Ternes Daniel (10)",Denham Paul (9),Denham Paul (90.0%)
Hong Kong Football Club M2A,Wei Stephen J. (11),Li Samuel Kwok Sing (7),Hathiramani Dinesh (85.7%)
Hong Kong Football Club M2B,Lulla Vikram (12),"Mulchand Rajesh, Lulla Vikram (6)",Tanner Julian (66.7%)
Hong Kong Football Club M2C,Gates Stuart (12),Long Adrian (9),Long Adrian (100.0%)
Ladies Recreation Club M2,Adjemian Nicolas (10),Leung Chi On (6),Leung Chi On (85.7%)
Old Squash Fellows,Leung Dick Kan Fai (10),Leung Dick Kan Fai (9),Poon Sunny Yat Sing (100.0%)
Royal Hong Kong Yacht Club M2,Cheng Victor Kwok Wai (11),Cheng Victor Kwok Wai (8),Jones Robert F. (85.7%)
Titlows Squash Team,"Au Ming Chung Sampson, Lo Wai Kiu Bobby, Yung Kai Sing (13)","Au Ming Chung Sampson, Yung Kai Sing (2)","Au Ming Chung Sampson, Yung Kai Sing (15.4%)"
United Services Recreation Club M2,Bidal Jay (12),"Chow Ming Hei Quincy, Lai Kwok Wai Wilfred (7)",Chow Ming Hei Quincy (87.5%)
