Home Team,Away Team,Venue,Match Week,Date
Physical Chess 1,The Squash Club 1,Cornwall Street Squash Centre,19,2024-03-22
Hong Kong Football Club 7A,Happy Squash 2,Hong Kong Football Club,19,2024-03-22
Friend Club 2,Twister 1,Kwun Chung Sports Centre,19,2024-03-22
Hong Kong Racketlon Association 1,X-Alpha 3,Cornwall Street Squash Centre,19,2024-03-22
i-Mask Advance Squash Club 2,Kowloon Cricket Club 7,Cornwall Street Squash Centre,19,2024-03-22
Hong Kong Football Club 7B,Fusion Squash Club 1,Hong Kong Football Club,19,2024-03-22
