Home Team,Away Team,Venue,Match Week,Date
i-Mask Advance Squash Club 2,Hong Kong Racketlon Association 1,Cornwall Street Squash Centre,16,2024-03-01
Hong Kong Football Club 7B,Friend Club 2,Hong Kong Football Club,16,2024-03-01
Kowloon Cricket Club 7,Happy Squash 2,Kowloon Cricket Club,16,2024-03-01
X-Alpha 3,Physical Chess 1,Pei Ho Street Sports Centre,16,2024-03-01
Twister 1,The Squash Club 1,Cornwall Street Squash Centre,16,2024-03-01
Fusion Squash Club 1,Hong Kong Football Club 7A,HK Squash Centre,16,2024-03-01
