Team,Most Games,Most Wins,Highest Win Percentage
Centre Squash,"Bedouillat Vincent, Cheung Ka Lun Alan, Chevaux Alexander, Ren Jean-Philippe (7)","Bedouillat Vincent, Chevaux Alexander (4)",Grillo Francesco (60.0%)
Friend Club,"Ip Chun Keung, Wong Ho Sang (9)",Ip Chun Keung (9),Ip Chun Keung (100.0%)
HKPF Squash Team,Ko Toby Ho Yin (9),Ko Toby Ho Yin (8),Ko Toby Ho Yin (88.9%)
Hong Kong Football Club 9,Wei Mia Lynn (8),Wei Mia Lynn (5),Jones Robert F. (66.7%)
Kowloon Cricket Club 9,Wan Pauline Yuen Ping (8),Yim Man Ching (7),"Yim Man Ching, Cheung Coco Oi Yan (100.0%)"
Kwai Tsing District Squash Club,Ho Gary Ming Fai (9),Tsang Yan Kiu (7),Tsang Yan Kiu (100.0%)
The Best Group 2,"Andersson Greger, Chan Cheuk Kee (7)","Chan Cheuk Kee, Watt Ka Chun Ringo, Ho Sung Hon, Cheng Chi Wah (2)","Watt Ka Chun Ringo, Cheng Chi Wah (40.0%)"
i-Mask Advance Squash Club 3,Hegde Vishal (8),Kong Yuk Hang Jason (6),Kong Yuk Hang Jason (85.7%)
