Team,Most Games,Most Wins,Highest Win Percentage
Hong Kong Cricket Club M2A,Caveney Barry John (9),Caveney Barry John (6),Caveney Barry John (66.7%)
Hong Kong Cricket Club M2B,Janes Gareth (8),Janes Gareth (6),Janes Gareth (75.0%)
Hong Kong Football Club M2A,Pun Teddy (8),Pun Teddy (6),Wei Stephen J. (83.3%)
Hong Kong Football Club M2B,Gates Stuart (8),Gates Stuart (6),Derouet Yann (80.0%)
Ladies Recreation Club M2A,Amjad Nauman (8),Soo Euan Tsung Liang (6),Soo Euan Tsung Liang (100.0%)
Ladies Recreation Club M2B,Swan Owen (8),Swan Owen (4),Swan Owen (50.0%)
