Team,Most Games,Most Wins,Highest Win Percentage
Hong Kong Cricket Club 3,West Steven (8),West Steven (4),Ekanayake Yeshan (60.0%)
Hong Kong Football Club 4A,"Chan Cheuk Fung, Appan Janak (8)","Chan Cheuk Fung, Appan Janak (5)",Tsang Cheuk Fung (80.0%)
Hong Kong Football Club 4B,Lee Tsz Long Max (10),Khosa Ashwin (7),Khosa Ashwin (87.5%)
Kowloon Cricket Club 4,"Chan Shing Fung, Lai Michael Cheuk Fung (9)",Lai Michael Cheuk Fung (8),Lai Michael Cheuk Fung (88.9%)
NEXUS 2,Chu Ho Ching (8),Chan Kai Lam (4),Chan Kai Lam (80.0%)
Sha Tin 2,Leung Kelvin Siu Fung (9),Tam Kal Wai (2),Tam Kal Wai (33.3%)
United Services Recreation Club 1,Yuen Tsz Long (10),Yuen Tsz Long (7),"Yip Tony Tsun Yuen, Choy Kit Lun Ivan (85.7%)"
X-Alpha 1,Lai Pong Yin (9),Lai Pong Yin (9),"* Kwan Wan Hei, Lai Pong Yin, Kwan Wan Lok, Chan Lok Hin (100.0%)"
