Team,Most Games,Most Wins,Highest Win Percentage
Hong Kong Cricket Club 3,West Steven (8),West Steven (4),"Ekanayake Yeshan, West Steven (50.0%)"
Hong Kong Football Club 4A,"Chan Cheuk Fung, Appan Janak (8)","Chan Cheuk Fung, Appan Janak (5)",Tsang Cheuk Fung (80.0%)
Hong Kong Football Club 4B,Lee Tsz Long Max (11),Khosa Ashwin (8),Khosa Ashwin (88.9%)
Kowloon Cricket Club 4,Lai Michael Cheuk Fung (10),Lai Michael Cheuk Fung (9),Lai Michael Cheuk Fung (90.0%)
NEXUS 2,Chu Ho Ching (8),Chan Kai Lam (4),Chan Kai Lam (80.0%)
Sha Tin 2,Leung Kelvin Siu Fung (10),"Tam Kal Wai, Leung Ethan Ka Hin (2)",Tam Kal Wai (33.3%)
United Services Recreation Club 1,Yuen Tsz Long (10),Yuen Tsz Long (7),"Yip Tony Tsun Yuen, Choy Kit Lun Ivan (85.7%)"
X-Alpha 1,Lai Pong Yin (9),Lai Pong Yin (9),"* Kwan Wan Hei, Lai Pong Yin, Kwan Wan Lok, Chan Lok Hin (100.0%)"
