Team,Most Games,Most Wins,Highest Win Percentage
Hong Kong Football Club 8,"Ramachandran Arjun, Ng Alan Chi Fung, Kirpalani Shaun (8)",Ramachandran Arjun (7),Ramachandran Arjun (87.5%)
Kinetic 2,Lo Ching Yin (8),Law Tsz Long (2),Law Tsz Long (40.0%)
Ladies Recreation Club Div 8,"Rach Duncan Ai, * Park Yongho Joshua (8)",Rach Duncan Ai (8),Rach Duncan Ai (100.0%)
Physical Chess 3,Ng Matthew Ka Wai (7),Leung Sek Ho Kelvin (4),Leung Sek Ho Kelvin (66.7%)
Sha Tin 3,"Cheung Ringo Hon Lam, Chan Hoi Hei, Cheuk Chi Tak (7)",Cheuk Chi Tak (7),"Yiu Cheuk Hei, Cheuk Chi Tak, Cheung Wai Kwong (100.0%)"
Squashathon Zero,"Cheng Chun Yin, Chan Muk Kan (7)",Chan Muk Kan (5),Chan Muk Kan (71.4%)
Striving Squash,Lam Yuen Sarm (10),Lam Yuen Sarm (10),Lam Yuen Sarm (100.0%)
TOMCAT,Lam Alan Wing Lun (10),Poon Hing Keung (4),"Chau Po Yin, Ko Vincent Tak Kwan (60.0%)"
i-Mask Advance Squash Club 2,"Au Wai Lun, Chan Hei Ching Boris (8)",Au Wai Lun (6),Au Wai Lun (75.0%)
