Team,Most Games,Most Wins,Highest Win Percentage
Centre Squash,Bedouillat Vincent (9),"Bedouillat Vincent, Chevaux Alexander (5)",Chevaux Alexander (62.5%)
Friend Club,"Ip Chun Keung, Wong Ho Sang (11)",Ip Chun Keung (11),Ip Chun Keung (100.0%)
HKPF Squash Team,Ko Toby Ho Yin (11),Ko Toby Ho Yin (10),Ko Toby Ho Yin (90.9%)
Hong Kong Football Club 9,Wei Mia Lynn (9),Wei Mia Lynn (6),Wei Mia Lynn (66.7%)
Kowloon Cricket Club 9,Wan Pauline Yuen Ping (9),Yim Man Ching (8),"Yim Man Ching, Cheung Coco Oi Yan (100.0%)"
Kwai Tsing District Squash Club,Ho Gary Ming Fai (11),Tsang Yan Kiu (8),Tsang Yan Kiu (88.9%)
The Best Group 2,Andersson Greger (9),"Wong Rames Wang Lung, Chan Cheuk Kee, Ho Sung Hon, Cheng Chi Wah (3)","Ho Sung Hon, Cheng Chi Wah (42.9%)"
i-Mask Advance Squash Club 3,"Kong Yuk Hang Jason, Hegde Vishal (9)",Kong Yuk Hang Jason (7),Lee Wing Lam (83.3%)
