Team,Most Games,Most Wins,Highest Win Percentage
Hong Kong Cricket Club L2,"Wong Jessica Po Sze, Hui Kwai Wah Monique (9)","Kwong Sarah Wing Yan, Hui Kwai Wah Monique (3)",Kwong Sarah Wing Yan (42.9%)
Hong Kong Football Club L2A,Wong Chung Ching Karen (9),Wong Chung Ching Karen (7),Wong Chung Ching Karen (77.8%)
Hong Kong Football Club L2B,Yeung Yurisa (10),Yeung Yurisa (7),Chung Ka Yau (75.0%)
Hong Kong Football Club L2C,Leung Tsz Shan (9),Cassidy Makaela Lin (5),Cassidy Makaela Lin (83.3%)
JESSICA L2,Li Ka Man (11),"Chung Yee Ling Elaine, Li Tsz Yau (9)",Li Tsz Yau (100.0%)
Kowloon Cricket Club L2,Ho Ka Wing Janice (8),Lee Sum Yuet (6),Tung Wing Yan (100.0%)
