Team,Most Games,Most Wins,Highest Win Percentage
Banbil,Foo Chun Huey (17),Foo Chun Huey (15),Au Wing Yin Francis (100.0%)
Bravo D10,Cheng Wing Hei Timothy (14),"Smith Alexander, Chow Pui Sing (5)",Chow Pui Sing (100.0%)
Craigengower Cricket Club,"Lo Tien Yue, Lam Wilson Koon Fung (10)","Li Chung Him Samuel, Lam Wilson Koon Fung (3)",Li Chung Him Samuel (50.0%)
RELAY 1,"Tam Wai Nam, Yuen Tsun Kit, Tse Man Hin (17)","Tam Wai Nam, Cheung Danny Yui Nam (14)",Cheung Danny Yui Nam (93.3%)
Sha Tin 4,"Li Ka Kit, Wong Alan Yuk Lun (14)",Li Ka Kit (8),Li Ka Kit (57.1%)
The Hong Kong Jockey Club Div 10,"Wong Yu San, Woo Heng Che Stephen, Hsu Marvin, Tong Franco Sui Lun (11)","Wong Yu San, Woo Heng Che Stephen (11)","* Wong Aaron Wan Chong, Wong Yu San, Woo Heng Che Stephen (100.0%)"
United Services Recreation Club 3,Chu Lap Sun (16),"Chu Lap Sun, Leung Chi Wang Christopher (7)",Yam Ken Luen Kai (75.0%)
