Team,Most Games,Most Wins,Highest Win Percentage
Banbil,Foo Chun Huey (16),Foo Chun Huey (14),Au Wing Yin Francis (100.0%)
Bravo D10,Cheng Wing Hei Timothy (14),"Smith Alexander, Chow Pui Sing (5)",Chow Pui Sing (100.0%)
Craigengower Cricket Club,"Lo Tien Yue, Lam Wilson Koon Fung (10)","Li Chung Him Samuel, Lam Wilson Koon Fung (3)",Li Chung Him Samuel (50.0%)
RELAY 1,Yuen Tsun Kit (17),"Tam Wai Nam, Cheung Danny Yui Nam, Yuen Tsun Kit (13)",Cheung Danny Yui Nam (92.9%)
Sha Tin 4,"Li Ka Kit, Wong Alan Yuk Lun (13)",Li Ka Kit (7),Li Ka Kit (53.8%)
The Hong Kong Jockey Club Div 10,"Wong Yu San, Tong Franco Sui Lun (11)",Wong Yu San (11),"* Wong Aaron Wan Chong, Wong Yu San, Woo Heng Che Stephen (100.0%)"
United Services Recreation Club 3,Chu Lap Sun (15),Chu Lap Sun (7),Yam Ken Luen Kai (85.7%)
