Team,Most Games,Most Wins,Highest Win Percentage
Bolton,Gollop Stephen (17),Gollop Stephen (8),Gollop Stephen (47.1%)
Hong Kong Club Blue,"McLennan Justin, Kendall Charles Richard (15)","Brien Peter Wilhelm Hubert, Kendall Charles Richard (7)",Cox Simon (80.0%)
Hong Kong Football Club M4A,"Au Siu Fai, Murray David (17)",Au Siu Fai (16),"Ford Anthony, Chan Christine Yik Tat (100.0%)"
Hong Kong Football Club M4B,Rundle David Christopher (15),Rundle David Christopher (14),Rundle David Christopher (93.3%)
Royal Hong Kong Yacht Club M4,Oei Chuen Shek Joseph (17),Oei Chuen Shek Joseph (7),Dong Ka Chung Jacky (80.0%)
SKCSC,Chan Kin Hung Kit (21),Wong Tony Wing Tung (17),Wong Tony Wing Tung (89.5%)
United Services Recreation Club M4,Chu Lap Sun (20),"Leung Chi Wang Christopher, Daigneault Christian (12)","Wong Rames Wang Lung, Ku Wai Hang William (100.0%)"
WAKO,Yiu Sai Ngoi (20),Yiu Sai Ngoi (18),Yiu Sai Ngoi (90.0%)
