Team,Rubber 1 Win %,Rubber 2 Win %,Rubber 3 Win %,Rubber 4 Win %,avg_win_perc,Total Rubbers
Hong Kong Football Club L3B,75.0,100.0,50.0,50.0,68.75,16
JESSICA Smashin' Mochi,33.33333333333333,33.33333333333333,100.0,100.0,66.66666666666666,12
Hong Kong Cricket Club Rockettes,50.0,50.0,50.0,75.0,56.25,16
Hong Kong Football Club L3A,75.0,50.0,50.0,33.33333333333333,52.08333333333333,15
Physical Chess Ladies,80.0,20.0,50.0,33.33333333333333,45.83333333333333,17
Hong Kong Football Club L3C,60.0,60.0,20.0,40.0,45.0,20
The Squash Club Ladies,0.0,0.0,20.0,0.0,5.0,20
