Team,Rubber 1 Win %,Rubber 2 Win %,Rubber 3 Win %,Rubber 4 Win %,Rubber 5 Win %,avg_win_perc
United Services Recreation Club M2,100.0,50.0,100.0,50.0,50.0,70.0
Hong Kong Cricket Club M2,40.0,40.0,80.0,100.0,60.0,64.0
Hong Kong Football Club M2C,16.666666666666664,50.0,83.33333333333334,83.33333333333334,83.33333333333334,63.333333333333336
Hong Kong Football Club M2A,50.0,25.0,100.0,75.0,25.0,55.0
Royal Hong Kong Yacht Club M2,80.0,20.0,20.0,80.0,40.0,48.0
Ladies Recreation Club M2,20.0,60.0,20.0,40.0,20.0,32.0
Old Squash Fellows,75.0,75.0,0.0,0.0,0.0,30.0
Hong Kong Football Club M2B,50.0,50.0,25.0,0.0,25.0,30.0
Titlows Squash Team,20.0,0.0,0.0,0.0,25.0,9.0
