Team Name,Home,Average Home Score,Average Away Score,home_away_diff
Hong Kong Cricket Club M2A,Hong Kong Cricket Club,2.0,1.3333333333333333,0.6666666666666667
Hong Kong Football Club M2A,Hong Kong Football Club,3.0,2.5,0.5
Hong Kong Football Club M2B,Hong Kong Football Club,3.0,2.75,0.25
Ladies Recreation Club M2A,Ladies Recreation Club,1.6666666666666667,1.5,0.16666666666666674
Ladies Recreation Club M2B,Ladies Recreation Club,0.5,1.0,-0.5
Hong Kong Cricket Club M2B,Hong Kong Cricket Club,2.0,3.0,-1.0
