Team Name,Home,Average Home Score,Average Away Score,home_away_diff
Kowloon Cricket Club L2A,Kowloon Cricket Club,2.25,1.625,0.625
Hong Kong Football Club L2B,Hong Kong Football Club,3.6666666666666665,3.3333333333333335,0.33333333333333304
Hong Kong Cricket Club L2,Hong Kong Cricket Club,1.8888888888888888,1.8333333333333333,0.05555555555555558
JESSICA L2 [withdrawal],HK Squash Centre,0.0,0.0,0.0
Hong Kong Football Club L2A,Hong Kong Football Club,2.3333333333333335,2.5,-0.16666666666666652
Kowloon Cricket Club L2B,Kowloon Cricket Club,2.7142857142857144,3.2,-0.48571428571428577
