Team Name,Home,Average Home Score,Average Away Score,home_away_diff
Hong Kong Cricket Club M2A,Hong Kong Cricket Club,2.0,1.1666666666666667,0.8333333333333333
Hong Kong Football Club M2B,Hong Kong Football Club,3.2,2.888888888888889,0.31111111111111134
Hong Kong Cricket Club M2B,Hong Kong Cricket Club,2.0,2.0,0.0
Ladies Recreation Club M2A,Ladies Recreation Club,1.5714285714285714,1.6666666666666667,-0.09523809523809534
Hong Kong Football Club M2A,Hong Kong Football Club,3.0,3.142857142857143,-0.1428571428571428
Ladies Recreation Club M2B,Ladies Recreation Club,0.3333333333333333,0.7142857142857143,-0.380952380952381
