Team,Rubber 1 Win %,Rubber 2 Win %,Rubber 3 Win %,Rubber 4 Win %,avg_win_perc
Hong Kong Football Club L3A,33.33333333333334,66.66666666666666,33.33333333333333,0.0,33.33333333333333
JESSICA L3,-22.857142857142854,25.0,-25.0,42.85714285714286,5.0
Hong Kong Cricket Club L3,-7.142857142857146,23.80952380952381,-17.142857142857146,-40.0,-10.119047619047613
Hong Kong Football Club L3B,-50.0,33.33333333333333,-33.33333333333333,-16.66666666666667,-16.666666666666664
Hong Kong Football Club L3C,-25.0,0.0,0.0,-50.0,-18.75
