Team,Rubber 1 Win %,Rubber 2 Win %,Rubber 3 Win %,Rubber 4 Win %,Rubber 5 Win %,avg_win_perc,Total Rubbers
Kowloon Cricket Club L2B,55.55555555555556,77.77777777777779,77.77777777777779,100.0,100.0,82.22222222222223,34
Hong Kong Football Club L2B,55.55555555555556,87.5,75.0,71.42857142857143,0.0,57.8968253968254,32
Kowloon Cricket Club L2A,44.44444444444444,50.0,40.0,33.33333333333333,0.0,33.55555555555556,24
Hong Kong Football Club L2A,50.0,22.22222222222222,25.0,14.285714285714285,0.0,22.3015873015873,34
Hong Kong Cricket Club L2,44.44444444444444,12.5,25.0,28.57142857142857,0.0,22.1031746031746,32
