Team,Most Games,Most Wins,Highest Win Percentage
Happy Squash 1,Leung Ping Chak (9),Leung Ping Chak (7),"Seung Wai Ching, Leung Shun Wa Ethan (85.7%)"
Hong Kong Football Club 3A,Cheng Yu Ching (8),Cheng Yu Ching (8),Cheng Yu Ching (100.0%)
Hong Kong Football Club 3B,"Cassidy Cameron Michael, Anthony Nigel (9)",Cassidy Cameron Michael (7),Cassidy Cameron Michael (77.8%)
Kowloon Cricket Club 3A,Ho Ka On (9),"Ho Ka On, Lau Hok Yin Anthony (5)",Lau Hok Yin Anthony (100.0%)
Kowloon Cricket Club 3B,Yip Tsz Ho (10),Liu Tsz Ling (8),Liu Tsz Ling (88.9%)
NEXUS 1,Li Ho Hin (9),Lau Ho Fung (5),Lau Ho Fung (71.4%)
Sha Tin 1,"Tang Ethan Pui Lok, Yim Gi Ping (7)",Tang Ethan Pui Lok (3),Tang Ethan Pui Lok (42.9%)
TNGX,Mak Tsun Hin (12),Hon Michael Tsz San (9),Hon Michael Tsz San (81.8%)
Young Player 3,Wong Sze Yu (8),"Wong Sze Yu, Yeung Tsung Chit Karson, Wai Pak Lam (6)","Yeung Tsung Chit Karson, Wai Pak Lam (85.7%)"
