Team,Most Games,Most Wins,Highest Win Percentage
Bolton,"Gollop Stephen, Wright Martin (9)",Gollop Stephen (4),Gollop Stephen (44.4%)
Hong Kong Club Blue,Brien Peter Wilhelm Hubert (10),Brien Peter Wilhelm Hubert (6),Cox Simon (80.0%)
Hong Kong Football Club M4A,Au Siu Fai (10),Au Siu Fai (9),Ford Anthony (100.0%)
Hong Kong Football Club M4B,Rundle David Christopher (8),Rundle David Christopher (8),Rundle David Christopher (100.0%)
Royal Hong Kong Yacht Club M4,Oei Chuen Shek Joseph (9),Oei Chuen Shek Joseph (5),Dong Ka Chung Jacky (80.0%)
SKCSC,Chan Kin Hung Kit (12),Wong Tony Wing Tung (9),Wong Tony Wing Tung (90.0%)
United Services Recreation Club M4,Chu Lap Sun (11),"Leung Chi Wang Christopher, Daigneault Christian (7)",Daigneault Christian (100.0%)
WAKO,Yiu Sai Ngoi (11),Yiu Sai Ngoi (9),Yiu Sai Ngoi (81.8%)
