Team,Most Games,Most Wins,Highest Win Percentage
Hong Kong Cricket Club M2A,Grewal Harpreet (15),Caveney Barry John (7),Caveney Barry John (53.8%)
Hong Kong Cricket Club M2B,Janes Gareth (16),Janes Gareth (12),Janes Gareth (75.0%)
Hong Kong Football Club M2A,Pun Teddy (16),Pun Teddy (14),Long Adrian (100.0%)
Hong Kong Football Club M2B,Gates Stuart (16),"Gates Stuart, Derouet Yann (11)",Derouet Yann (91.7%)
Ladies Recreation Club M2A,Amjad Nauman (16),Soo Euan Tsung Liang (14),Soo Euan Tsung Liang (100.0%)
Ladies Recreation Club M2B,Swan Owen (16),Swan Owen (5),Joel Neoh Eu Jin (36.4%)
