Team,Rubber 1 Win %,Rubber 2 Win %,Rubber 3 Win %,Rubber 4 Win %,avg_win_perc,Total Rubbers
Hong Kong Football Club L2B,75.0,100.0,66.66666666666666,33.33333333333333,68.75,13
Kowloon Cricket Club L2A,25.0,100.0,50.0,100.0,68.75,9
Kowloon Cricket Club L2B,33.33333333333333,33.33333333333333,66.66666666666666,100.0,58.33333333333333,11
Hong Kong Football Club L2A,66.66666666666666,33.33333333333333,33.33333333333333,33.33333333333333,41.66666666666666,12
Hong Kong Cricket Club L2,50.0,0.0,33.33333333333333,33.33333333333333,29.166666666666664,13
