Team,Rubber 1 Win %,Rubber 2 Win %,Rubber 3 Win %,Rubber 4 Win %,avg_win_perc,Total Rubbers
JESSICA L3,33.33333333333333,84.61538461538461,66.66666666666666,72.72727272727273,64.33566433566433,48
Hong Kong Football Club L3B,64.28571428571429,64.28571428571429,53.84615384615385,50.0,58.104395604395606,51
Hong Kong Cricket Club L3,42.857142857142854,42.857142857142854,53.84615384615385,63.63636363636363,50.7992007992008,52
Hong Kong Football Club L3A,78.57142857142857,30.76923076923077,25.0,40.0,43.58516483516483,49
Hong Kong Football Club L3C,28.57142857142857,28.57142857142857,50.0,20.0,31.785714285714285,50
