Team Name,Home,Average Home Score,Average Away Score,home_away_diff
RELAY 1,Cornwall Street Squash Centre,2.4285714285714284,1.1666666666666667,1.2619047619047616
Vitality Squash 1,HK Squash Centre,3.5,2.2857142857142856,1.2142857142857144
Hong Kong Football Club 11,Hong Kong Football Club,3.3333333333333335,2.5714285714285716,0.7619047619047619
Banbil,HK Squash Centre,3.1666666666666665,3.0,0.16666666666666652
TOMCAT,Cornwall Street Squash Centre,1.8333333333333333,1.8333333333333333,0.0
Hong Kong Cricket Club 5,Hong Kong Cricket Club,1.2857142857142858,1.5,-0.2142857142857142
Xavier,Cornwall Street Squash Centre,3.5,3.8333333333333335,-0.3333333333333335
