Team Name,Home,Average Home Score,Average Away Score,home_away_diff
Vitality Squash 1,HK Squash Centre,3.5714285714285716,2.0,1.5714285714285716
RELAY 1,Cornwall Street Squash Centre,2.4285714285714284,1.4285714285714286,0.9999999999999998
Hong Kong Football Club 11,Hong Kong Football Club,3.142857142857143,2.25,0.8928571428571428
Banbil,HK Squash Centre,3.4285714285714284,2.857142857142857,0.5714285714285712
Xavier,Cornwall Street Squash Centre,3.625,3.4285714285714284,0.19642857142857162
TOMCAT,Cornwall Street Squash Centre,1.8571428571428572,1.8333333333333333,0.023809523809523947
Hong Kong Cricket Club 5,Hong Kong Cricket Club,1.2857142857142858,1.7142857142857142,-0.4285714285714284
