Team Name,Home,Average Home Score,Average Away Score,home_away_diff
Hong Kong Football Club 11,Hong Kong Football Club,3.4,2.1666666666666665,1.2333333333333334
RELAY 1,Cornwall Street Squash Centre,2.0,1.0,1.0
Vitality Squash 1,HK Squash Centre,3.6,2.8,0.8000000000000003
Banbil,HK Squash Centre,3.2,3.0,0.20000000000000018
TOMCAT,Cornwall Street Squash Centre,1.8333333333333333,1.75,0.08333333333333326
Hong Kong Cricket Club 5,Hong Kong Cricket Club,1.2,1.4,-0.19999999999999996
Xavier,Cornwall Street Squash Centre,3.6,3.8333333333333335,-0.2333333333333334
