Team Name,Home,Average Home Score,Average Away Score,home_away_diff
Vitality Squash 1,HK Squash Centre,3.5714285714285716,2.2857142857142856,1.285714285714286
RELAY 1,Cornwall Street Squash Centre,2.4285714285714284,1.4285714285714286,0.9999999999999998
Hong Kong Football Club 11,Hong Kong Football Club,3.142857142857143,2.5714285714285716,0.5714285714285712
Banbil,HK Squash Centre,3.1666666666666665,2.857142857142857,0.3095238095238093
TOMCAT,Cornwall Street Squash Centre,1.8571428571428572,1.8333333333333333,0.023809523809523947
Xavier,Cornwall Street Squash Centre,3.4285714285714284,3.4285714285714284,0.0
Hong Kong Cricket Club 5,Hong Kong Cricket Club,1.2857142857142858,1.7142857142857142,-0.4285714285714284
