Team Name,Home,Average Home Score,Average Away Score,home_away_diff
MERCURY,HK Squash Centre,2.727272727272727,1.2222222222222223,1.5050505050505047
Kinetic 1,Yuen Long Jockey Club Squash Courts,2.3333333333333335,1.4545454545454546,0.8787878787878789
Ladies Recreation Club Div 12,Ladies Recreation Club,1.8888888888888888,1.3636363636363635,0.5252525252525253
Studio Pro,Java Road Sports Centre,1.7272727272727273,1.2222222222222223,0.505050505050505
Hong Kong Cricket Club 6,Hong Kong Cricket Club,4.0,3.5454545454545454,0.4545454545454546
i-Mask Advance Squash Club 3,Cornwall Street Squash Centre,3.4,3.2,0.19999999999999973
Squashathon Zero,Cornwall Street Squash Centre,3.5454545454545454,3.5555555555555554,-0.010101010101009944
Sha Tin Squash Rackets Club 3,Cornwall Street Squash Centre,2.2,2.6,-0.3999999999999999
