Team Name,Home,Average Home Score,Average Away Score,home_away_diff
MERCURY,HK Squash Centre,2.8,1.1666666666666667,1.633333333333333
Hong Kong Cricket Club 6,Hong Kong Cricket Club,4.0,3.0,1.0
Ladies Recreation Club Div 12,Ladies Recreation Club,1.6,0.6666666666666666,0.9333333333333335
Kinetic 1,Yuen Long Jockey Club Squash Courts,2.1666666666666665,1.4,0.7666666666666666
Studio Pro,Java Road Sports Centre,2.3333333333333335,1.8,0.5333333333333334
i-Mask Advance Squash Club 3,Cornwall Street Squash Centre,3.4,3.1666666666666665,0.2333333333333334
Squashathon Zero,Cornwall Street Squash Centre,3.4,3.3333333333333335,0.06666666666666643
Sha Tin Squash Rackets Club 3,Cornwall Street Squash Centre,2.8333333333333335,3.0,-0.16666666666666652
