Team Name,Home,Average Home Score,Average Away Score,home_away_diff
MERCURY,HK Squash Centre,2.8,1.4,1.4
Hong Kong Cricket Club 6,Hong Kong Cricket Club,4.0,3.0,1.0
Kinetic 1,Yuen Long Jockey Club Squash Courts,2.4,1.4,1.0
Ladies Recreation Club Div 12,Ladies Recreation Club,1.6,0.6,1.0
Studio Pro,Java Road Sports Centre,2.6,1.8,0.8
i-Mask Advance Squash Club 3,Cornwall Street Squash Centre,3.4,3.0,0.3999999999999999
Squashathon Zero,Cornwall Street Squash Centre,3.4,3.2,0.19999999999999973
Sha Tin Squash Rackets Club 3,Cornwall Street Squash Centre,2.4,3.0,-0.6000000000000001
