Team Name,Home,Average Home Score,Average Away Score,home_away_diff
Smart Squash 2,Tai Po Sports Ground,3.1666666666666665,1.5,1.6666666666666665
Friend Club 6,Cornwall Street Squash Centre,2.2,0.6666666666666666,1.5333333333333337
Happy Squash 3,Wai Tsuen Sports Centre,3.0,1.6,1.4
i-Mask Advance Squash Club 7,Cornwall Street Squash Centre,1.8,0.4,1.4
i-Mask Advance Squash Club 8,HK Squash Centre,2.4,1.4,1.0
Fusion Squash Club 2,HK Squash Centre,3.5714285714285716,3.0,0.5714285714285716
X-Alpha 4,Pei Ho Street Sports Centre,5.0,4.571428571428571,0.4285714285714288
Vitality Squash 2,HK Squash Centre,2.5,2.5,0.0
