Team Name,Home,Average Home Score,Average Away Score,home_away_diff
Hong Kong Football Club 3A,Hong Kong Football Club,2.4285714285714284,2.142857142857143,0.2857142857142856
Young Player 3,HK Squash Centre,2.0,1.75,0.25
Happy Squash 1,Cornwall Street Squash Centre,2.2857142857142856,2.1666666666666665,0.11904761904761907
Hong Kong Football Club 3B,Hong Kong Football Club,2.1666666666666665,2.625,-0.4583333333333335
Kowloon Cricket Club 3,Kowloon Cricket Club,3.375,3.8333333333333335,-0.4583333333333335
