Team Name,Home,Average Home Score,Average Away Score,home_away_diff
Hong Kong Cricket Club 4,Hong Kong Cricket Club,3.3333333333333335,1.5,1.8333333333333335
Kowloon Cricket Club 8,Kowloon Cricket Club,3.2,1.6666666666666667,1.5333333333333334
Hong Kong Cricket Club 3,Hong Kong Cricket Club,3.25,1.75,1.5
Physical Chess 2,Cornwall Street Squash Centre,3.0,2.0,1.0
Global Squash 1,HK Squash Centre,3.6666666666666665,2.8,0.8666666666666667
Sha Tin Squash Rackets Club 2,Cornwall Street Squash Centre,2.2,1.6666666666666667,0.5333333333333334
Hong Kong Football Club 8B,Hong Kong Football Club,1.3333333333333333,1.4,-0.06666666666666665
Hong Kong Football Club 8A,Hong Kong Football Club,3.3333333333333335,3.5,-0.16666666666666652
United Services Recreation Club 2,United Services Recreation Club,2.6,3.0,-0.3999999999999999
