Team Name,Home,Average Home Score,Average Away Score,home_away_diff
Hong Kong Cricket Club 3,Hong Kong Cricket Club,3.5714285714285716,2.5,1.0714285714285716
Physical Chess 2,Cornwall Street Squash Centre,2.5,2.0,0.5
Kowloon Cricket Club 8,Kowloon Cricket Club,3.2857142857142856,2.8,0.48571428571428577
Hong Kong Cricket Club 4,Hong Kong Cricket Club,2.3333333333333335,2.1666666666666665,0.16666666666666696
Hong Kong Football Club 8A,Hong Kong Football Club,3.2,3.2857142857142856,-0.08571428571428541
Sha Tin Squash Rackets Club 2,Cornwall Street Squash Centre,1.8571428571428572,2.0,-0.1428571428571428
Hong Kong Football Club 8B,Hong Kong Football Club,1.0,1.1666666666666667,-0.16666666666666674
United Services Recreation Club 2,United Services Recreation Club,2.5,2.8333333333333335,-0.3333333333333335
Global Squash 1,HK Squash Centre,2.6,3.25,-0.6499999999999999
