Team Name,Home,Average Home Score,Average Away Score,home_away_diff
Hong Kong Cricket Club L2A,Hong Kong Cricket Club,2.6666666666666665,2.0,0.6666666666666665
Hong Kong Football Club L2C,Hong Kong Football Club,1.4,1.1666666666666667,0.23333333333333317
Kowloon Cricket Club L2,Kowloon Cricket Club,3.0,3.0,0.0
Hong Kong Cricket Club L2B,Hong Kong Cricket Club,0.8,0.8333333333333334,-0.033333333333333326
Hong Kong Football Club L2A,Hong Kong Football Club,3.0,3.4,-0.3999999999999999
Hong Kong Football Club L2B,Hong Kong Football Club,1.0,1.6,-0.6000000000000001
