Team Name,Home,Average Home Score,Average Away Score,home_away_diff
Hong Kong Cricket Club L2A,Hong Kong Cricket Club,2.857142857142857,1.8888888888888888,0.9682539682539684
Hong Kong Football Club L2C,Hong Kong Football Club,1.5714285714285714,1.25,0.3214285714285714
Kowloon Cricket Club L2,Kowloon Cricket Club,3.142857142857143,3.25,-0.1071428571428572
Hong Kong Football Club L2B,Hong Kong Football Club,0.8888888888888888,1.2857142857142858,-0.39682539682539697
Hong Kong Cricket Club L2B,Hong Kong Cricket Club,0.5555555555555556,1.0,-0.4444444444444444
Hong Kong Football Club L2A,Hong Kong Football Club,3.0,3.5,-0.5
