Team Name,Home,Average Home Score,Average Away Score,home_away_diff
Hong Kong Cricket Club Rockettes,Hong Kong Cricket Club,2.857142857142857,2.0,0.8571428571428572
The Squash Club Ladies,Cornwall Street Squash Centre,0.6666666666666666,0.14285714285714285,0.5238095238095237
Hong Kong Football Club L3C,Hong Kong Football Club,2.2857142857142856,1.8333333333333333,0.45238095238095233
JESSICA Smashin' Mochi,HK Squash Centre,2.5,2.142857142857143,0.3571428571428572
Physical Chess Ladies,Cornwall Street Squash Centre,1.8333333333333333,1.5,0.33333333333333326
Hong Kong Football Club L3A,Hong Kong Football Club,2.7142857142857144,2.4,0.3142857142857145
Hong Kong Football Club L3B,Hong Kong Football Club,2.6,2.5714285714285716,0.02857142857142847
