Team Name,Home,Average Home Score,Average Away Score,home_away_diff
Hong Kong Football Club M1A,Hong Kong Football Club,3.142857142857143,2.4,0.7428571428571429
Ladies Recreation Club M1,Ladies Recreation Club,2.5,2.0,0.5
Hong Kong Cricket Club M1B,Hong Kong Cricket Club,1.1428571428571428,0.8,0.34285714285714275
Hong Kong Cricket Club M1A,Hong Kong Cricket Club,1.3333333333333333,1.0,0.33333333333333326
Hong Kong Football Club M1B,Hong Kong Football Club,3.0,2.8333333333333335,0.16666666666666652
