Team Name,Home,Average Home Score,Average Away Score,home_away_diff
Hong Kong Football Club M3B,Hong Kong Football Club,2.0,1.0,1.0
Royal Hong Kong Yacht Club M3,Royal Hong Kong Yacht Club,2.625,2.2857142857142856,0.3392857142857144
Hong Kong Club Blue,HK CLUB,1.625,1.2857142857142858,0.3392857142857142
Phoenix,Masters - HK Squash Centre,4.25,4.428571428571429,-0.17857142857142883
Hong Kong Cricket Club M3,Hong Kong Cricket Club,2.625,3.0,-0.375
Hong Kong Football Club M3A,Hong Kong Football Club,3.0,3.375,-0.375
United Services Recreation Club M3,United Services Recreation Club,2.0,2.375,-0.375
Kowloon Cricket Club M3,Kowloon Cricket Club,3.142857142857143,3.625,-0.4821428571428572
Bolton,Masters - HK Squash Centre,0.6666666666666666,1.25,-0.5833333333333334
