Team,Rubber 1 Win %,Rubber 2 Win %,Rubber 3 Win %,Rubber 4 Win %,Rubber 5 Win %,avg_win_perc
Hong Kong Football Club M2A,33.33333333333333,-16.666666666666657,33.33333333333333,-3.333333333333343,33.33333333333334,15.999999999999993
United Services Recreation Club M2,12.5,37.5,23.214285714285715,-42.857142857142854,42.857142857142854,14.642857142857146
Hong Kong Cricket Club M2,12.5,-12.5,50.0,16.07142857142857,7.142857142857139,14.642857142857125
Ladies Recreation Club M2,50.0,0.0,-12.5,0.0,23.214285714285715,12.142857142857146
Hong Kong Football Club M2B,-3.333333333333343,6.666666666666671,43.333333333333336,-26.666666666666657,33.33333333333334,10.666666666666671
