Team,Rubber 1 Win %,Rubber 2 Win %,Rubber 3 Win %,Rubber 4 Win %,Rubber 5 Win %,avg_win_perc,Total Rubbers
Kowloon Cricket Club L2B,66.66666666666666,100.0,66.66666666666666,100.0,0.0,66.66666666666666,10
Hong Kong Football Club L2B,33.33333333333333,100.0,100.0,33.33333333333333,0.0,53.33333333333333,12
Kowloon Cricket Club L2A,0.0,50.0,100.0,100.0,0.0,50.0,8
Hong Kong Football Club L2A,66.66666666666666,50.0,0.0,50.0,0.0,33.33333333333333,9
Hong Kong Cricket Club L2,60.0,20.0,20.0,25.0,0.0,25.0,19
JESSICA L2 [withdrawal],0.0,0.0,0.0,0.0,0.0,0.0,0
