Team,Most Games,Most Wins,Highest Win Percentage
Hong Kong Football Club 2A,^ Lau Dick Siu Wai (16),"^ Lau Dick Siu Wai, ^ Ho Eric Chu Him (10)",Wong Arthur Man Pok (69.2%)
Hong Kong Football Club 2B,"^ Chiu Ho Fai, Ward Andrew (16)",^ Chiu Raymond Shung Hei (10),^ Chiu Raymond Shung Hei (71.4%)
Perrier Sergio Tacchini KCC 2A,"Law Yat Long, Ho Tze Ho Hugo, Chu Alex Kwok Kee (15)","Yeung Ho Wai, Ho Tze Ho Hugo (13)",Yeung Ho Wai (100.0%)
Perrier Sergio Tacchini KCC 2B,"Fung Ivan Ngo Long, Chan Nelson Kai Chi, Lau Hok Yin Anthony (15)",Lau Hok Yin Anthony (6),Fung Tsz Cheong (50.0%)
Young Player 4,Ho Samuel Ka Hei (13),Chung Yat Long (11),Chung Yat Long (100.0%)
