Team,Most Games,Most Wins,Highest Win Percentage
Arctic Circle,Wu Chi Wai (10),Choi Hiu Yeung (7),Choi Hiu Yeung (77.8%)
Craigengower Cricket Club,Tang Ka Yan (10),Tang Ka Yan (8),"Li Chung Him Samuel, Leung Wai Chun Hugo (100.0%)"
Greenfield,Young Ki Chun (10),Chan Kwok Wa (3),Chan Kwok Wa (33.3%)
MM Squash,Bachani Vinay Suresh (9),"Bachani Vinay Suresh, Chen Haoyuan (7)",Chen Haoyuan (87.5%)
North District Sports Association 1,Leung Yat Hei (10),Chau Yung Lok (7),Chau Yung Lok (87.5%)
Squashathon SocGen,Rambaud- Chanoz Nicolas (9),"Buxani Krish, Ho Cheuk Yiu (4)","Buxani Krish, Ho Cheuk Yiu (66.7%)"
Star River 2,Pang Danny King Wai (11),Li Zong Xiang (4),Li Zong Xiang (50.0%)
The Squash Club 3,Chong Siu Fung (11),Chong Siu Fung (10),"Chung Kwong Hei, Lam Yan Yu Hayley, Tam Ming Wai (100.0%)"
X-Alpha 5,Tse Tin Yui (9),Tse Tin Yui (6),Wong Kwun Hin (100.0%)
