Team,Most Games,Most Wins,Highest Win Percentage
Hong Kong Cricket Club L4,Verma Tara (7),Liu Yang (6),Liu Yang (100.0%)
Hong Kong Cricket Club Rockettes,Cumming Alison (10),"Cumming Alison, Lam Ka Yin (4)",Lam Ka Yin (57.1%)
Hong Kong Football Club JSA,Wong Yi Ching Mia (9),Wong Yi Ching Mia (6),Chiu Hau Yi (83.3%)
Hong Kong Football Club L4,"Le Angelina Elizabeth, Morton Mavis (7)",Ho Alexandra (4),Ho Alexandra (66.7%)
JESSICA L4,Leung Wai Kwan (9),"Leung Wai Kwan, So Hau Yi (7)","Choi Angel Chung Yin, So Hau Yi (100.0%)"
JESSICA Mochis,Pun Zhe Xin Keira (6),"Pun Zhe Xin Keira, Jin Olivia (4)",Jin Olivia (80.0%)
Kwai Tsing District Squash Club L4,Tsang Sin Kei Ophelia (9),Tsang Sin Kei Ophelia (9),Tsang Sin Kei Ophelia (100.0%)
Squashathon Ladies,"Ho Michelle Pak Wai, Chung Wing Yin, Chan Alice Yin Ling (5)",Ho Michelle Pak Wai (4),Ho Michelle Pak Wai (80.0%)
The Squash Club L4,Ngan Joan (9),"Ngan Joan, Wong Yeuk Yik (5)",Wong Yeuk Yik (62.5%)
