Team,Most Games,Most Wins,Highest Win Percentage
Hong Kong Cricket Club M2,"Head Phil, Achouch Frank, Janes Gareth (8)","Head Phil, Achouch Frank, Janes Gareth (6)","Head Phil, Achouch Frank, Janes Gareth (75.0%)"
Hong Kong Football Club M2A,Pun Teddy (10),Raducki Stephen (9),Raducki Stephen (100.0%)
Hong Kong Football Club M2B,"Gates Stuart, Scheepers Bradley (9)",Tulloch Gillem (5),Tulloch Gillem (83.3%)
Ladies Recreation Club M2,Moreu Horacio (10),"Moreu Horacio, Swan Owen (6)",Swan Owen (75.0%)
United Services Recreation Club M2,Muhammad Ilyas Gull (10),"Muhammad Ilyas Gull, Bidal Jay, Chow Ming Hei Quincy (2)","Bidal Jay, Chow Ming Hei Quincy (22.2%)"
