Team,Rubber 1 Win %,Rubber 2 Win %,Rubber 3 Win %,Rubber 4 Win %,avg_win_perc
Hong Kong Football Club M1A,16.666666666666686,0.0,16.666666666666686,33.33333333333334,16.666666666666686
Ladies Recreation Club M1,12.5,0.0,0.0,12.5,6.25
Hong Kong Cricket Club M1B,-16.666666666666664,-16.66666666666667,0.0,33.333333333333336,0.0
Hong Kong Cricket Club M1A,16.666666666666657,-16.666666666666664,-16.666666666666664,0.0,-4.166666666666664
Hong Kong Football Club M1B,0.0,-33.33333333333334,-33.33333333333334,16.666666666666657,-12.500000000000014
