Team Name,Home,Average Home Score,Average Away Score,home_away_diff
Hong Kong Football Club L2B,Hong Kong Football Club,3.0,2.0,1.0
Hong Kong Football Club L2C,Hong Kong Football Club,1.0,0.3333333333333333,0.6666666666666667
Kowloon Cricket Club L2,Kowloon Cricket Club,2.6666666666666665,2.6666666666666665,0.0
JESSICA L2,HK Squash Centre,2.6666666666666665,3.0,-0.3333333333333335
Hong Kong Football Club L2A,Hong Kong Football Club,1.5,2.0,-0.5
Hong Kong Cricket Club L2,Hong Kong Cricket Club,1.0,1.6666666666666667,-0.6666666666666667
