Team,Most Games,Most Wins,Highest Win Percentage
Kinetic 2,Tam Wing Tung (7),Tam Wing Tung (5),Tam Wing Tung (71.4%)
LONGVIEW,Yiu Sai Ngoi (7),Chui Danny Kam Wah (1),Chui Danny Kam Wah (16.7%)
Physical Chess 3,"Tung Chun Keung Anson, Leong Chin Han (6)",Leong Chin Han (4),Leong Chin Han (66.7%)
Sha Tin 3,"Cheung Wai Kwong, Li Ka Kit (7)",Cheung Wai Kwong (5),Cheuk Chi Tak (80.0%)
Squashathon Zero,"Ng Terry Ka Ming, Wong Tsz Wang Clayton (5)",Wong Tsz Wang Clayton (4),Wong Tsz Wang Clayton (80.0%)
TOMCAT,Poon Hing Keung (6),Poon Hing Keung (4),Poon Hing Keung (66.7%)
i-Mask Advance Squash Club 2,"Chow Tat Keung, Ho Miu Sze, Ho Wai Kit Simon (6)",Ho Miu Sze (5),Ho Miu Sze (83.3%)
