Team,Most Games,Most Wins,Highest Win Percentage
Hong Kong Cricket Club L4,"Verma Tara, Chiu Amber Elisabeth (5)","Verma Tara, Chiu Amber Elisabeth (0)","Verma Tara, Chiu Amber Elisabeth (0.0%)"
Hong Kong Cricket Club Rockettes,Cumming Alison (7),"Cumming Alison, Lam Ka Yin (3)",Lam Ka Yin (50.0%)
Hong Kong Football Club JSA,Wong Yi Ching Mia (6),Wong Yi Ching Mia (3),Wong Yi Ching Mia (50.0%)
Hong Kong Football Club L4,"Le Angelina Elizabeth, Morton Mavis (5)",Le Angelina Elizabeth (2),Le Angelina Elizabeth (40.0%)
JESSICA L4,Leung Wai Kwan (6),Leung Wai Kwan (4),Leung Wai Kwan (66.7%)
JESSICA Mochis, (nan), (nan), (nan%)
Kwai Tsing District Squash Club L4,"Tsang Sin Kei Ophelia, Tam Sum Yi (6)",Tsang Sin Kei Ophelia (6),Tsang Sin Kei Ophelia (100.0%)
Squashathon Ladies,"Ho Michelle Pak Wai, Chan Alice Yin Ling (5)",Ho Michelle Pak Wai (4),Ho Michelle Pak Wai (80.0%)
The Squash Club L4,"Chung Tsam Yee, Ngan Joan (6)",Ngan Joan (4),Ngan Joan (66.7%)
