Team,Most Games,Most Wins,Highest Win Percentage
Hong Kong Cricket Club L3,Ho Helen Sin Man (8),"Ho Helen Sin Man, Tang Ching On (5)",Tang Ching On (83.3%)
Hong Kong Football Club L3A,"Chan Niki Sin Hok, Law Tsz Ting (8)",Yang Sihan (6),Li Clarissa (100.0%)
Hong Kong Football Club L3B,Law Hei Yau (12),Law Hei Yau (8),"Law Hei Yau, Cheung Hei Kwai Myra, Mishra Ipsa (66.7%)"
Hong Kong Football Club L3C,Chui Jennifer (11),Tse Ka Wing (4),Tse Ka Wing (50.0%)
JESSICA L3,Au Shuk Ting (9),"Chan Cheuk Yan, Luo Wan Hei (7)","Chan Cheuk Yan, Luo Wan Hei (100.0%)"
