Team Name,Home,Convenor,Email
HEAD SHATIN 5,Cornwall Street (CSPSC),Chun Ming Lai,chunmlai@yahoo.com.hk
Hong Kong Cricket Club 17,Hong Kong Cricket Club (HKCC),Chris Clark,chrisbhclimited@gmail.com
i-Mask Advance Squash Club 11,Cornwall Street (CSPSC),Tat Chi Chow,chowsir30@gmail.com
Kinetic 6,Yeung Uk Road (YURSC),Harold Yiu Keung Low,haroldlow@yahoo.com.hk
PLZ,Cornwall Street (CSPSC),Ka Lun Chow,kalun19871211@hotmail.com
Smart Squash 3,Tai Po Sports Ground (TPSG),Alvin Ka Kit Lai,alvin_lai87@yahoo.com.hk
Spaghetti,Cornwall Street (CSPSC),Chun Hong Wong,wchjohn1@gmail.com
The Zero Squash Club D17,Cornwall Street (CSPSC),Michael Siu Ming Kwan,kekming@hotmail.com
