Team Name,Home,Convenor,Email
A Squash 1A,Cornwall Street (CSPSC),Wai Ching Seung,koseung101@hotmail.com
A Squash 1B,Cornwall Street (CSPSC),Wai Ching Seung,koseung101@hotmail.com
Hong Kong Football Club 5,Hong Kong Football Club (HKFC),Pieter Le ^ Roux,lerouxchiro@gmail.com
Howards Folly Wine LRC Div 5,Ladies Recreation Club (LRC),Samuel Jacob Gellman,sam.gellman@gmail.com
i-Mask Advance Squash Club 2,Cornwall Street (CSPSC),Tat Chi Chow,chowsir30@gmail.com
PERRIER SERGIO TACCHINI KCC 5,Kowloon Cricket Club (KCC),Chun Keung Tse,cktse@sjc.edu.hk
Physical Chess 1,Cornwall Street (CSPSC),Shui Lun Wilson Chan,squashphysicalchess@gmail.com
Smart Squash 2,Cornwall Street (CSPSC),Tsz Chun Ng,mikengmike1990@yahoo.com.hk
TNG 1,Cornwall Street (CSPSC),Anson Yu Shun Kwong,ansonkys@hotmail.com
