Team,Most Games,Most Wins,Highest Win Percentage
Hong Kong Cricket Club 3, (nan), (nan), (nan%)
Hong Kong Football Club 4A, (nan), (nan), (nan%)
Hong Kong Football Club 4B,"Khosa Ashwin, Lee Tsz Long Max (5)",Khosa Ashwin (5),Khosa Ashwin (100.0%)
Kowloon Cricket Club 4,Lai Michael Cheuk Fung (5),Lai Michael Cheuk Fung (4),Lai Michael Cheuk Fung (80.0%)
NEXUS 2, (nan), (nan), (nan%)
Sha Tin 2, (nan), (nan), (nan%)
United Services Recreation Club 1,"Yuen Tsz Long, da Silva Juan (5)",Yuen Tsz Long (4),Yuen Tsz Long (80.0%)
X-Alpha 1, (nan), (nan), (nan%)
