Team,Rubber 1 Win %,Rubber 2 Win %,Rubber 3 Win %,Rubber 4 Win %,avg_win_perc
Hong Kong Football Club L2C,33.33333333333333,0.0,33.33333333333333,0.0,16.666666666666664
JESSICA L2,25.0,-17.85714285714286,10.714285714285708,-16.66666666666667,0.2976190476190368
Hong Kong Football Club L2B,33.33333333333333,0.0,0.0,-33.33333333333334,0.0
Kowloon Cricket Club L2,-7.142857142857139,-25.0,42.85714285714286,-16.666666666666686,-1.4880952380952408
Hong Kong Football Club L2A,16.666666666666657,0.0,33.33333333333333,-66.66666666666667,-4.166666666666671
Hong Kong Cricket Club L2,3.3333333333333357,-30.0,3.3333333333333357,-33.33333333333333,-14.16666666666666
