Team,Rubber 1 Win %,Rubber 2 Win %,Rubber 3 Win %,Rubber 4 Win %,Rubber 5 Win %,avg_win_perc,Total Rubbers
Hong Kong Football Club M2A,58.333333333333336,50.0,58.333333333333336,72.72727272727273,90.9090909090909,66.06060606060608,58
Hong Kong Cricket Club M2,83.33333333333334,66.66666666666666,58.333333333333336,72.72727272727273,44.44444444444444,65.1010101010101,56
Ladies Recreation Club M2,41.66666666666667,75.0,75.0,25.0,25.0,48.333333333333336,60
Hong Kong Football Club M2B,54.54545454545454,27.27272727272727,36.36363636363637,63.63636363636363,54.54545454545454,47.272727272727266,55
United Services Recreation Club M2,9.090909090909092,27.27272727272727,18.181818181818183,18.181818181818183,33.33333333333333,21.21212121212121,53
