Team,Rubber 1 Win %,Rubber 2 Win %,Rubber 3 Win %,Rubber 4 Win %,avg_win_perc
Hong Kong Football Club M2B,60.0,20.0,-46.66666666666667,33.33333333333334,16.66666666666667
Hong Kong Cricket Club M2A,50.0,16.66666666666667,-41.66666666666666,16.66666666666667,10.416666666666671
Ladies Recreation Club M2B,0.0,-41.66666666666667,50.0,0.0,2.083333333333332
Hong Kong Cricket Club M2B,16.66666666666667,-16.666666666666657,8.333333333333343,-16.66666666666667,-2.0833333333333286
Hong Kong Football Club M2A,0.0,0.0,8.333333333333343,-25.0,-4.166666666666657
Ladies Recreation Club M2A,33.33333333333334,-8.333333333333329,-8.333333333333329,-33.33333333333333,-4.166666666666657
