Team,Rubber 1 Win %,Rubber 2 Win %,Rubber 3 Win %,Rubber 4 Win %,Rubber 5 Win %,avg_win_perc,Total Rubbers
Kowloon Cricket Club M3,100.0,100.0,100.0,100.0,50.0,90.0,10
Hong Kong Football Club M3A,50.0,100.0,75.0,75.0,75.0,75.0,20
Hong Kong Cricket Club M3,33.33333333333333,66.66666666666666,66.66666666666666,66.66666666666666,66.66666666666666,59.999999999999986,15
Hong Kong Football Club M3B,66.66666666666666,33.33333333333333,66.66666666666666,66.66666666666666,33.33333333333333,53.33333333333333,15
Royal Hong Kong Yacht Club M3,100.0,33.33333333333333,33.33333333333333,33.33333333333333,33.33333333333333,46.66666666666665,15
OSF,0.0,0.0,0.0,0.0,66.66666666666666,13.333333333333332,15
Titlows Squash Master,0.0,0.0,0.0,0.0,0.0,0.0,10
