Team,Most Games,Most Wins,Highest Win Percentage
Electrify Squash Ladies,Yeung Abby (6),"Kwong Yee Ki, Yeung Abby (1)",Kwong Yee Ki (20.0%)
Hong Kong Cricket Club L4,Li Zoe (7),Li Zoe (7),"Leung Lilian Wai Shan, Li Zoe (100.0%)"
Hong Kong Football Club JSA,Morton Tess (5),Morton Tess (5),Morton Tess (100.0%)
Hong Kong Football Club L4,Wong Shuk Ting Ruby (7),Wong Shuk Ting Ruby (4),Wong Shuk Ting Ruby (57.1%)
JESSICA L4,"Chan Cheuk Yan, Kwong Wai Nga DoDo, Ng Jessica Yuk Mui (5)","Chan Cheuk Yan, Kwong Wai Nga DoDo (5)","Chan Cheuk Yan, Kwong Wai Nga DoDo (100.0%)"
JESSICA Smashin' Mochi,Ho Chin Pik (9),Ho Chin Pik (4),Ho Chin Pik (44.4%)
i-Mask Advance Squash Club L4,Lin Hei Chi Amber (5),Lin Hei Chi Amber (1),Lin Hei Chi Amber (20.0%)
