Team,Most Games,Most Wins,Highest Win Percentage
Kinetic 2,"Ling Yau Hang, Chan Ching Long, Tam Wing Tung (9)",Tam Wing Tung (6),Tam Wing Tung (66.7%)
LONGVIEW,Yiu Sai Ngoi (8),Chui Danny Kam Wah (1),Chui Danny Kam Wah (14.3%)
Physical Chess 3,Tung Chun Keung Anson (8),Leong Chin Han (5),Leong Chin Han (71.4%)
Sha Tin 3,Cheung Wai Kwong (9),Chan Gabriel Emmanuel (7),"Chan Gabriel Emmanuel, Chan Yin Fung (100.0%)"
Squashathon Zero,Ng Terry Ka Ming (8),Cheng Chun Yin (6),Cheng Chun Yin (85.7%)
TOMCAT,Poon Hing Keung (10),Poon Hing Keung (5),Chau Po Yin (66.7%)
i-Mask Advance Squash Club 2,Chow Tat Keung (9),Ho Miu Sze (7),Chan Martin Lok Yin (100.0%)
