Team,Rubber 1 Win %,Rubber 2 Win %,Rubber 3 Win %,Rubber 4 Win %,Rubber 5 Win %,avg_win_perc,Total Rubbers
Hong Kong Cricket Club M2,85.71428571428571,57.14285714285714,57.14285714285714,71.42857142857143,50.0,64.28571428571428,34
Hong Kong Football Club M2A,66.66666666666666,33.33333333333333,66.66666666666666,66.66666666666666,83.33333333333334,63.33333333333333,30
Ladies Recreation Club M2,33.33333333333333,83.33333333333334,66.66666666666666,33.33333333333333,33.33333333333333,49.999999999999986,30
Hong Kong Football Club M2B,42.857142857142854,42.857142857142854,42.857142857142854,57.14285714285714,57.14285714285714,48.57142857142857,35
United Services Recreation Club M2,16.666666666666664,33.33333333333333,16.666666666666664,16.666666666666664,20.0,20.666666666666664,29
