Team Name,Home,Convenor,Email
Hong Kong Cricket Club L2,Hong Kong Cricket Club,Kwai Wah Monique Hui,moniquehui1025@gmail.com
Hong Kong Football Club L2A,Hong Kong Football Club,Chung Ching Karen Wong,wongchungchingkaren@yahoo.com.hk
Hong Kong Football Club L2B,Hong Kong Football Club,Yurisa Yeung,yurisa.yeung@gmail.com
Hong Kong Football Club L2C,Hong Kong Football Club,Tsz Shan Leung,kellythethen70@gmail.com
JESSICA L2,HK Squash Centre,Elise Jia Yunn Ng,elisen@hksi.org.hk
Kowloon Cricket Club L2,Kowloon Cricket Club,Phoebe Hei Ting Leung,phoebelht@gmail.com
