Team,Rubber 1 Win %,Rubber 2 Win %,Rubber 3 Win %,Rubber 4 Win %,avg_win_perc,Total Rubbers
Hong Kong Football Club M2A,80.0,20.0,75.0,100.0,68.75,18
Hong Kong Football Club M2B,57.14285714285714,71.42857142857143,66.66666666666666,75.0,67.5595238095238,24
Hong Kong Cricket Club M2B,50.0,75.0,75.0,50.0,62.5,14
Ladies Recreation Club M2A,80.0,40.0,20.0,40.0,45.0,20
Hong Kong Cricket Club M2A,0.0,33.33333333333333,66.66666666666666,16.666666666666664,29.166666666666664,24
Ladies Recreation Club M2B,16.666666666666664,50.0,0.0,0.0,16.666666666666664,20
