Home Team,Away Team,Venue,Match Week,Date,Avg Simulated Home Points,Avg Simulated Away Points
Studio Pro,Sha Tin Squash Rackets Club 3,Java Road Sports Centre,20,2024-04-12,2.2184218421842186,3.7815781578157814
Squashathon Zero,Hong Kong Cricket Club 6,Cornwall Street Squash Centre,20,2024-04-12,3.15021502150215,2.84978497849785
MERCURY,Kinetic 1,HK Squash Centre,20,2024-04-12,3.1458145814581457,2.8541854185418543
i-Mask Advance Squash Club 3,Ladies Recreation Club Div 12,Cornwall Street Squash Centre,20,2024-04-12,3.95039503950395,2.04960496049605
Ladies Recreation Club Div 12,MERCURY,Ladies Recreation Club,21,2024-04-19,3.565956595659566,2.434043404340434
Kinetic 1,Squashathon Zero,Yuen Long Jockey Club Squash Courts,21,2024-04-19,1.8484848484848484,4.151515151515151
Hong Kong Cricket Club 6,Studio Pro,Hong Kong Cricket Club,21,2024-04-19,4.647764776477648,1.3522352235223523
Sha Tin Squash Rackets Club 3,i-Mask Advance Squash Club 3,Cornwall Street Squash Centre,21,2024-04-19,2.465746574657466,3.534253425342534
