Home Team,Away Team,Venue,Match Week,Date,Avg Simulated Home Points,Avg Simulated Away Points
Hong Kong Football Club L1B,Kowloon Cricket Club L1B,Hong Kong Football Club,9,2024-02-01,0.51,3.49
Hong Kong Cricket Club L1,Kowloon Cricket Club L1A,Hong Kong Cricket Club,9,2024-02-01,1.4,2.6
Jessica,Hong Kong Football Club L1A,HK Squash Centre,9,2024-02-01,1.62,2.38
Kowloon Cricket Club L1B,Jessica,Kowloon Cricket Club,10,2024-03-07,2.3,1.7
Hong Kong Football Club L1A,Hong Kong Cricket Club L1,Hong Kong Football Club,10,2024-03-07,3.05,0.95
Kowloon Cricket Club L1A,Hong Kong Football Club L1B,Kowloon Cricket Club,10,2024-03-07,3.51,0.49
