Home Team,Away Team,Venue,Match Week,Date,Avg Simulated Home Points,Avg Simulated Away Points
Hong Kong Football Club L1B,Kowloon Cricket Club L1B,Hong Kong Football Club,9,2024-02-01,0.5158,3.4842
Hong Kong Cricket Club L1,Kowloon Cricket Club L1A,Hong Kong Cricket Club,9,2024-02-01,1.4094,2.5906
Jessica,Hong Kong Football Club L1A,HK Squash Centre,9,2024-02-01,1.6224,2.3776
Kowloon Cricket Club L1B,Jessica,Kowloon Cricket Club,10,2024-03-07,2.2668,1.7332
Hong Kong Football Club L1A,Hong Kong Cricket Club L1,Hong Kong Football Club,10,2024-03-07,3.1072,0.8928
Kowloon Cricket Club L1A,Hong Kong Football Club L1B,Kowloon Cricket Club,10,2024-03-07,3.5154,0.4846
