Home Team,Away Team,Venue,Match Week,Date,Avg Simulated Home Points,Avg Simulated Away Points
Hong Kong Cricket Club Rockettes,Hong Kong Football Club L3C,Hong Kong Cricket Club,20,2024-04-12,2.833283328332833,2.166716671667167
Hong Kong Football Club L3A,The Squash Club Ladies,Hong Kong Football Club,20,2024-04-12,4.291429142914291,0.7085708570857085
JESSICA Smashin' Mochi,Physical Chess Ladies,HK Squash Centre,20,2024-04-12,2.8128812881288128,2.1871187118711872
Hong Kong Football Club L3B,Physical Chess Ladies,Hong Kong Football Club,21,2024-04-19,3.193119311931193,1.8068806880688069
JESSICA Smashin' Mochi,Hong Kong Football Club L3A,HK Squash Centre,21,2024-04-19,2.214921492149215,2.785078507850785
The Squash Club Ladies,Hong Kong Cricket Club Rockettes,Cornwall Street Squash Centre,21,2024-04-19,1.0442044204420442,3.9557955795579556
