Home Team,Away Team,Venue,Match Week,Date,Avg Simulated Home Points,Avg Simulated Away Points
Royal Hong Kong Yacht Club M2,United Services Recreation Club M2,Royal Hong Kong Yacht Club,17,2024-03-07,2.369236923692369,3.630763076307631
Ladies Recreation Club M2,Titlows Squash Team,Ladies Recreation Club,17,2024-03-07,5.125712571257126,0.8742874287428742
Hong Kong Football Club M2C,Hong Kong Cricket Club M2,Hong Kong Football Club,17,2024-03-07,3.5336533653365336,2.4663466346634664
Hong Kong Cricket Club M2,Ladies Recreation Club M2,Hong Kong Cricket Club,18,2024-03-14,3.861986198619862,2.138013801380138
Titlows Squash Team,Old Squash Fellows,MTR Club House,18,2024-03-14,1.2885288528852885,4.711471147114711
Royal Hong Kong Yacht Club M2,Hong Kong Football Club M2A,Royal Hong Kong Yacht Club,18,2024-03-14,2.2839283928392837,3.7160716071607163
Hong Kong Football Club M2B,United Services Recreation Club M2,Hong Kong Football Club,18,2024-03-14,2.5414541454145416,3.4585458545854584
