Home Team,Away Team,Venue,Match Week,Date,Avg Simulated Home Points,Avg Simulated Away Points
Hong Kong Football Club M3B,Kowloon Cricket Club M3,Hong Kong Football Club,17,2024-03-07,2.1314,3.8686
United Services Recreation Club M3,Phoenix,United Services Recreation Club,17,2024-03-07,2.1842,3.8158
Hong Kong Club Blue,Hong Kong Football Club M3A,HK CLUB,17,2024-03-07,2.1958,3.8042
Bolton,Royal Hong Kong Yacht Club M3,Masters - HK Squash Centre,17,2024-03-07,1.7106,4.2894
Bolton,Hong Kong Club Blue,Masters - HK Squash Centre,18,2024-03-14,2.3786,3.6214
Hong Kong Football Club M3A,Phoenix,Hong Kong Football Club,18,2024-03-14,2.5954,3.4046
United Services Recreation Club M3,Hong Kong Football Club M3B,United Services Recreation Club,18,2024-03-14,3.7496,2.2504
Kowloon Cricket Club M3,Hong Kong Cricket Club M3,Kowloon Cricket Club,18,2024-03-14,3.4062,2.5938
