Home Team,Away Team,Venue,Match Week,Date,Avg Simulated Home Points,Avg Simulated Away Points
Bolton,Royal Hong Kong Yacht Club M3,Masters - HK Squash Centre,17,2024-03-07,1.5962596259625963,4.403740374037404
Bolton,Hong Kong Club Blue,Masters - HK Squash Centre,18,2024-03-14,2.3485348534853485,3.6514651465146515
Hong Kong Football Club M3A,Phoenix,Hong Kong Football Club,18,2024-03-14,2.6245624562456245,3.3754375437543755
United Services Recreation Club M3,Hong Kong Football Club M3B,United Services Recreation Club,18,2024-03-14,3.822882288228823,2.177117711771177
Kowloon Cricket Club M3,Hong Kong Cricket Club M3,Kowloon Cricket Club,18,2024-03-14,3.5306530653065304,2.4693469346934696
