Team,Most Games,Most Wins,Highest Win Percentage
Happy Squash 1,Leung Ping Chak (17),Leung Ping Chak (15),Seung Wai Ching (93.3%)
Hong Kong Football Club 3A,Huang Sidney Victor (14),"Huang Sidney Victor, Cheng Yu Ching (12)",Cheng Yu Ching (92.3%)
Hong Kong Football Club 3B,Anthony Nigel (14),Cassidy Cameron Michael (9),Cassidy Cameron Michael (69.2%)
Kowloon Cricket Club 3A,Ho Ka On (18),"Ho Ka On, Lau Hok Yin Anthony (11)",Lau Hok Yin Anthony (91.7%)
Kowloon Cricket Club 3B,Yip Tsz Ho (16),Liu Tsz Ling (12),Wan Tsz Ho (100.0%)
NEXUS 1,Li Ho Hin (13),Law Harry (8),Lau Ho Fung (75.0%)
Sha Tin 1,Tang Ethan Pui Lok (14),Tang Ethan Pui Lok (8),Cheung Jason Kiu Yin (60.0%)
TNGX,Mak Tsun Hin (16),Hon Michael Tsz San (11),Hon Michael Tsz San (73.3%)
Young Player 3,Wong Sze Yu (16),"Law Pak Ho Cyrus, Wai Pak Lam (11)",Wai Pak Lam (84.6%)
