Team,Most Games,Most Wins,Highest Win Percentage
Electrify Squash Ladies,Kwong Yee Ki (9),"Kwong Yee Ki, Lum Suet Man Belinda (3)",Lum Suet Man Belinda (42.9%)
Hong Kong Cricket Club L4,Leung Lilian Wai Shan (10),Leung Lilian Wai Shan (9),"Liu Yang, Li Zoe (100.0%)"
Hong Kong Football Club JSA,Le Angelina Elizabeth (8),"Morton Tess, Jue Lauren Kai Xin (6)","Hung Wai Tung, Morton Tess, Jue Lauren Kai Xin (100.0%)"
Hong Kong Football Club L4,"Wong Shuk Ting Ruby, Morton Mavis (11)",Wong Shuk Ting Ruby (6),Fong Chui Ping (80.0%)
JESSICA L4,Kwong Wai Nga DoDo (10),Kwong Wai Nga DoDo (8),"Chan Cheuk Yan, Kwok To Yan (100.0%)"
JESSICA Smashin' Mochi,Ho Chin Pik (13),Ho Chin Pik (5),"Guttendorf Zoe, Pun Zhe Qiao Kimi (42.9%)"
i-Mask Advance Squash Club L4,Lin Hei Chi Amber (11),"Tsang Tze Nam, Lin Hei Chi Amber (2)",Tsang Tze Nam (33.3%)
