Team,Rubber 1 Win %,Rubber 2 Win %,Rubber 3 Win %,Rubber 4 Win %,avg_win_perc,Total Rubbers
Hong Kong Football Club M2B,50.0,90.0,60.0,87.5,71.875,38
Hong Kong Football Club M2A,80.0,20.0,66.66666666666666,66.66666666666666,58.33333333333333,38
Hong Kong Cricket Club M2A,50.0,50.0,50.0,50.0,50.0,40
Hong Kong Cricket Club M2B,30.0,50.0,60.0,37.5,44.375,38
Ladies Recreation Club M2A,80.0,30.0,30.0,14.285714285714285,38.57142857142857,37
Ladies Recreation Club M2B,10.0,60.0,33.33333333333333,33.33333333333333,34.166666666666664,35
