Position,Name of Player,Team,Average Points,Total Game Points,Games Played,Won,Lost,Division,Win Percentage
1,Law Hong Ting Kelvin,Global Squash 2,26.2,393,15,14,1,11,0.9333333333333333
2,Tsoi Keith Tsz Fung,Sha Tin 5,24.21,339,14,12,2,11,0.8571428571428571
3,Poon Raymond Wai Man,Sha Tin 5,24.2,363,15,15,0,11,1.0
4,Brettell Dominic,Invader Squash,23.25,186,8,6,2,11,0.75
5,Ma Charles Chun Fung,Tuen Mun Squash Club,23.18,255,11,9,2,11,0.8181818181818182
6,Cheng Jonathan Yee Fung,Global Squash 2,21.69,282,13,10,3,11,0.7692307692307693
7,Ngan Wynn,The Squash Club 3,21.0,294,14,9,5,11,0.6428571428571429
8,Kumar Raj,HKCC Tuesday Night Rockers,20.7,207,10,7,3,11,0.7
9,Chung Tsam Yee,The Squash Club 3,20.18,222,11,11,0,11,1.0
10,Wan Man Fai,Kinetic 3,19.09,210,11,10,1,11,0.9090909090909091
11,Chan Connal Tak Kay,Star River 1,19.07,267,14,12,2,11,0.8571428571428571
12,Lam Yan Yu Hayley,The Squash Club 3,18.75,150,8,6,2,11,0.75
13,Ko Sze Chai Cedric,7NT,18.6,186,10,9,1,11,0.9
14,Sun Ka Ip Justin Edmund,i-Mask Advance Squash Club 4,18.43,129,7,3,4,11,0.42857142857142855
15,Leung Kwok Wai,Star River 1,18.38,294,16,6,10,11,0.375
16,Pau Andy Chun Hung,Star River 1,18.27,201,11,7,4,11,0.6363636363636364
17,Poole-Wilson Michael,HKCC Tuesday Night Rockers,17.67,159,9,9,0,11,1.0
18,Hui Prodipto,Kinetic 3,17.4,174,10,3,7,11,0.3
19,Ho Wai Ying,BOSS,16.85,219,13,6,7,11,0.46153846153846156
20,Chau Hang Henry,Kinetic 3,16.67,150,9,9,0,11,1.0
21,Lau Ho Wing,Tuen Mun Squash Club,16.5,132,8,5,3,11,0.625
22,Hui Adrian Wai Hung,7NT,16.5,165,10,3,7,11,0.3
23,Yeung Leo Kin Lai,i-Mask Advance Squash Club 4,16.5,99,6,2,4,11,0.3333333333333333
24,Wong Kwok Hee,Tuen Mun Squash Club,16.36,180,11,8,3,11,0.7272727272727273
25,Bernard Edwin,HKCC Tuesday Night Rockers,16.33,147,9,4,5,11,0.4444444444444444
26,Fan Da Jong,Global Squash 2,16.2,162,10,7,3,11,0.7
27,Tsang Patrick Hing Suen,Tuen Mun Squash Club,16.2,81,5,5,0,11,1.0
28,Bradbury Adrian,HKCC Tuesday Night Rockers,15.9,159,10,6,4,11,0.6
29,Fong Wai Kuen,BOSS,15.86,222,14,8,6,11,0.5714285714285714
30,Ip Thomas Shun Moon,BOSS,15.64,219,14,11,3,11,0.7857142857142857
31,Chan Thomas Tsz Sau,The Squash Club 3,15.0,105,7,5,2,11,0.7142857142857143
32,Tang Keng Io,Kinetic 3,15.0,180,12,3,9,11,0.25
33,Li Kelvin Hon Hun,BOSS,14.75,177,12,2,10,11,0.16666666666666666
34,Chung Kwong Hei,The Squash Club 3,14.57,102,7,6,1,11,0.8571428571428571
35,Ma Chun Wah,Tuen Mun Squash Club,14.4,144,10,3,7,11,0.3
36,Liu Vincent Wing Sang,Invader Squash,14.25,228,16,4,12,11,0.25
37,To Felix Ka Hei,Kinetic 3,14.0,126,9,4,5,11,0.4444444444444444
38,Chan Raymond Tsan Fai,7NT,13.67,123,9,1,8,11,0.1111111111111111
39,Hui Man Fai,i-Mask Advance Squash Club 4,13.64,150,11,2,9,11,0.18181818181818182
40,Ko Yat Ming,Tuen Mun Squash Club,13.29,93,7,6,1,11,0.8571428571428571
41,Fung Wing Hing,Sha Tin 5,13.2,198,15,5,10,11,0.3333333333333333
42,Au Wai Keung,i-Mask Advance Squash Club 4,13.0,156,12,9,3,11,0.75
43,Wai Brian Hok Chun,Sha Tin 5,12.86,90,7,4,3,11,0.5714285714285714
44,Chan Pak Lun,Sha Tin 5,12.75,153,12,10,2,11,0.8333333333333334
45,Griffiths John David,HKCC Tuesday Night Rockers,12.69,165,13,5,8,11,0.38461538461538464
46,Luk Raymond Yiu Fai,BOSS,12.3,123,10,8,2,11,0.8
47,Cheng Kathy Ka Wai,i-Mask Advance Squash Club 4,12.27,135,11,8,3,11,0.7272727272727273
48,Lou Eddie Kuong Fai,i-Mask Advance Squash Club 4,12.0,84,7,4,3,11,0.5714285714285714
49,Yip Nigel Wing Kei,7NT,12.0,72,6,2,4,11,0.3333333333333333
50,Ngan Xyan,The Squash Club 3,12.0,60,5,1,4,11,0.2
51,Wong Wilson Wai Shing,Kinetic 3,11.57,81,7,5,2,11,0.7142857142857143
52,Ho Yu Hin Kenneth,Star River 1,11.0,99,9,7,2,11,0.7777777777777778
53,Yung Kai Sing,7NT,11.0,132,12,5,7,11,0.4166666666666667
54,Leung Freddie Ping Wah,Invader Squash,10.88,174,16,6,10,11,0.375
55,Chan Penny Miu Kwan,Sha Tin 5,10.5,105,10,8,2,11,0.8
56,Chong Tin Hang,i-Mask Advance Squash Club 4,10.5,147,14,3,11,11,0.21428571428571427
57,Poon Kings Kin Sun,Invader Squash,10.38,135,13,2,11,11,0.15384615384615385
58,Lee Henry Kwok Chung,Kinetic 3,10.2,51,5,2,3,11,0.4
59,Cheng Chi Kin Austin,Tuen Mun Squash Club,9.86,69,7,2,5,11,0.2857142857142857
59,Wong Him Yui,The Squash Club 3,9.86,69,7,2,5,11,0.2857142857142857
61,Cheung Chi Hei,Global Squash 2,9.5,114,12,4,8,11,0.3333333333333333
62,Lai Herbert Chan Wah,Star River 1,9.0,81,9,5,4,11,0.5555555555555556
63,Chan Willie Wai Hung,Invader Squash,8.57,60,7,3,4,11,0.42857142857142855
64,Vera Henry,HKCC Tuesday Night Rockers,7.88,63,8,4,4,11,0.5
65,Chu Chun Yin,Tuen Mun Squash Club,7.8,39,5,2,3,11,0.4
66,Ang Cheung Yue,The Squash Club 3,7.8,39,5,1,4,11,0.2
67,Pang Danny King Wai,Star River 1,7.75,93,12,3,9,11,0.25
68,Wong Michael,BOSS,7.5,60,8,3,5,11,0.375
69,Poon Patrick Lai Keung,Star River 1,7.36,81,11,1,10,11,0.09090909090909091
70,Man Hok Him,7NT,7.33,66,9,3,6,11,0.3333333333333333
71,Wong Simpson Yau Shan,Invader Squash,7.09,78,11,4,7,11,0.36363636363636365
72,Healy Richard,HKCC Tuesday Night Rockers,7.0,42,6,1,5,11,0.16666666666666666
73,Vaswani Arun,Kinetic 3,6.86,48,7,4,3,11,0.5714285714285714
74,Chan Paul Chiu Hung,Tuen Mun Squash Club,5.5,33,6,0,6,11,0.0
75,Smith Robert,HKCC Tuesday Night Rockers,5.0,30,6,1,5,11,0.16666666666666666
76,Tong Foon Chi,Global Squash 2,4.5,27,6,1,5,11,0.16666666666666666
77,Au Shing Wai,Invader Squash,2.57,18,7,1,6,11,0.14285714285714285
78,Leung Yuk Chiu James,Global Squash 2,2.5,15,6,0,6,11,0.0
79,Kan Yu Hin,Global Squash 2,1.8,9,5,1,4,11,0.2
80,Lau Sui Ho,Tuen Mun Squash Club,0.6,3,5,0,5,11,0.0
,Fu Ivan Fuk Cheong,7NT,18.0,36,2,1,1,11,0.5
,Leung Kam Yau Hardy,The Squash Club 3,15.0,30,2,2,0,11,1.0
,Lee Maurice King Sun,BOSS,15.0,30,2,2,0,11,1.0
,Chung Shun Yeung,i-Mask Advance Squash Club 4,15.0,15,1,1,0,11,1.0
,Fung Bruce Wai Ho,BOSS,13.5,27,2,2,0,11,1.0
,Chau Kwok Hung,Sha Tin 5,13.5,27,2,1,1,11,0.5
,Wong Bao Kwong Chi,Star River 1,12.0,12,1,1,0,11,1.0
,Koeman Arthur,HKCC Tuesday Night Rockers,11.0,33,3,1,2,11,0.3333333333333333
,Tsoi Chi Chuen,Tuen Mun Squash Club,11.0,33,3,0,3,11,0.0
,Leong David Kam Ho,Kinetic 3,10.5,21,2,0,2,11,0.0
,Ip Simon Shing On,Tuen Mun Squash Club,9.0,18,2,0,2,11,0.0
,Brettell David,Invader Squash,7.5,15,2,1,1,11,0.5
,Ng Chi Ming,Global Squash 2,7.5,15,2,1,1,11,0.5
,Openshaw Michael,HKCC Tuesday Night Rockers,7.5,15,2,0,2,11,0.0
,Leung Hok Sum,The Squash Club 3,7.0,21,3,1,2,11,0.3333333333333333
,Ho Yuen Wang Samson,The Squash Club 3,7.0,21,3,1,2,11,0.3333333333333333
,Lee Vanessa Sze Wing,Global Squash 2,6.75,27,4,1,3,11,0.25
,Wong Ka Hei,7NT,6.75,27,4,1,3,11,0.25
,Yeung Samuel Albert,7NT,6.0,24,4,1,3,11,0.25
,Cao Yu,The Squash Club 3,6.0,6,1,0,1,11,0.0
,Tse Wai Hong,Kinetic 3,6.0,12,2,0,2,11,0.0
,Lai Tiffany Hoi Jun,Global Squash 2,4.5,18,4,0,4,11,0.0
,Wai Veronica Chi Man,Star River 1,3.0,3,1,0,1,11,0.0
,Chan Edward Cheuk Wah,Star River 1,3.0,3,1,0,1,11,0.0
,Wong King Yi Kimmy,7NT,3.0,9,3,0,3,11,0.0
,Cheung Ching San,i-Mask Advance Squash Club 4,3.0,3,1,0,1,11,0.0
,Matsuo Serina,Global Squash 2,3.0,3,1,0,1,11,0.0
,Yip Siu Hong,i-Mask Advance Squash Club 4,3.0,6,2,0,2,11,0.0
,Hughes Trevor,HKCC Tuesday Night Rockers,3.0,3,1,0,1,11,0.0
,Lui Danny Wai Kit,7NT,2.25,9,4,0,4,11,0.0
,Cheng Samantha Ho Yan,The Squash Club 3,1.5,3,2,0,2,11,0.0
,Cheung Fung Yee Ida,Global Squash 2,1.5,3,2,0,2,11,0.0
,Mok Ka Chun,i-Mask Advance Squash Club 4,1.0,3,3,0,3,11,0.0
,Ho Kwok Kei,Kinetic 3,0.0,0,1,0,1,11,0.0
,O'Neill Glenn,HKCC Tuesday Night Rockers,0.0,0,3,0,3,11,0.0
,Ngan Joan,The Squash Club 3,0.0,0,0,0,0,11,0.0
,Lee Chun Tak,Kinetic 3,0.0,0,0,0,0,11,0.0
,Chan Koon Yan Boris,7NT,0.0,0,0,0,0,11,0.0
