Team,Played,Won,Lost,Points,Playoffs,1,2,3,4,5,6
Hong Kong Football Club L1A,10,9.4762,0.5238,34.461,100.0,100.0,0.0,0.0,0.0,0.0,0.0
Kowloon Cricket Club L1B,10,6.5518,3.4482,25.7852,100.00000000000001,0.0,73.24000000000001,24.9,1.8599999999999999,0.0,0.0
Kowloon Cricket Club L1A,10,6.6579999999999995,3.342,24.1262,100.00000000000001,0.0,26.040000000000003,70.42,3.54,0.0,0.0
Jessica,10,4.7758,5.2242,20.3388,100.0,0.0,0.72,4.68,94.6,0.0,0.0
Hong Kong Cricket Club L1,10,2.4464,7.5536,11.2882,0.0,0.0,0.0,0.0,0.0,100.0,0.0
Hong Kong Football Club L1B,10,0.0918,9.9082,2.0006,0.0,0.0,0.0,0.0,0.0,0.0,100.0
