Team,Played,Won,Lost,Points,Playoffs,1,2,3,4,5,6
Hong Kong Football Club L1A,10,9.4738,0.5262,34.4758,100.0,100.0,0.0,0.0,0.0,0.0,0.0
Kowloon Cricket Club L1B,10,6.5328,3.4672,25.733,99.99999999999999,0.0,72.11999999999999,26.06,1.82,0.0,0.0
Kowloon Cricket Club L1A,10,6.657,3.343,24.1226,100.0,0.0,27.200000000000003,68.7,4.1000000000000005,0.0,0.0
Jessica,10,4.7968,5.2032,20.3816,100.0,0.0,0.6799999999999999,5.24,94.08,0.0,0.0
Hong Kong Cricket Club L1,10,2.4466,7.5534,11.291599999999999,0.0,0.0,0.0,0.0,0.0,100.0,0.0
Hong Kong Football Club L1B,10,0.093,9.907,1.9954,0.0,0.0,0.0,0.0,0.0,0.0,100.0
