Team,Played,Won,Lost,Points,Playoffs,1,2,3,4,5,6
Hong Kong Football Club L1A,10,9.8626,0.1374,36.158,100.0,100.0,0.0,0.0,0.0,0.0,0.0
Kowloon Cricket Club L1B,10,6.6556,3.3444,26.4686,100.0,0.0,66.67999999999999,33.32,0.0,0.0,0.0
Kowloon Cricket Club L1A,10,6.962,3.038,25.563200000000002,100.0,0.0,33.32,66.67999999999999,0.0,0.0,0.0
Jessica,10,4.3444,5.6556,18.5314,100.0,0.0,0.0,0.0,100.0,0.0,0.0
Hong Kong Cricket Club L1,10,2.1374,7.8626000000000005,9.842,0.0,0.0,0.0,0.0,0.0,100.0,0.0
Hong Kong Football Club L1B,10,0.038,9.962,1.4368,0.0,0.0,0.0,0.0,0.0,0.0,100.0
