Team,Played,Won,Lost,Points,Playoffs,1,2,3,4,5,6
Hong Kong Football Club L1A,10,9.4612,0.5388,34.4388,100.0,100.0,0.0,0.0,0.0,0.0,0.0
Kowloon Cricket Club L1B,10,6.5464,3.4536,25.7724,100.0,0.0,72.44,25.52,2.04,0.0,0.0
Kowloon Cricket Club L1A,10,6.6708,3.3292,24.1684,100.0,0.0,26.8,69.86,3.34,0.0,0.0
Jessica,10,4.7886,5.2114,20.3694,100.0,0.0,0.76,4.62,94.62,0.0,0.0
Hong Kong Cricket Club L1,10,2.4398,7.5602,11.2668,0.0,0.0,0.0,0.0,0.0,100.0,0.0
Hong Kong Football Club L1B,10,0.0932,9.9068,1.9842,0.0,0.0,0.0,0.0,0.0,0.0,100.0
