Team,Played,Won,Lost,Points,Playoffs,1,2,3,4,5,6
Hong Kong Football Club L2A,20,17.526600000000002,2.4734,78.50540000000001,100.0,75.26,24.740000000000002,0.0,0.0,0.0,0.0
Kowloon Cricket Club L2,20,15.4604,4.5396,75.7872,100.0,24.740000000000002,75.26,0.0,0.0,0.0,0.0
Hong Kong Cricket Club L2A,20,10.5922,9.4078,54.5284,100.0,0.0,0.0,100.0,0.0,0.0,0.0
Hong Kong Football Club L2C,20,8.3512,11.6488,37.752,97.26,0.0,0.0,0.0,97.26,2.74,0.0
Hong Kong Football Club L2B,20,4.0638000000000005,15.9362,29.3226,2.74,0.0,0.0,0.0,2.74,92.94,4.32
Hong Kong Cricket Club L2B,20,4.0058,15.9942,21.1044,0.0,0.0,0.0,0.0,0.0,4.32,95.67999999999999
