Team,Played,Won,Lost,Points,Playoffs,1,2,3,4,5,6
Hong Kong Football Club L2A,20,17.5512,2.4488000000000003,78.5648,100.0,65.16,34.839999999999996,0.0,0.0,0.0,0.0
Kowloon Cricket Club L2,20,15.728200000000001,4.2718,77.2668,100.0,34.839999999999996,65.16,0.0,0.0,0.0,0.0
Hong Kong Cricket Club L2A,20,10.6092,9.3908,54.5966,100.0,0.0,0.0,100.0,0.0,0.0,0.0
Hong Kong Football Club L2C,20,8.354800000000001,11.645199999999999,37.7572,98.83999999999999,0.0,0.0,0.0,98.83999999999999,1.1400000000000001,0.02
Hong Kong Football Club L2B,20,3.7252,16.2748,27.597,1.1400000000000001,0.0,0.0,0.0,1.1400000000000001,89.58,9.28
Hong Kong Cricket Club L2B,20,4.0314,15.9686,21.2176,0.02,0.0,0.0,0.0,0.02,9.28,90.7
