Team,Played,Won,Lost,Points,Playoffs,1,2,3,4,5
Hong Kong Football Club M1B,16,13.55,2.45,57.934799999999996,100.0,71.2,28.78,0.02,0.0,0.0
Hong Kong Football Club M1A,16,11.762,4.2379999999999995,55.6814,100.0,28.799999999999997,71.14,0.06,0.0,0.0
Ladies Recreation Club M1,16,8.2396,7.760400000000001,42.7268,100.0,0.0,0.08,99.92,0.0,0.0
Hong Kong Cricket Club M1A,16,3.6444,12.355599999999999,23.5026,80.22,0.0,0.0,0.0,80.22,19.78
Hong Kong Cricket Club M1B,16,2.8040000000000003,13.196,20.1544,19.78,0.0,0.0,0.0,19.78,80.22
