Team,Played,Won,Lost,Points,Playoffs,1,2,3,4,5
Hong Kong Football Club M1B,16,14.2974,1.7026,59.2022,100.0,97.18,2.82,0.0,0.0,0.0
Hong Kong Football Club M1A,16,11.224,4.776,54.06,100.0,2.82,97.06,0.12,0.0,0.0
Ladies Recreation Club M1,16,7.899,8.100999999999999,42.693,100.0,0.0,0.12,99.88,0.0,0.0
Hong Kong Cricket Club M1A,16,2.9994,13.0006,22.981,68.52000000000001,0.0,0.0,0.0,68.52000000000001,31.480000000000004
Hong Kong Cricket Club M1B,16,3.5802,12.4198,21.0638,31.480000000000004,0.0,0.0,0.0,31.480000000000004,68.52000000000001
