Team,Most Games,Most Wins,Highest Win Percentage
8 Virtues + 1,Chen Alexander Kelin (11),"Chen Alexander Kelin, Cai Yuxi (8)",Cai Yuxi (80.0%)
Electrify Squash Div 14,Law Wing Kin (13),Law Wing Kin (8),"Yuen Kenneth Ka Fai, Sat Wai Yin (80.0%)"
Hong Kong Football Club 14A,Le Aaron Quang (13),Le Aaron Quang (10),Le Aaron Quang (76.9%)
Hong Kong Football Club 14B,Ikeda-Thew Bennett Masa (14),"Sachdeva Anant, Ikeda-Thew Bennett Masa (11)",Sachdeva Anant (91.7%)
Kowloon Cricket Club 14,Wong Yin Chi Aurelius (13),Wong Yin Chi Aurelius (11),Ebrahim Adnan Azhar (85.7%)
Ladies Recreation Club Div 14,Chen Peak Julian (15),"Choe Yeda, Lien Brandon (12)","Choe Yeda, Adjemian Antoine (100.0%)"
North District Sports Association 3,"Fung Yau On, Wong Chi Kit (14)","Fung Yau On, Wong Chi Kit (10)",Leung Wai Ki (72.7%)
X-Alpha 6,Wong Ting Ho (12),"Ma Tsz Wun, Wong Ting Ho (4)",Ma Tsz Wun (44.4%)
