Team,Most Games,Most Wins,Highest Win Percentage
Hong Kong Cricket Club M2A,Grewal Harpreet (13),"Caveney Barry John, Denham Paul (6)",Buckland Paul Edwin Kim (60.0%)
Hong Kong Cricket Club M2B,Janes Gareth (13),Janes Gareth (10),Janes Gareth (76.9%)
Hong Kong Football Club M2A,Pun Teddy (14),Pun Teddy (12),"Ho Simon Man Kai, Wei Stephen J. (87.5%)"
Hong Kong Football Club M2B,Gates Stuart (15),Gates Stuart (10),Derouet Yann (90.0%)
Ladies Recreation Club M2A,Amjad Nauman (15),Soo Euan Tsung Liang (12),Soo Euan Tsung Liang (100.0%)
Ladies Recreation Club M2B,Swan Owen (14),Swan Owen (5),Joel Neoh Eu Jin (44.4%)
