Team Name,Home,Average Home Score,Average Away Score,home_away_diff
Sha Tin 3,Cornwall Street Squash Centre,4.333333333333333,0.0,4.333333333333333
i-Mask Advance Squash Club 2,Cornwall Street Squash Centre,2.0,0.0,2.0
Kinetic 2,Yuen Long Jockey Club Squash Courts,1.5,0.5,1.0
Striving Squash,Kwun Chung Sports Centre,2.0,1.3333333333333333,0.6666666666666667
Squashathon Zero,Cornwall Street Squash Centre,2.0,2.0,0.0
Hong Kong Football Club 8,Hong Kong Football Club,3.6666666666666665,4.0,-0.3333333333333335
Ladies Recreation Club Div 8,Ladies Recreation Club,3.0,4.0,-1.0
TOMCAT,Cornwall Street Squash Centre,0.0,2.0,-2.0
Physical Chess 3,Cornwall Street Squash Centre,0.0,3.0,-3.0
