Team,Rubber 1 Win %,Rubber 2 Win %,Rubber 3 Win %,Rubber 4 Win %,Rubber 5 Win %,avg_win_perc
Hong Kong Football Club L2C,3.3333333333333357,20.0,16.66666666666667,-6.666666666666671,100.0,26.666666666666664
JESSICA L2,11.111111111111114,11.1111111111111,15.277777777777786,4.166666666666671,0.0,8.333333333333336
Kowloon Cricket Club L2,-14.444444444444443,-11.111111111111114,50.0,9.722222222222214,0.0,6.833333333333329
Hong Kong Football Club L2B,-10.0,6.666666666666657,6.666666666666657,3.333333333333343,0.0,1.3333333333333286
Hong Kong Football Club L2A,10.0,-25.0,25.0,-10.0,0.0,0.0
Hong Kong Cricket Club L2,1.1111111111111107,-17.77777777777778,1.1111111111111107,-5.714285714285715,0.0,-4.253968253968255
