Team,Rubber 1 Win %,Rubber 2 Win %,Rubber 3 Win %,Rubber 4 Win %,Rubber 5 Win %,avg_win_perc,Total Rubbers
Kowloon Cricket Club L2,60.0,90.0,90.0,88.88888888888889,0.0,65.77777777777779,39
JESSICA L2,100.0,66.66666666666666,77.77777777777779,37.5,0.0,56.38888888888889,36
Hong Kong Football Club L2B,50.0,66.66666666666666,66.66666666666666,83.33333333333334,0.0,53.33333333333333,24
Hong Kong Football Club L2C,16.666666666666664,33.33333333333333,50.0,33.33333333333333,100.0,46.666666666666664,20
Hong Kong Football Club L2A,50.0,0.0,50.0,40.0,0.0,28.0,23
Hong Kong Cricket Club L2,10.0,20.0,10.0,12.5,0.0,10.5,38
