Team,Most Games,Most Wins,Highest Win Percentage
Honey Badger 2,"Higgins Martin, Van Dommele Brock (11)",Higgins Martin (7),Higgins Martin (63.6%)
Island Squash Racket Club - United 2,Amsellem Oren (17),"Derouet Yann, Heritage Jonathan Paul (10)",Derouet Yann (90.9%)
KTSC,To Shing Yuk (21),To Shing Yuk (17),To Shing Yuk (81.0%)
Kinetic 4,Wong Wilson Wai Shing (19),"Chau Hang Henry, Wong Wilson Wai Shing, Lee Henry Kwok Chung (5)","Chau Hang Henry, Lee Henry Kwok Chung (45.5%)"
Kwai Tsing District Squash Club 1,Chan Ying Lun (18),Chan Hei Wai Henry (12),Chan Hei Wai Henry (70.6%)
United Services Recreation Club 3,Lai Kwok Wai Wilfred (19),Lai Kwok Wai Wilfred (17),Miu Peter Wah Ching (100.0%)
Visions,Leung Yuk Chiu James (21),Tang Matthew Yu To (6),Tang Matthew Yu To (40.0%)
i-Mask Advance Squash Club 9,"Ip Chun Keung, Chu Raymond Wai Man, Ching Tsz Pan (21)",Ip Chun Keung (20),Ip Chun Keung (95.2%)
