Team,Most Games,Most Wins,Highest Win Percentage
Diocesan,"Woo Jonathan Kin-Heng, Woo Nicholas Cheuk-Heng (13)",Fung Long Yiu (2),Fung Long Yiu (40.0%)
Hong Kong Football Club 19,Fordham Henry (16),Fordham Henry (12),Kerr Lewis Gordon (100.0%)
KYS 2,Siu Ho Ying (17),Fung Leong Hoi (11),Fung Leong Hoi (84.6%)
Smart Squash 6,Li Tsz Chung (20),Lee Chok Kan (12),Hui Fu Wing Edwin (85.7%)
Spark 5,Cheng August Huan-Chen (14),Ho Ho Fai Alfred (6),Ho Ho Fai Alfred (46.2%)
The Zero Squash Club D19,Chan Sui Ting (14),"Tse Tin Po, Chan Sui Ting (13)","Tse Tin Po, Chung Pui Lam (100.0%)"
United Services Recreation Club 4,Yuen Tsz Long (16),Tang Nga Man (13),Ko Hei Shun (92.3%)
i-Mask Advance Squash Club 15,Ko Nathan (21),Ko Nathan (17),Hon Wai Lam (88.9%)
