Team,Most Games,Most Wins,Highest Win Percentage
A Squash,Seung Wai Ching (19),Seung Wai Ching (7),Ho Chun Fai (40.0%)
Friend Club 1,Tang Chun Long (21),Tang Chun Long (10),Tang Chun Long (47.6%)
Hong Kong Football Club 3A,Wong Arthur Man Pok (19),Lau King Yat (13),Lau King Yat (92.9%)
Hong Kong Football Club 3B,Chan Shui Lun Wilson (20),Wong Anson (12),Wong Anson (85.7%)
Perrier Sergio Tacchini KCC 3,Wan Tsz Ho (21),"Lau Hok Yin Anthony, Wan Tsz Ho (17)",Lau Hok Yin Anthony (85.0%)
USRC - FWD 1,Wong Joe Wai Chung (19),Wong Joe Wai Chung (19),Wong Joe Wai Chung (100.0%)
Young Player 3,Tang Ethan Pui Lok (18),"Lam Matthew Shing Fung, Tse Jat (11)",Tse Jat (91.7%)
i-Mask Advance Squash Club 1,"Ho Ka On, Yip Tsz Ho, Murakami Akifumi (17)",Yip Tsz Ho (8),Yip Tsz Ho (47.1%)
