Team,Most Games,Most Wins,Highest Win Percentage
Hong Kong Cricket Club Rockettes,Kwok Alvina (17),Kwok Alvina (15),Kwok Alvina (88.2%)
Hong Kong Football Club L3A,MacNamara Jade (14),MacNamara Jade (7),MacNamara Jade (50.0%)
Hong Kong Football Club L3B,Millar Nicole (15),Wong Javy Ki Ling (10),Wong Javy Ki Ling (71.4%)
Hong Kong Football Club L3C,Wong Shuk Ting Ruby (15),Leong Ai Lin (9),Leong Ai Lin (81.8%)
Perrier Ladies,Hazell Ashley (13),Hazell Ashley (10),"Leung Wai Kwan, Tse Kathleen Sarah (100.0%)"
Polladies,Chan Odyn Siu Ha (15),Chan Koon Ki (13),Chan Koon Ki (100.0%)
