Team Name,Home,Convenor,Email
Energetic,Cornwall Street Squash Centre,Shiu Moon * Leung,moonmoon2416@hotmail.com
Friend Club 2,Cornwall Street Squash Centre,Sherlock Rafael Ko,sherlockko93@gmail.com
Hong Kong Football Club 5,Hong Kong Football Club,Alexandre Barmont,abarmont@hotmail.com
Perrier Sergio Tacchini KCC 5,Kowloon Cricket Club,Chun Keung Tse,cktse@sjc.edu.hk
Sha Tin Squash Rackets Club 1,Cornwall Street Squash Centre,Gi Ping Yim,mariokingyim@gmail.com
YLJR 1,Yuen Long Jockey Club Squash Courts,Siu Nam Lau,oscarlauhk@hotmail.com
