Team Name,Home,Convenor,Email
Hong Kong Cricket Club L1,Hong Kong Cricket Club,Sze Wing Wai,phssquash@yahoo.com.hk
Hong Kong Football Club L1A,Hong Kong Football Club,Ka Man Carmen Lee,carmenlee@blade.com.hk
Hong Kong Football Club L1B,Hong Kong Football Club,Valerie Kaitlyn Huang,bebehung@gmail.com
Perrier Sergio Tacchini KCC L1A,Kowloon Cricket Club,Ka Po Ho,hokapo1027@yahoo.com.hk
Perrier Sergio Tacchini KCC L1B,Kowloon Cricket Club,Jannis Wing Hei Lam,jannislamwh@gmail.com
Young Player L1,HK Squash Centre,Rebecca Wing Yin Chiu,rebeccac@hksi.org.hk
