Team,Rubber 1 Win %,Rubber 2 Win %,Rubber 3 Win %,Rubber 4 Win %,Rubber 5 Win %,avg_win_perc,Total Rubbers
Hong Kong Football Club M2A,70.0,50.0,60.0,70.0,90.0,68.0,50
Hong Kong Cricket Club M2,81.81818181818183,63.63636363636363,63.63636363636363,72.72727272727273,44.44444444444444,65.25252525252526,53
Hong Kong Football Club M2B,54.54545454545454,27.27272727272727,36.36363636363637,63.63636363636363,54.54545454545454,47.272727272727266,55
Ladies Recreation Club M2,30.0,80.0,70.0,20.0,30.0,46.0,50
United Services Recreation Club M2,10.0,30.0,20.0,20.0,25.0,21.0,48
