Team Name,Home,Average Home Score,Average Away Score,home_away_diff
JESSICA Mochis,HK Squash Centre,3.0,0.0,3.0
Squashathon Ladies,Cornwall Street Squash Centre,3.0,0.0,3.0
Kwai Tsing District Squash Club L4,Yeung Uk Road Sports Centre,2.0,1.0,1.0
Hong Kong Football Club L4,Hong Kong Football Club,1.0,1.0,0.0
JESSICA L4,HK Squash Centre,3.0,4.0,-1.0
Hong Kong Football Club JSA,Hong Kong Football Club,0.0,1.0,-1.0
Hong Kong Cricket Club Rockettes,Hong Kong Cricket Club,0.0,2.0,-2.0
Hong Kong Cricket Club L4,Hong Kong Cricket Club,0.0,3.0,-3.0
