Team,Rubber 1 Win %,Rubber 2 Win %,Rubber 3 Win %,Rubber 4 Win %,avg_win_perc,Total Rubbers
Kowloon Cricket Club L2,50.0,100.0,50.0,80.0,70.0,23
JESSICA L2,75.0,75.0,75.0,50.0,68.75,16
Hong Kong Football Club L2B,33.33333333333333,66.66666666666666,66.66666666666666,100.0,66.66666666666666,12
Hong Kong Football Club L2A,50.0,0.0,0.0,100.0,37.5,7
Hong Kong Cricket Club L2,16.666666666666664,50.0,16.666666666666664,33.33333333333333,29.16666666666666,24
Hong Kong Football Club L2C,0.0,0.0,0.0,50.0,12.5,11
