Team Name,Home,Average Home Score,Average Away Score,home_away_diff
Hong Kong Football Club L2C,Hong Kong Football Club,1.0,0.3333333333333333,0.6666666666666667
Hong Kong Football Club L2A,Hong Kong Football Club,1.3333333333333333,1.0,0.33333333333333326
JESSICA L2,HK Squash Centre,3.0,2.75,0.25
Kowloon Cricket Club L2,Kowloon Cricket Club,3.0,2.8333333333333335,0.16666666666666652
Hong Kong Football Club L2B,Hong Kong Football Club,2.6666666666666665,3.0,-0.3333333333333335
Hong Kong Cricket Club L2,Hong Kong Cricket Club,0.75,1.1666666666666667,-0.41666666666666674
