Team,Most Games,Most Wins,Highest Win Percentage
8 Virtues + 1,Chen Alexander Kelin (9),Chen Alexander Kelin (7),Zheng Fiona Zixuan (83.3%)
Electrify Squash Div 14,Law Wing Kin (9),Law Wing Kin (6),Yuen Kenneth Ka Fai (80.0%)
Hong Kong Football Club 14A,Le Aaron Quang (10),Le Aaron Quang (9),Le Aaron Quang (90.0%)
Hong Kong Football Club 14B,Ikeda-Thew Bennett Masa (11),"Sachdeva Anant, Ikeda-Thew Bennett Masa (8)",Sachdeva Anant (88.9%)
Kowloon Cricket Club 14,Wong Yin Chi Aurelius (12),Wong Yin Chi Aurelius (10),Ebrahim Adnan Azhar (100.0%)
Ladies Recreation Club Div 14,Chen Peak Julian (12),Lien Brandon (10),"Choe Yeda, Adjemian Antoine (100.0%)"
North District Sports Association 3,"Fung Yau On, Wong Chi Kit (11)","Fung Yau On, Wong Chi Kit (7)",Leung Wai Ki (75.0%)
X-Alpha 6,Wong Ting Ho (11),"Ma Tsz Wun, Wong Ting Ho (4)",Ma Tsz Wun (44.4%)
