Home Team,Away Team,Venue,Match Week,Date
Hong Kong Football Club JSA,Hong Kong Football Club L4,Hong Kong Football Club,1,2025-10-03
Hong Kong Cricket Club L4,Hong Kong Cricket Club Rockettes,Hong Kong Cricket Club,1,2025-10-03
JESSICA L4,JESSICA Mochis,HK Squash Centre,1,2025-10-03
Squashathon Ladies,The Squash Club L4,Cornwall Street Squash Centre,6,2025-11-07
Hong Kong Football Club L4,Hong Kong Football Club JSA,Hong Kong Football Club,10,2025-12-12
Hong Kong Cricket Club Rockettes,Hong Kong Cricket Club L4,Hong Kong Cricket Club,10,2025-12-12
JESSICA Mochis,JESSICA L4,HK Squash Centre,10,2025-12-12
The Squash Club L4,Squashathon Ladies,Cornwall Street Squash Centre,15,2026-01-30
Hong Kong Cricket Club L4,JESSICA Mochis,HK Squash Centre,18,2026-03-06
