Team,Rubber 1 Win %,Rubber 2 Win %,Rubber 3 Win %,Rubber 4 Win %,avg_win_perc,Total Rubbers
Hong Kong Football Club M2A,83.33333333333334,33.33333333333333,80.0,100.0,74.16666666666667,21
Hong Kong Football Club M2B,44.44444444444444,77.77777777777779,75.0,80.0,69.30555555555556,31
Hong Kong Cricket Club M2B,37.5,75.0,42.857142857142854,50.0,51.339285714285715,27
Ladies Recreation Club M2A,75.0,25.0,14.285714285714285,40.0,38.57142857142857,28
Hong Kong Cricket Club M2A,0.0,50.0,75.0,16.666666666666664,35.416666666666664,30
Ladies Recreation Club M2B,12.5,37.5,0.0,25.0,18.75,26
