Home Team,Away Team,Venue,Match Week,Date
Royal Hong Kong Yacht Club M3,Hong Kong Football Club M3B,Royal Hong Kong Yacht Club,20,2026-03-19
Hong Kong Cricket Club M3,Kowloon Cricket Club M3,Hong Kong Cricket Club,20,2026-03-19
Hong Kong Football Club M3A,OSF,Hong Kong Football Club,20,2026-03-19
Kowloon Cricket Club M3,Hong Kong Football Club M3A,Kowloon Cricket Club,21,2026-03-26
Hong Kong Football Club M3B,Hong Kong Cricket Club M3,Hong Kong Football Club,21,2026-03-26
Titlows Squash Master,Royal Hong Kong Yacht Club M3,Masters - Harbour Road Sports Centre,21,2026-03-26
